,sent
132,"It is highly desirable to find an approach for rapidly developing potent therapeutics against MERS-CoV, which not only can be implemented for MERS treatment but also can help to develop a platform strategy to combat future emerging coronaviruses."
133,This work could be extended further to enable medical practitioners in automatically identifying and characterizing SARS coronavirus strain in a fast and efficient fashion using short and/or incomplete segments of nucleotide sequences.
134,Methods: The 2019 novel coronavirus proteome was aligned to a curated database of viral immunogenic peptides.
135,"Using ELISA, we demonstrated that 12 of 12 herds in Saskatchewan, and 109 of 110 animals tested, and antibody to bovine coronavirus."
136,"Diagnostics play a central role in the early detection and control of outbreaks and can enable a more nuanced understanding of the disease kinetics and risk factors for the Middle East respiratory syndrome-coronavirus (MERS-CoV), one of the high-priority pathogens identified by the WHO."
137,"This review will focus on several of these newly identified pathogens for which there are clinical data implicating a role of these viruses in respiratory tract disease specifically, human metapneumovirus, human coronaviruses NL63 and HKU1, and the human bocavirus."
138,"One world, one health: The novel coronavirus COVID-19 epidemic"
139,The results are consistent with coronavirus transcription models in which the transcription from upstream TRSs is attenuated by downstream TRSs.
140,"Public health measures have successfully identified and contained outbreaks of the severe acute respiratory syndrome (SARS) coronavirus (SARS-CoV)(1,2,3,4,5), but concerns remain over the possibility of future recurrences."
141,Severe acute respiratory syndrome (SARS) is an infectious disease caused by a novel coronavirus that cost nearly 800 lives.
142,Wuhan Novel Coronavirus disease (COVID-19) outbreak has become a global outbreak which has raised the concern of scientific community to design and discover a definitive cure against this deadly virus which has caused deaths of numerous infected people upon infection and spreading.
143,"Middle East respiratory syndrome coronavirus (MERS-CoV) still causes outbreaks despite public awareness and implementation of health care measures, such as rapid viral diagnosis and patient quarantine."
144,"This article reviews the clinical syndromes associated with bovine coronavirus, including pneumonia in calves and adult cattle, calf diarrhea, and winter dysentery; diagnostic methods; prevention using vaccination; and treatment, with adjunctive immunotherapy."
145,"All 15 strains of IBV tested as well as two Turkey coronavirus strains were amplified, whereas none of the other pathogens examined, tested positive."
146,Bovine coronavirus (BCoV) is antigenically related to ECoV; it is therefore possible that BCoV vaccine will induce antibodies against ECoV in horses.
147,"MERS-CoV and Pipistrellus bat coronavirus (BtCoV) strain HKU5 of Betacoronavirus (β-CoV) subgroup 2c share >65% identity at the amino acid level in several regions, including nonstructural protein 5 (nsp5) and the nucleocapsid (N) protein, which are significant drug and vaccine targets."
148,"The disease was caused by an unknown animal coronavirus (CoV) that had crossed the species barrier through close contact of humans with infected animals, and was identified as the etiological agent for SARS."
149,"Health care personnel are commonly exposed to infectious agents via sharp injuries (eg, human immunodeficiency virus, hepatitis B virus, and hepatitis C virus), direct patient care (eg, pertussis and meningococcus), and the contaminated environment (eg, Clostridium difficile)."
150,This disease had never been observed in man before; the SARS-Coronavirus causing the disease was unknown.
151,We aimed to determine the Middle East respiratory syndrome coronavirus (MERS-CoV) nasal carriage rate among pilgrims performing the 2013 Hajj and to describe the compliance with the Saudi Ministry of Health vaccine recommendations.
152,"Among the recently emerged respiratory pathogens are influenza viruses, coronaviruses, enteroviruses, and adenoviruses."
153,"Utilizing the SARS-CoV infectious clone, we generated and characterized a chimeric virus expressing the spike of bat coronavirus SHC014 in a mouse adapted SARS-CoV backbone."
154, The Middle East respiratory syndrome coronavirus (MERS-CoV) has infected over 1600 individuals with nearly 600 deaths since it was first identified in human populations in 2012.
155,"Previously, we reported the 5 L scale expression and purification of a promising recombinant SARS vaccine candidate, RBD219-N1, the 218–amino acid residue receptor-binding domain (RBD) of SARS coronavirus expressed in yeast–Pichia pastoris X-33."
156,Cats are susceptible to natural infection with several strains of feline coronavirus that result in either effusive and noneffusive feline infectious peritonitis or enteritis.
157,"Novel Coronavirus (2019-nCoV) is an emerging pathogen that was first identified in Wuhan, China in late December 2019."
158," The Middle East respiratory syndrome coronavirus (MERS-CoV), is an emerging pathogen that continues to cause outbreaks in the Arabian peninsula and in travelers from this region, raising the concern that a global pandemic could occur."
159,"4567042 Inactivated canine coronavirus vaccine William M Acree, Bobby Edwards, John W Black assigned to American Home Products Corporation"
160,"Using this resource, we showed that genetic variations in SARS-CoV-2, though still few for the moment, already follow the pattern of mutations in related coronaviruses, and could alter the immune vulnerability landscape of this virus."
161,"Among these 13 patients, 11 (92 %) presented a confirmed influenza (A/H3N2) and two had another respiratory virus: one human metapneumovirus and one human coronavirus."
162,2019-nCoV is a novel form of coronavirus that causes COVID-19 and has high similarity with SARS-CoV.
163," The Middle East respiratory syndrome coronavirus (MERS-CoV) has infected more than 1900 humans, since 2012."
164,"Through a cross-sectional community-based nasal self-swabbing study we sought to determine carriage epidemiology for respiratory pathogens amongst bacteria (Streptococcus pneumoniae, Haemophilus influenza, Moraxella catarrhalis, Staphylococcus aureus, Pseudomonas aeruginosa and Neisseria meningitidis) and viruses (RSV, Influenza viruses A and B, Rhinovirus/Enterovirus, Coronavirus, Parainfluenza viruses 1-3 and Adenovirus (ADV))."
165,: The recently emerged 2019 Novel Coronavirus (SARS-CoV-2) and associated COVID-19 disease cause serious or even fatal respiratory tract infection and yet no approved therapeutics or effective treatment is currently available to effectively combat the outbreak.
166,Severe acute respiratory syndrome (SARS) was caused by a previously unrecognized animal coronavirus that exploited opportunities provided by 'wet markets' in southern China to adapt to become a virus readily transmissible between humans.
167,"Unfortunately, there is limited experience with coronavirus infections during pregnancy, and it now appears certain that pregnant women have become infected during the present 2019-nCoV epidemic."
168,"Here we identify a metallopeptidase, angiotensin-converting enzyme 2 (ACE2)(3,4), isolated from SARS coronavirus (SARS-CoV)-permissive Vero E6 cells, that efficiently binds the S1 domain of the SARS-CoV S protein."
169,"At 125 nm, it is slightly larger than influenza, SARS and MERS viruses."
170,"The Corona Virus Disease 2019 (COVID-19) outbroke in Wuhan, China in December 2019 and the severe acute respiratory syndrome (SARS) outbroke in Guangzhou, China in 2003 were caused by highly pathogenic coronaviruses with high homology."
171," Coronaviruses (CoVs) are enveloped, positive-strand RNA viruses with characteristic spike glycoproteins that project outward like the rays of the sun (corona – Latin for ‘crown’), when visualized by electron microscopy."
172,“The Art of War” in the Era of Coronavirus Disease 2019 (COVID-19)
173,"Thus, an efficient vaccination strategy is required to prevent the further spread of the infection."
174,"These include viral S protein targeting; inhibitors of host proteases, including TMPRSS2, cathepsin L and furin protease, and of viral M(pro) and the PL(pro) proteases; convalescent plasma; and vaccine candidates."
175,This finding will be of potential use in future monitoring of SL-CoV infection in bats and spillover animals and in development of more effective vaccine to cover broad protection against this new group of coronaviruses.
176,"On the other hand, the TLR agonist&#8208;adjuvanted vaccine induced highly protective antibodies without eosinophilic infiltrations, as well as Th1/17 cytokine responses."
177,"Intestinal content samples were collected from 101 broiler flocks from several regions of Jordan to detect the presence of astrovirus, coronavirus, reovirus, and rotavirus, by using reverse transcriptase polymerase chain reaction (RT-PCR)."
178,"Thus, delta inulin adjuvants may offer a unique ability to develop safer and more effective coronavirus vaccines."
179," A trasmissible gastroenteritis (TGE) coronavirus mutant (188-SG), selected as attenuated and resistant to acidity and proteases of the digestive tract of adult pigs, was used as vaccine (“Nouzilly strain”) in sows to protect suckling piglets against a challenge exposure carried out with a higly virulent TGEV strain."
180,The impact of the drastic reduction in travel volume within mainland China in January and February 2020 was quantified with respect to reports of novel coronavirus (COVID-19) infections outside China.
181, The spike (S) protein of the severe acute respiratory syndrome coronavirus (SARS-CoV) is responsible for host cell attachment and fusion of the viral and host cell membranes.
182,"The Network has proven its excellence throughout these 65 years, providing detailed information on circulating seasonal influenza viruses, as well as immediate response to the influenza pandemics in 1957, 1968, and 2009, and to threats caused by animal influenza viruses and by zoonotic transmission of coronaviruses."
183,"With an ongoing threat posed by circulating zoonotic strains, new strategies are required to prepare for the next emergent coronavirus (CoV)."
184,"Since then, we have witnessed the emergence of several other viral respiratory pathogens including influenza viruses (avian influenza H5N1, H7N9, and H10N8; variant influenza A H3N2 virus), human adenovirus-14, and Middle East respiratory syndrome coronavirus (MERS-CoV)."
185,"The spike (S) glycoprotein of the avian gammacoronavirus infectious bronchitis virus (IBV) is comprised of two subunits (S1 and S2), has a role in virulence in vivo, and is responsible for cellular tropism in vitro."
186,"It is timely to systematically review the potential of these interventions, including those for Middle East respiratory syndrome-Coronavirus (MERS-CoV) and severe acute respiratory syndrome (SARS)-CoV, to guide policymakers globally on their prioritization of resources for research and development."
187,"As in other coronaviruses, nucleocapsid (N) is one of the most crucial structural components of the SARS-CoV."
188,"Thus, the establishment of BP-caKII and the identified mutations in this study may provide insight into the genetic background of embryo and cold adaptations, and the attenuation of coronaviruses."
189,"To construct a recombinant plasmid Pet23a-M, the gene encoding severe acute respiratory syndrome (SARS) coronavirus membrane protein was amplified by RT-PCR and cloned into the expression plasmid Pet23a."
190,"Such vaccines present major challenges: coronavirus immunity often wanes rapidly, individuals needing to be protected include the elderly, and vaccines may exacerbate rather than prevent coronavirus lung immunopathology."
191,"The correlation of NAb titers with age, lymphocyte counts, and blood CRP levels suggested that the interplay between virus and host immune response in coronavirus infections should be further explored for the development of effective vaccine against SARS-CoV-2 virus."
192,"Coronaviruses (CoVs) encode a mixture of highly conserved and novel genes, as well as genetic elements necessary for infection and pathogenesis, raising the possibility of common targets for attenuation and therapeutic design."
193," To limit the spread of Middle East respiratory syndrome coronavirus (MERS-CoV) in Saudi Arabia, the Ministry of Health tried to raise public awareness using different public campaigns."
194,"Here, we have conducted an online search for all treatment options related to coronavirus infections as well as some RNA virus infection and we have found that general treatments, coronavirus-specific treatments, and antiviral treatments should be useful in fighting COVID-19."
195,The scientific interest on coronaviruses increased after the emergence of Severe Acute Respiratory Syndrome coronavirus (SARS-CoV) outbreaks in 2002-2003 followed by Middle East Respiratory Syndrome CoV (MERS-CoV).
196,Recombination in the family Coronaviridae has been well documented and is thought to be a contributing factor in the emergence and evolution of different coronaviral genotypes as well as different species of coronavirus.
197," Newly emerging viruses such as the Ebola virus, severe acute respiratory syndrome (SARS)-, Middle East respiratory syndrome (MERS)-coronavirus, and the avian influenza virus are serious threats to public health and have become a global concern."
198,"Coronaviruses are enveloped, single-stranded RNA viruses that are distributed worldwide."
199,This article examines methods currently used to enhance the titre and duration of specific antibody in the mammary secretions of cows and pigs with particular reference to rotavirus and coronavirus infections.
200,"Coupled with increased safety and reduced pathogenesis, the study highlights the potential for NSP16 attenuation as a major component of future live-attenuated coronavirus vaccines."
201,"Further investigation revealed these cases to result from infection with a newly identified coronavirus, termed the 2019-nCoV."
202,"Porcine epidemic diarrhea virus (PEDV), an Alphacoronavirus in the family Coronaviridae, causes acute diarrhea, vomiting, dehydration, and high mortality rates in neonatal piglets."
203," The coronavirus avian Infectious bronchitis virus (IBV) poses economic threats to poultry farms worldwide, affecting the performance of both meat-type and egg-laying birds."
204,"Middle East Respiratory Syndrome (MERS) is a highly lethal pulmonary infection caused by a previously unidentified coronavirus (CoV), likely transmitted to humans by infected camels."
205, Murine antisera with neutralising activity for the coronavirus causative of Middle East respiratory syndrome (MERS) were induced by immunisation of Balb/c mice with the receptor binding domain (RBD) of the viral Spike protein.
206,"269 swabs were obtained, 87 were positive for virus: influenza (24%), RSV (14%), coronavirus (32%), rhinovirus (17%), human metapneumovirus (9%) and parainfluenza (5%)."
207,We evaluated the humoral immune response and pathological end points in ferrets challenged with the Urbani strain of SARS-associated coronavirus (SARS-CoV) after having received formalin-inactivated whole-virus vaccine or mock vaccine.
208,"The construction of cDNA clones encoding large-size RNA molecules of biological interest, like coronavirus genomes, which are among the largest mature RNA molecules known to biology, has been hampered by the instability of those cDNAs in bacteria."
209, The spike (S) protein of severe acute respiratory syndrome coronavirus (SARS-CoV) is important for vaccine development.
210, A one-tube reverse transcription-polymerase chain reaction (RT-PCR) for absolute feline coronavirus (FCoV) quantitation was developed.
211,: Coronaviruses are the diverse group of RNA virus.
212," The spike (S) protein of severe acute respiratory syndrome-associated coronavirus (SARS-CoV) is not only responsible for receptor binding, but also a major antigenic determinant capable of inducing protective immunity."
213,"Individual infection was noted with astrovirus, coronavirus and rotavirus but not with reovirus, whereas all flocks infected with reovirus were also infected with coronavirus."
214,Porcine epidemic diarrhea virus is an alphacoronavirus responsible for significant morbidity and mortality in pigs.
215,CLINICAL SIGNIFICANCE: Canine coronavirus should be considered as a clinically relevant cause of infectious respiratory disease in crowded dog populations.
216, The safety and the efficacy of a modified-live (ML) canine coronavirus (CCoV) vaccine strain 257/98-3c was evaluated in 14 dogs seronegative and virus negative for CCoV.
217,"Influenza, coronavirus or rhinovirus were detected in three participants; all in the placebo group."
218,"This highlights the role of coronaviruses, respiratory syncytial virus, and unidentified agents in the elderly, and questions the assumptions made in American estimates on the impact of influenza and the value of influenza vaccines."
219,Similar approaches would be also applicable to other human and animal coronaviruses.
220,"Here, we report the cryo-electron microscopy structure of the PEDV S protein in the prefusion conformation at a resolution of 3.1 Å."
221,"Significant progress has been made in developing DNA vaccines against various biodefense and emerging infectious disease targets, such as HIV-1, influenza, severe acute respiratory syndrome associated coronavirus (SARS-CoV), Ebola, the viral encephalitides, anthrax, plague, and botulism, among others with some already moving into early phase clinical trials with promising results."
222,"To gain insight into the basis of this difference, we established a recombinant adenovirus system expressing the S protein from SL-CoV (rAd-Rp3-S) to investigate its immune characterization."
223,"Severe acute respiratory syndrome coronavirus 2 (SARS-CoV-2) is the cause of the ongoing pandemic of coronavirus disease 2019 (COVID-19), a public health emergency of international concern declared by the World Health Organization (WHO)."
224,The recently identified Middle East Respiratory Syndrome Coronavirus (MERS-CoV) causes severe and fatal acute respiratory illness in humans.
225,"Additionally, understanding the global diversity of respiratory viruses is also part of emerging disease preparedness, because non-human coronaviruses and paramyxoviruses have been listed as priority concerns in a recent WHO research and development blueprint initiative for emerging infectious diseases."
226,Our approach represents a strategy with potential for broad applications for the stable attenuation of coronaviruses and possibly other RNA viruses.
227, The recent introduction of the porcine epidemic diarrhea virus (PEDV) into the North American swine herd has highlighted again the need for effective vaccines for swine coronaviruses.
228,Human coronavirus NL63 (HCoV-NL63) is a common respiratory virus that causes moderately severe infections.
229,The outbreak of coronavirus disease 2019 (COVID-19) has aroused a global alert.
230,Analysis of paired serum samples aids verification of canine coronavirus infection in respiratory disease.
231,"Recent outbreaks of avian influenza viruses, Middle East respiratory syndrome coronaviruses, Zika virus and Ebola virus present great threats to global health."
232,"A novel lineage C betacoronavirus, originally named human coronavirus EMC/2012 (HCoV-EMC) and recently renamed Middle East respiratory syndrome coronavirus (MERS-CoV), that is phylogenetically closely related to Tylonycteris bat coronavirus HKU4 and Pipistrellus bat coronavirus HKU5, which we discovered in 2007 from bats in Hong Kong, has recently emerged in the Middle East to cause a severe acute respiratory syndrome (SARS)-like infection in humans."
233,"IMPORTANCE Coronavirus (CoV) emergence in both humans and livestock represents a significant threat to global public health, as evidenced by the sudden emergence of severe acute respiratory syndrome CoV (SARS-CoV), MERS-CoV, porcine epidemic diarrhea virus, and swine delta CoV in the 21st century."
234, Two genotype-specific fluorogenic RT-PCR assays were developed for the detection and quantitation of canine coronavirus (CCoV) type I and type II RNA in the faeces of dogs with diarrhoea.
235,The recent emergence of severe acute respiratory syndrome coronavirus 2 (SARS-CoV-2) from the Hubei province in China in late 2019 demonstrates the epidemic potential of coronaviruses.
236,"Despite the importance of the spike protein in viral entry and host immune responses, high-resolution structural information concerning this large macromolecular machine has been difficult to obtain."
237,"The list of viruses that are briefly reviewed here includes rhinoviruses, respiratory syncytial virus, parainfluenza virus, adenovirus, metapneumovirus and coronavirus."
238,"The human coronaviruses (CoV) include HCoV-229E, HCoV-OC43, HCoV-NL63, and HCoV-HKU1, some of which have been known for decades."
239,"The disease is officially named as Coronavirus Disease-2019 (COVID-19, by WHO on February 11, 2020)."
240," In order to investigate the ability of an oil adjuvanted vaccine containing bovine coronavirus antigen to enhance lactogenic immunity in the calf, pregnant cows and heifers were vaccinated and specific virus neutralising antibody levels determined in serum, colostrum and milk."
241,Our studies revealed that the sialic acid-binding domain at the N terminus of the S1 subunit has an orientation that is substantially different from that observed in the previously determined spike structure from human alphacoronavirus NL63.
242,No approved vaccine yet exists for any form of coronavirus.
243,"Angiotensin-converting enzyme 2 (ACE2) was found to be the receptor of 2019-nCoV.This review provides a brief overview of human coronavirus receptors and their applications, with a view to providing references for the tracing, cross-species transmission, epidemiological analysis and antiviral and vaccine studies of 2019-nCoV."
244,"The 2019 novel coronavirus (COVID19 / Wuhan coronavirus), officially named as Severe Acute Respiratory Syndrome Coronavirus 2 (SARS-CoV-2), is a positive-sense single-stranded RNA coronavirus."
245," Bovine coronavirus (BCoV) is a viral enteric pathogen associated with calf diarrhea worldwide being, in Argentina, mostly detected in dairy husbandry systems."
246,"Objective: The Coronavirus (COVID-19) has advanced into 197 countries and territories leaving behind a total of 372,757 confirmed cases and 16231 deaths."
247,"In the present study, three fragments of the truncated S protein were expressed in E. coli, and analyzed with pooled sera of convalescence phase of SARS patients."
248,"Here, we report the first full-length crystal structure of Alphacoronavirus nsp1 from PEDV."
249,"Over the recent decades, China experienced several emerging virus outbreaks including those caused by the severe acute respiratory syndrome- (SARS-) coronavirus (Cov), H5N1 virus, and H7N9 virus."
250,"Using an avian coronavirus spike protein as a model antigen, sVLPs were prepared by incubating 100 nm gold nanoparticles in a solution containing an optimized concentration of viral proteins."
251,"Although the initial isolates of the severe acute respiratory syndrome (SARS) coronavirus (CoV) are sensitive to neutralization by antibodies through their spike (S) glycoprotein, variants of S have since been identified that are resistant to such inhibition."
252,COVID-19 is caused by a coronavirus named SARS-CoV-2.
253,"We further showed that the generated IBV VLPs could induce humoral immune responses in a level comparable to that of inactivated IBV vaccine, and more importantly the IBV VLPs could elicit significantly higher cellular immune responses than the inactivated IBV vaccine."
254," The aim of this study is to reveal infection dynamics of bovine respiratory syncytial virus (BRSV), bovine parainfluenza virus type 3 (PI-3), bovine herpesvirus 1 (BHV-1), bovine viral diarrhea virus (BVDV), bovine adenovirus type 3 (BAV-3) and bovine coronavirus (BCoV), which are important viral pathogens of respiratory disease complex in ruminants."
255,Porcine epidemic diarrhea virus (PEDV) is a highly contagious coronavirus that causes severe diarrhea and death in neonatal piglets.
256, The Middle East respiratory syndrome coronavirus (MERS-CoV) is a highly pathogenic and zoonotic virus with a fatality rate in humans of over 35%.
257,"The optimal management of these infections is limited by the overall paucity of available treatment, highlighting the need for new antiviral drug or immunotherapies."
258, The causative agent of Severe Acute Respiratory Syndrome (SARS) was identified as a coronavirus (CoV) following the outbreak of 2002–2003.
259,"As these fusion proteins exhibit cross-reactivity against coronaviruses, they could have potential applications for diagnosis, prophylaxis, and treatment of 2019-nCoV."
260,"Coronaviruses, human metapneumovirus (hMPV) and enteroviruses have also impacted humans globally."
261,"HCoV 229E, HCoV OC43 (also known as betacoronavirus 1), NL63, HKU1 or SARS-CoV) to survive in different environmental conditions (e.g."
262, Severe acute respiratory syndrome (SARS) caused by a newly identified coronavirus (SARS-CoV) remains a threat to cause epidemics as evidenced by recent sporadic cases in China.
263,"A novel pneumonia-associated respiratory syndrome named coronavirus disease-2019 (COVID-19), which caused by SARS-CoV-2 and broken in Wuhan, China in the end of 2019."
