,sent
264,"The MERS-CoV genome encodes four major structural proteins, among which the spike (S) protein has a key role in viral infection and pathogenesis."
265,The impact of the drastic reduction in travel volume within mainland China in January and February 2020 was quantified with respect to reports of novel coronavirus (COVID-19) infections outside China.
266,Infectious bronchitis (IB) is a highly contagious disease of economic importance in the poultry industry caused by the coronavirus infectious bronchitis virus (IBV).
267,"In summary, the assembly of IBV VLPs with M and S proteins provided a simple strategy for generating VLPs for coronaviruses, and the generated IBV VLPs laid a feasible foundation for the development of an effective vaccine against infection of IBV in the future."
268,"In this study, we propose a compression-complexity based distance measure for automatic identification of SARS coronavirus strains from a set of viruses using only short fragments of nucleotide sequences."
269,Phylogeny-based clustering based on replicase genes was identical to the antigen-based classification of coronaviruses into three groups.
270,"In this review, the current state of vaccine development against human severe acute respiratory syndrome (SARS) coronavirus, focusing on recently published data is assessed."
271,"The extent of this process appeared to depend strongly on the coronaviral genomic background, the luciferase gene being much more stable in the feline than in the mouse coronavirus genome."
272,"The case fatality rate for H7N9 (35 %) is lower than for H5N1 (60 %) or H10N8 (67 %) but is comparable to that for the Middle East respiratory syndrome coronavirus (MERS CoV), another emerging zoonosis with travel-associated importations."
273,"In addition, the SARS Coronavirus (SARS-CoV) was also analyzed in the same way."
274,"Finally, taking into account the persisting lack of specific antiviral treatments (there is, in fact, no specific treatment available to fight coronaviruses infections), the Coronaviridae specificities (i.e."
275,"While avian infectious bronchitis coronavirus (IBV) infection and avian influenza A virus (IAV) infection both depend on α2,3-linked sialic acids, the host tropism of IBV is restricted compared to that of IAV."
276,Comparative analysis of the SARS coronavirus genome: a good start to a long journey
277,The molecular biology of coronaviruses and particular features of the human coronavirus 229E (HCoV 229E) indicate that HCoV 229E-based vaccine vectors can become a new class of highly efficient vaccines.
278,"Little more than one week later, three research groups from this WHO-coordinated network simultaneously found evidence of a hitherto unknown coronavirus in SARS patients, using different approaches."
279,"In this article, an international analysis was performed on the ongoing coronavirus disease 2019 (COVID-19) pandemic."
280,"Similar to previous clones in both flaviviruses and coronaviruses, the approach constructs a panel of contiguous cDNAs that span the DENV genome and can be systematically and directionally assembled to produce viable, full-length viruses."
281,Coronavirus assembly also takes place at pre-Golgi membranes.
282,"Hepatitis C virus (HCV) envelope glycoproteins, E1 and E2, were used with MF59 adjuvant as a candidate vaccine for a phase I safety and immunogenicity trial."
283,"This report describes the atomic-resolution structure of the spike protein from porcine epidemic diarrhea virus, a pathogenic alphacoronavirus that causes severe agricultural damage."
284,"Overall, 41.8% of the acute respiratory illnesses evaluated were associated with a respiratory virus infection, with picornaviruses, coronaviruses and influenza viruses being the most common infections recognized."
285,MERS Coronavirus: An Emerging Zoonotic Virus
286,The rapid identification (within several weeks) of potent MAbs suggests a possibility to use the new large antibody library and related methodology for a quick response to the public threat resulting from emerging coronaviruses.
287,"In this review, we present factors to consider in establishing an animal model for the study of novel coronaviruses and compare the different animal models that have been employed to study SARS-CoV and MERS-CoV."
288,In this protein we identified one epitope WDYPKCDRA is highly immunogenic and 100% conserved among all available human coronavirus strains.
289,"Middle East respiratory syndrome coronavirus (MERS-CoV) is a novel virus that emerged in 2012, causing acute respiratory distress syndrome (ARDS), severe pneumonia-like symptoms, and multi-organ failure, with a case fatality rate of ~36%."
290," The recent identification of a novel human coronavirus responsible of a SARS-like illness in the Middle-East a decade after the SARS pandemic, demonstrates that reemergence of a SARS-like coronavirus from an animal reservoir remains a credible threat."
291,"Since December, 2019, an outbreak of pneumonia caused by the new coronavirus (2019-nCoV) has hit the city of Wuhan in the Hubei Province."
292,Human coronaviruses cause both upper and lower respiratory tract infections in humans.
293," Emerging and re-emerging coronaviruses cause morbidity and mortality in human and animal populations, resulting in serious public and animal health threats and economic losses."
294,"Exotic and emerging viral pathogens associated with high morbidity and mortality in humans are being identified annually with recent examples including Lujo virus in southern Africa, Severe Fever with Thrombocytopenia Syndrome virus in China and a SARS-like coronavirus in the Middle East."
295,"In two SARS patients, we examined the memory CD4+ T-cell responses to peptides derived from SARS coronavirus structural proteins."
296, The Middle East respiratory syndrome coronavirus (MERS-CoV) is a lethal zoonotic pathogen that was first identified in humans in Saudi Arabia and Jordan in 2012.
297,Severe acute respiratory syndrome (SARS) is a zoonotic infectious disease caused by a novel coronavirus (CoV).
298,"The per-1,000 positivity rates were influenza virus 66, RSV 49, rhinovirus 33, metapneumovirus 16, and coronavirus 8."
299,"In view of a recent spread of severe acute respiratory syndrome (SARS), there is a high demand for production of a vaccine to prevent this disease."
300,"Middle East respiratory syndrome (MERS) is a highly lethal respiratory disease caused by a novel betacoronavirus (MERS coronavirus, MERS-CoV)."
301, This article is an overview of the most clinically important respiratory viruses including the recently emerged highly pathogenic coronaviruses and other viruses that are transmitted via the respiratory tract.
302,"However, the detailed structure and molecular mechanisms underlying the Alphacoronavirus nsp1 inhibition of host gene expression remain unclear."
303,"Middle East respiratory syndrome-coronavirus (MERS-CoV) is an emerging virus that causes severe disease with fatal outcomes; however, there are currently no approved vaccines or specific treatments against MERS-CoV."
304,"In this study, recombinant baculovirus vAcS and vAcME were constructed to express the S protein and the M and E proteins of SARS CoV, respectively."
305," Avian coronavirus infectious bronchitis virus (IBV) is a respiratory pathogen of chickens, causing severe economic losses in poultry industry worldwide."
306,"It is currently believed that this deadly Coronavirus strain originated from wild animals at the Huanan market in Wuhan, a city in Hubei province."
307,Vaccine against Middle East respiratory syndrome coronavirus
308,We also detected a human coronavirus coinfection in one clinical sample.
