,pid,newpid,category,sent,newscore,answer,keyword,question
550,971d0sir,523,drug,The virus shares a high level of identity with some bat coronaviruses and is recognised as a potentially zoonotic virus.,0.15017493686952316,bat,sirolimus,Can sirolimus treat COVID-19
551,m40kwgcg,1206,drug,"In general, characteristics of patients who died were in line with the MuLBSTA score, an early warning model for predicting mortality in viral pneumonia.",0.15017320727657205,viral pneumonia,Aspirin,Can Aspirin treat COVID-19
552,80m78jh2,78,drug,Further molecular models for both the MEVs were prepared and validated for their stable molecular interaction with Toll-Like Receptor 3 (TLR 3).,0.1501656544017582,toll-like receptor 3,APN01,Can APN01 treat COVID-19
553,rziv5342,208,drug,The GHS Index lists the countries best prepared for an epidemic or pandemic.,0.15014737806959644,ghs index lists the countries best prepared for an epidemic or pandemic,Losartan,Can Losartan treat COVID-19
554,0lyxvex0,520,drug,The perceived mental healthcare need was seen in more than 80 % of participants.,0.15013787368451775,mental healthcare,Traditional Chinese Medicine,Can Traditional Chinese Medicine treat COVID-19
555,yb5kf0u2,43,drug,"Driven by the urgent need for COVID-19 vaccines, we utilized this strategy to rapidly develop MNA SARS-CoV-2 subunit vaccines and tested their pre-clinical immunogenicity in vivo by exploiting our substantial experience with MNA MERS-CoV vaccines.",0.15013391105873358,pre-clinical immunogenicity,Vitamin C,Can Vitamin C treat COVID-19
556,hicqy5sj,254,drug,Previous studies showed that 2019-nCoV is highly homologous to human SARS-CoV and attaches host cells though the binding of the spike receptor binding domain (RBD) domain to the angiotensin-converting enzyme II (ACE2).,0.15012477165955912,2019,Losartan,Can Losartan treat COVID-19
557,fmumym1x,165,drug,"The sequences of the surface protein of SARS-CoV-2 and its proximal sequences were obtained by BLAST, the sequences of the whole genome of SARS-CoV-2 were obtained from the GenBank.",0.15011944438140912,the sequences of the surface protein of sars-cov-2,Traditional Chinese Medicine,Can Traditional Chinese Medicine treat COVID-19
558,rxrlbw60,102,drug,Do the vaccines generated to the SARS-CoV or MERS-CoV or their proteins offer protection against 2019-nCoV?,0.1501049255460542,offer protection against 2019-ncov,Vitamin C,Can Vitamin C treat COVID-19
559,hicqy5sj,255,drug,"However, the molecular mechanisms of 2019-nCoV binding to human ACE2 and evolution of 2019-nCoV remain unclear.",0.15010280743011878,2019-ncov binding to human ace2,Vitamin C,Can Vitamin C treat COVID-19
560,ztcyvsoi,1188,drug,The computerized tomographic chest scan is usually abnormal even in those with no symptoms or mild disease.,0.15009135260617876,the computerized tomographic chest scan is usually abnormal even in those with no symptoms or mild disease,Losartan,Can Losartan treat COVID-19
561,nzvuugls,249,drug,Puzzle of highly pathogenic human coronaviruses (2019-nCoV),0.15007635834987326,puzzle of highly pathogenic human coronaviruses,Losartan,Can Losartan treat COVID-19
562,fvig79k3,851,drug,"The current state of the epidemic is increasingly serious, and there has been the urgent necessity to develop an effective new drug.",0.15006643797525504,there has been the urgent necessity to develop an effective new drug,TAF,Can TAF treat COVID-19
563,2m6ks6nd,152,drug,Research suggests remarkable genomic resemblance of 2019-nCoV with Severe Acute Respiratory Syndrome (SARS) which has a history of a pandemic in 2002.,0.1500647273041299,ncov,Losartan,Can Losartan treat COVID-19
564,971d0sir,522,drug, The SARS-CoV-2 is a new human coronavirus candidate recently detected in China that is now reported in people on inhabited continents.,0.15005303872764514,the sars-cov-2 is a new human coronavirus candidate recently detected in china that is now reported in people on inhabited continents,Losartan,Can Losartan treat COVID-19
565,uifnjio5,463,drug,Background The COVID-19 pandemic caused by SARS-CoV-2 coronavirus threatens global public health.,0.15005055026352332,covid-19 pandemic caused by sars-cov-2 coronavirus threatens global public health,Tetrandrine,Can Tetrandrine treat COVID-19
566,ztcyvsoi,1189,drug,Treatment is essentially supportive; role of antiviral agents is yet to be established.,0.15004313402397912,treatment is essentially supportive,Traditional Chinese Medicine,Can Traditional Chinese Medicine treat COVID-19
567,szsb1oan,240,drug,"While human strains of Coronavirus are associated with about 15% of cases of the common cold, the SARS-CoV-2 may present with varying degrees of severity, from flu-like symptoms to death.",0.15003634736348978,"the sars-cov-2 may present with varying degrees of severity , from flu-like symptoms to death",Recombinant human angiotensin- converting enzyme 2,Can Recombinant human angiotensin- converting enzyme 2 treat COVID-19
568,1cc9ig04,961,drug,"At present, it is of utmost importance to understand the virus biology and to rapidly assess the potential of existing drugs and develop new active compounds.",0.15002893533512934,virus,Traditional Chinese Medicine,Can Traditional Chinese Medicine treat COVID-19
569,yd7tu7u4,1094,drug,"Starting from December 2019, a novel coronavirus, named 2019-nCoV, was found to cause Severe Acute Respiratory (SARI) symptoms and rapid pandemic in China.",0.15002084263864046,"starting from december 2019 , a novel coronavirus , named 2019-ncov , was found to cause severe acute respiratory ( sari ) symptoms and rapid pandemic in china",Losartan,Can Losartan treat COVID-19
570,ymc93p0w,859,drug,"After the eleventh consecutive MERS-CoV passage in the presence of ciclesonide, a resistant mutation was generated, which resulted in an amino acid substitution (A25V) in nonstructural protein (NSP) 15, as identified using reverse genetics.",0.15002016341987345,ciclesonide,TAF,Can TAF treat COVID-19
571,nn15iyqd,1066,drug," The Coronavirus-associated disease, that was first identified in 2019 in China (CoViD-19), is a pandemic caused by a bat-derived beta-coronavirus, named SARS-CoV2.",0.15001659558844266,china,Losartan,Can Losartan treat COVID-19
572,yb5kf0u2,41,drug,"In variant constructs, we engineered immune stimulants (RS09 or flagellin, as TLR4 or TLR5 agonists, respectively) into this trimeric design.",0.15000564578612702,can idx-184 treat covid-19,IDX-184,Can IDX-184 treat COVID-19
573,1mjaycee,173,drug,"Genomic analysis revealed that SARS-CoV-2 is phylogenetically related to severe acute respiratory syndrome-like (SARS-like) bat viruses, therefore bats could be the possible primary reservoir.",0.1499976852796659,"sars-cov-2 is phylogenetically related to severe acute respiratory syndrome-like ( sars-like ) bat viruses , therefore bats could be the possible primary reservoir",Recombinant human angiotensin- converting enzyme 2,Can Recombinant human angiotensin- converting enzyme 2 treat COVID-19
574,ejg393zs,288,drug,The very rapid spread of the COVID-19 in China and in many other countries has caused fear among people across the world.,0.1499951726778509,the very rapid spread of the covid-19,Bevacizumab,Can Bevacizumab treat COVID-19
575,190zxwwj,1036,drug, Background Cancer patients are regarded as a highly vulnerable group in the current Coronavirus Disease 2019 (COVID-19) pandemic.,0.14999341412349246,coronavirus disease 2019,Losartan,Can Losartan treat COVID-19
576,yf5g53a9,818,drug,"Owing to the lack of efficient and specific treatments and the need to contain the epidemic, drug repurposing appears to be the best tool to find a therapeutic solution.",0.14998959864123151,"lack of efficient and specific treatments and the need to contain the epidemic , drug repurposing appears to be the best tool to find a therapeutic solution",Traditional Chinese Medicine,Can Traditional Chinese Medicine treat COVID-19
577,9595vm0k,326,drug,"Overall, the validated assays described here can be instrumental for the detection of SARS-CoV-2-specific antibodies for diagnostic, seroepidemiological and vaccine evaluation studies.",0.14998458774012186,sars-cov-2-specific antibodies,TAF,Can TAF treat COVID-19
578,b31ctbat,656,drug,"By performing target-based virtual ligand screening, a total of 21 targets (including two human targets) were screened against compound libraries including ZINC drug database and our own database of natural products.",0.14998165787429898,zinc,halidomide,Can halidomide treat COVID-19
579,3r0nqzgu,1177,drug,"According to the expression profile of ACE2 in colon epithelial cells, we speculate adenoma and colorectal cancer patients are more likely to be infected with 2019-nCoV than healthy people.",0.14998079635431014,2019,sirolimus,Can sirolimus treat COVID-19
580,cszqykpu,680,drug,"In this study, we used our pretrained deep learning-based drug-target interaction model called Molecule Transformer-Drug Target Interaction (MT-DTI) to identify commercially available drugs that could act on viral proteins of 2019-nCoV.",0.1499722456609399,2019-ncov .,TAF,Can TAF treat COVID-19
581,02q9y011,1093,drug,"Although 26% of the amino acids in this SARS-CoV-2 macrodomain differ from those seen in other corona-viruses, the protein retains the ability to bind ADP-ribose, which is an important characteristic of beta coronaviruses, and potential therapeutic target.",0.14996430942062233,potential therapeutic target,Recombinant human angiotensin- converting enzyme 2,Can Recombinant human angiotensin- converting enzyme 2 treat COVID-19
582,sjyrr2bn,831,drug,The outbreak of COVID-19 is wreaking havoc worldwide due to inadequate risk assessment regarding the urgency of the situation.,0.14996238208468682,inadequate risk assessment,DAS181,Can DAS181 treat COVID-19
583,535lw99y,369,drug,"However, function of a bio-system is often under kinetic, rather than thermodynamic, control.",0.14996213744545794,"function of a bio-system is often under kinetic , rather than thermodynamic , control",Losartan,Can Losartan treat COVID-19
584,h8ahn8fw,1034,drug,It is necessary to further strengthen the monitoring to ensure that it will not cause diseases like Global Outbreak of 2003 SARS.,0.14996069993933142,it is necessary to further strengthen the monitoring to ensure that it will not cause diseases,SARS 3CL protease inhibitors,Can SARS 3CL protease inhibitors treat COVID-19
585,0d77ojnb,870,drug,"Moreover, mucosal epithelia such as that of the respiratory tract are protected by a layer of mucin polysaccharides, which are usually sulfated.",0.14995713139908534,"moreover , mucosal epithelia such as that of the respiratory tract are protected by a layer of mucin polysaccharides , which are usually sulfated .",IDX-184,Can IDX-184 treat COVID-19
586,sjyrr2bn,834,drug,Slowing the spread of the COVID-19 cases will significantly reduce the strain on the healthcare system of the country by limiting the number of people who are severely sick by COVID-19 and need hospital care.,0.1499519988316002,slowing the spread of the covid-19 cases will significantly reduce the strain on the healthcare system of the country by limiting the number of people who are severely sick by covid-19 and need hospital care,TAF,Can TAF treat COVID-19
587,ckay4ufw,227,drug,This implies that as a pandemic as declared by WHO (2020) the COVID-19 coronavirus does not have a curative vaccine yet and precautionary measures are advised through quarantine and observatory procedures.,0.14995160929076015,does not have a curative vaccine yet,velpatasvir,Can velpatasvir treat COVID-19
588,b4joa5tx,583,drug,Both compounds are promising drug leads with clinical potential that merits further studies.,0.14994107405015292,both compounds are promising drug leads with clinical potential that merits further studies,lopinavir/ritonavir,Can lopinavir/ritonavir treat COVID-19
589,yb5kf0u2,40,drug,Methods We first generated codon optimized MERS-S1 subunit vaccines fused with a foldon trimerization domain to mimic the native viral structure.,0.14993666160520674,codon optimized mers-s1 subunit vaccines,AZT,Can AZT treat COVID-19
590,3r0nqzgu,1171,drug,"Since the novel coronavirus has been reported to be capable of endangering thousands of lives, it is extremely important to find out how the coronavirus is transmitted in human organs.",0.14992949246490075,it is extremely important to find out how the coronavirus is transmitted in human organs,Losartan,Can Losartan treat COVID-19
591,647zcjgu,772,drug,"The RBDs from the two viruses share 72% identity in amino acid sequences, and molecular simulation reveals highly similar ternary structures.",0.14992390689647142,the rbds from the two viruses,IDX-184,Can IDX-184 treat COVID-19
592,535lw99y,370,drug,"To address this issue, we constructed a structural model for complex formed between ACE2 and the S-protein from 2019-nCoV, so that the rate of their association can be estimated and compared with the binding of S-protein from SARS-CoV by a multiscale simulation method.",0.14992117283869033,"to address this issue , we constructed a structural model for complex formed between ace2 and the s-protein from 2019-ncov , so that the rate of their association can be estimated and compared with the binding of s-protein from sars-cov by a multiscale simulation method",Levamisole,Can Levamisole treat COVID-19
593,h8ahn8fw,1031,drug,"Therefore, strengthening the monitoring of wild mammals is an urgent measure to prevent similar viruses from infecting humans in the future.",0.14992035484692676,strengthening the monitoring of wild mammals is an urgent measure to prevent similar viruses from infecting humans in the future,Losartan,Can Losartan treat COVID-19
594,m0q7rm6z,805,drug,The vast complexity in drug design and protocols regarding clinical trials often prohibit developing various new drug combinations for this epidemic disease in a limited time.,0.14991678736424402,prohibit developing various new drug combinations,TAF,Can TAF treat COVID-19
595,yqiggzk9,969,drug,The changes of blood routine and biochemical indexes at discharge and admission were compared.,0.14991424927003014,blood routine and biochemical indexes at discharge and admission were compared,TAF,Can TAF treat COVID-19
596,h8ahn8fw,1032,drug,"More than 1,000 confirmed cases have been reported in China.",0.14991097803506742,china,Losartan,Can Losartan treat COVID-19
597,hylue5wq,1148,drug,Potential inhibitors against 2019-nCoV coronavirus M protease from clinically approved medicines,0.14990167671993954,potential inhibitors,Losartan,Can Losartan treat COVID-19
598,a5udnv5f,348,drug,"Although many challenges exist, NAbs still offer a therapeutic option to control the current pandemic and the possible re-emergence of the virus in the future, and their development therefore remains a high priority.",0.14990062143154886,nabs still offer a therapeutic option to control the current pandemic and the possible re-emergence of the virus in the future,Naproxen,Can Naproxen treat COVID-19
599,535lw99y,372,drug,We further integrated this difference of association rate between virus and receptor into a mathematical model which describes the life cycle of virus in host cells and its interplay with the innate immune system.,0.1498837299025991,innate immune system,APN01,Can APN01 treat COVID-19
600,5xyt8d5u,923,drug,"Elder age, high number of comorbidities and more prominent laboratory abnormalities were associated with severe patients.",0.1498797744203037,"elder age , high number of comorbidities and more prominent laboratory abnormalities were associated with severe patients",Traditional Chinese Medicine,Can Traditional Chinese Medicine treat COVID-19
601,fway438n,18,drug,"Sanofi will build on work on a vaccine against SARS, another coronavirus that circulated in the early 2000s.",0.14987826274712085,vaccine against sars,APN01,Can APN01 treat COVID-19
602,p5ecpcll,733,drug,Conclusion: The clinical characteristics of the novel coronavirus pneumonia in Kunming are different from those in Wuhan.,0.14987350507657649,coronavirus pneumonia,Naproxen,Can Naproxen treat COVID-19
603,5i2dxg8z,905,drug,"It also incorporates a wide range of relevant information including scientific literatures, news, and popular articles for science dissemination, and provides visualization functionalities for genome variation analysis results based on all collected 2019-nCoV strains.",0.14987054604982125,2019-ncov strains,TAF,Can TAF treat COVID-19
604,nlsna66a,849,drug,Strategies against the novel coronavirus: Possible applications of the experimental Ebola drug remdesivir are being tested,0.14986955324674528,possible applications of the experimental ebola drug remdesivir,TAF,Can TAF treat COVID-19
605,8gncbgot,57,drug,Several laboratory protocols for confirmation of suspected 2019-nCoV cases using real-time reverse transcription polymerase chain reaction (RT-PCR) have been published.,0.14986778095976255,2019-ncov cases,Losartan,Can Losartan treat COVID-19
606,rl2qxd03,184,drug,"The goal of this review is to provide a timely overview on efforts to develop a vaccine for the 2019 novel coronavirus SARS-CoV-2, the causative agent of coronavirus disease (COVID-19).",0.14985304695756368,vaccine,APN01,Can APN01 treat COVID-19
607,a6p6ka8w,413,drug,Twitter is a rich medium that can be leveraged to understand public sentiment in real-time and target public health messages based on user interest and emotion.,0.14983831769128292,twitter is a rich medium that can be leveraged to understand public sentiment in real-time and target public health messages,AZT,Can AZT treat COVID-19
608,8o6yjxwe,946,drug,Objective: To analyze the clinical characteristics of cases of novel coronavirus pneumonia and a preliminary study to explore the relationship between different clinical classification and liver damage.,0.14982939147838892,coronavirus pneumonia,Losartan,Can Losartan treat COVID-19
609,vbayngh0,567,drug,"Here, we demonstrate that SARS-CoV-2 uses the SARS-CoV receptor ACE2 for entry and the serine protease TMPRSS2 for S protein priming.",0.1498284828436689,sars-cov-2 uses the sars-cov receptor ace2 for entry and the serine protease tmprss2 for s protein priming .,Recombinant human angiotensin- converting enzyme 2,Can Recombinant human angiotensin- converting enzyme 2 treat COVID-19
610,xhachzby,548,drug,"A novel coronavirus has been identified as the causative agent of a massive outbreak of atypical pneumonia originating at Wuhan, Hubei province, China.",0.14982704283860052,pneumonia,Naproxen,Can Naproxen treat COVID-19
611,13akn7dm,704,drug,"Conclusions In the process of management of COVID-19 infections, close attention should be paid on both lung and cardiovascular damage, especially on those with only symptoms of cardiovascular diseases.",0.1498222848841369,"in the process of management of covid-19 infections , close attention should be paid on both lung and cardiovascular damage",darunavir,Can darunavir treat COVID-19
612,hicqy5sj,259,drug,This may also provide insights into the evolution of 2019-nCoV because SARS-like coronaviruses are thought to have originated in bats that are known to have a higher body-temperature than humans.,0.14982118316869236,this may also provide insights into the evolution of 2019,Losartan,Can Losartan treat COVID-19
613,c4pcztdc,197,drug,Viruses infect host cells by binding to receptors on thesurface of cells.,0.14981773842257862,viruses infect host cells,Pathogen-specific aAPC,Can Pathogen-specific aAPC treat COVID-19
614,x95h80nq,68,drug,"Therefore, combating this new virus and stopping the epidemic is a matter of urgency.",0.14981578817833016,combating this new virus and stopping the epidemic is a matter of urgency,Naproxen,Can Naproxen treat COVID-19
615,m0q7rm6z,812,drug,The ML based approach for drug discovery as reported here can be a futuristic smart drug designing strategy for community applications.,0.14980511985924316,the ml based approach for drug discovery as reported here can be a futuristic smart drug designing strategy for community applications,Losartan,Can Losartan treat COVID-19
616,z0qzgu5m,592,drug,"However, drug screening using live 2019-nCoV requires high-level biosafety facilities, which imposes an obstacle for those without such facilities or 2019-novel coronavirus (2019-nCoV).",0.14979180916638926,2019-novel coronavirus ( 2019-ncov ) .,Losartan,Can Losartan treat COVID-19
617,190zxwwj,1051,drug,It is recommended that cancer patients receiving anti-tumour treatments should have vigorous screening for COVID-19 infection and should avoid treatments causing immunosuppression or have their dosages decreased in case of COVID-19 co-infection.,0.14979148588005758,it is recommended that cancer patients receiving anti-tumour treatments should have vigorous screening for covid-19 infection,TAF,Can TAF treat COVID-19
618,ejg393zs,289,drug,The novel coronavirus outbreak declared a Public Health Emergency of International Concern on 30 January 2020.,0.1497902249290984,coronavirus outbreak declared a public health emergency of international concern,Losartan,Can Losartan treat COVID-19
619,p5ecpcll,726,drug,Results: (1) The patients with new coronavirus pneumonia in Kunming were mainly of common type.,0.1497651682715887,coronavirus pneumonia,APN01,Can APN01 treat COVID-19
620,fvig79k3,854,drug,"The surface glycoprotein of 2019-nCoV was coincident with the CTD1 region of the S-protein by comparing the I-TASSER prediction model with the actual SARS model, which suggests that 2019-nCoV may bind to the ACE2 receptor through conformational changes.",0.1497618615981786,may bind to the ace2 receptor through conformational changes,APN01,Can APN01 treat COVID-19
621,iy9vjpuh,283,drug,"In order to assess the potential of the Wuhan 2019-nCoV to cause maternal, fetal and neonatal morbidity and other poor obstetrical outcomes, this communication reviews the published data addressing the epidemiological and clinical effects of SARS, MERS, and other coronavirus infections on pregnant women and their infants.",0.14975778499523254,"wuhan 2019-ncov to cause maternal , fetal and neonatal morbidity and other poor obstetrical outcomes",Losartan,Can Losartan treat COVID-19
622,7e8zlt3t,481,drug,An escalating pandemic by the novel SARS-CoV-2 virus is impacting global health and effective therapeutic options are urgently needed.,0.1497533836094449,effective therapeutic options are urgently needed,TAF,Can TAF treat COVID-19
623,b4joa5tx,581,drug,"The X-ray crystal structures of SARS-CoV-2 Mpro in complex with 11a and 11b were determined at 1.5 Å resolution, respectively.",0.14974028781992288,sars-cov-2 mpro,Huaier Granule,Can Huaier Granule treat COVID-19
624,75cotmn2,629,drug,"Knowledge about this growing infection is also increasing although many uncertainties remain, especially in the kidney transplant population.",0.14973797336735326,kidney transplant,Losartan,Can Losartan treat COVID-19
625,xhachzby,552,drug,We further describe 1.95- and 2.20-Å crystal structures of the complex between the enzyme and the most potent alpha-ketoamide optimized this way.,0.1497377001152254,can nitric oxide gas treat covid-19,Nitric Oxide Gas,Can Nitric Oxide Gas treat COVID-19
626,02q9y011,1092,drug,"This study examines one of the most novel proteins encoded by SARS-CoV-2, a macrodomain of nonstructural protein 3 (nsp3).",0.1497355202148874,this study examines one of the most novel proteins encoded by sars-cov-2,APN01,Can APN01 treat COVID-19
627,6y9n69g5,793,drug,The 2019-novel coronavirus (nCoV) is a major source of disaster in the 21(th) century.,0.14971798129144304,coronavirus,lopinavir/ritonavir,Can lopinavir/ritonavir treat COVID-19
628,hi38itc9,1111,drug,The average length of stay for discharged patients was 8 days.,0.14971154084814578,the average length of stay for discharged patients was 8 days,Naproxen,Can Naproxen treat COVID-19
629,nn15iyqd,1076,drug,"Rheumatic disease patients taking immunosuppressive drugs should be recommended to maintain the chronic therapy, prevent infection by avoiding social contacts and pausing immunosuppressants in case of infection.",0.14970102605435345,rheumatic disease patients taking immunosuppressive drugs should be recommended to maintain the chronic therapy,Losartan,Can Losartan treat COVID-19
630,t996fbad,693,drug,All 12 cases of the 2019-nCoV-infected patients developed pneumonia and half of them developed acute respiratory distress syndrome (ARDS).,0.14970038565427707,all 12 cases of the 2019-ncov-infected patients developed pneumonia,Naproxen,Can Naproxen treat COVID-19
631,80m78jh2,81,drug,Both the CTL and HTL MEVs models show a very sytable and very fitting conformational complex formation tendency with the Toll like receptor 3.,0.14969856654977245,toll,Tetrandrine,Can Tetrandrine treat COVID-19
632,c4pcztdc,200,drug,"The pathogen was a new coronavirus, named 2019 NovelCoronavirus (2019-nCoV) by WHO.",0.14969544983640415,2019,TAF,Can TAF treat COVID-19
633,ejg393zs,296,drug,"Incubation period for COVID-19 is between 2-10 days, according to the World Health Organization (WHO).",0.14969469636188001,"incubation period for covid-19 is between 2-10 days , according to the world health organization",Losartan,Can Losartan treat COVID-19
634,ju2en6n0,361,drug,What is the role of rheumatologists in the era of COVID-19?,0.14969346598251915,rheumatologists,ledipasvir,Can ledipasvir treat COVID-19
635,13jupb26,332,drug, This paper concerns study of the genome of the Wuhan Seafood Market isolate believed to represent the causative agent of the disease COVID-19.,0.14968204784564787,study of the genome of the wuhan seafood market isolate believed to represent the causative agent of the disease covid-19,Losartan,Can Losartan treat COVID-19
