,pid,newpid,category,sent,newscore,answer,keyword,question
724,penb65x7,1158,drug,These data indicate that 2–11% of patients with COVID-19 had liver comorbidities and 14–53% cases reported abnormal levels of alanine aminotransferase and aspartate aminotransferase (AST) during disease progression (table).,0.14910200154454764,2 – 11 % of patients with covid-19 had liver comorbidities and 14 – 53 % cases reported abnormal levels of alanine aminotransferase and aspartate aminotransferase ( ast ) during disease progression,Losartan,Can Losartan treat COVID-19
725,5xyt8d5u,921,drug,CONCLUSION: Detailed clinical investigation of 140 hospitalized COVID-19 cases suggest eosinopenia together with lymphopenia may be a potential indicator for diagnosis.,0.14907930568257385,detailed clinical investigation of 140 hospitalized covid-19 cases suggest eosinopenia together with lymphopenia may be a potential indicator for diagnosis,sirolimus,Can sirolimus treat COVID-19
726,nror02j6,107,drug,"Anthony S. Fauci, MD discusses the latest developments in the global spread of COVID-19 and the SARS-CoV-2 virus with JAMA Editor Howard Bauchner, MD.",0.14907902730755612,discusses the latest developments in the global spread of covid-19,Losartan,Can Losartan treat COVID-19
727,gu2mt6zp,125,drug,Recent advancements in plant biotechnology proved that plants have the ability to produce vaccines or biopharmaceuticals rapidly in a short time.,0.14907148206650045,vaccines,TAF,Can TAF treat COVID-19
728,uze6ze8o,330,drug,The unprecedented measures implemented in China are a bold attempt to control the outbreak – we need to understand their effectiveness to balance costs and benefits for similar events in the future.,0.14906948986579405,we need to understand their effectiveness to balance costs and benefits for similar events in the future,TAF,Can TAF treat COVID-19
729,6g34qwer,1126,drug,Baseline characteristics were generally balanced across two groups.,0.1490694739160205,baseline characteristics were generally balanced across two groups .,APN01,Can APN01 treat COVID-19
730,nxfr24sp,740,drug,"This report describes the clinical characteristics of COVID-19 in an in-center hemodialysis patient, as well as our experience in implementing steps to prevent the spread of COVID-19 pneumonia among in-center hemodialysis patients.",0.14906453243981654,"clinical characteristics of covid-19 in an in-center hemodialysis patient , as well as our experience in implementing steps to prevent the spread of covid-19 pneumonia among in-center hemodialysis patients",Losartan,Can Losartan treat COVID-19
731,k0te068l,1146,drug,"Autopsy studies are crucial to help understand the involvement of COVID-19 in the digestive system; however, to date, there has been only one autopsy report3 for a man aged 85 years with COVID-19, which showed segmental dilatation and stenosis in the small intestine.",0.14906409960756342,"there has been only one autopsy report3 for a man aged 85 years with covid-19 , which showed segmental dilatation and stenosis in the small intestine .",Losartan,Can Losartan treat COVID-19
732,3r0nqzgu,1169,drug,A newly identified novel coronavirus (2019-nCoV) has caused numerous acute respiratory syndrome cases in Wuhan China from December 2019 to Feb 2020.,0.14904650161693664,2019-ncov,TAF,Can TAF treat COVID-19
733,w9a0jopu,1168,drug,"Our ETCS has demonstrated substantial benefits in terms of the effectiveness of consultations and remote patient monitoring, multidisciplinary care, and prevention education and training.",0.1490464405151517,our etcs has demonstrated substantial benefits,Traditional Chinese Medicine,Can Traditional Chinese Medicine treat COVID-19
734,w84qtud6,898,drug,"The compounds Scopodulic acid and Dammarenolic acid showed the best-fit value of activity against SARS-CoV-2 spike glycoprotein 6vsb and main protease Mpro 6lu7 targets, respectively.",0.14904573641363672,sars-cov-2 spike glycoprotein 6vsb,Recombinant human angiotensin- converting enzyme 2,Can Recombinant human angiotensin- converting enzyme 2 treat COVID-19
735,lg45goe2,89,drug,"The firm is now launching two of its own Phase III clinical trials of remdesivir, in addition to the [truncated]",0.14903753180446547,remdesivir,TAF,Can TAF treat COVID-19
736,p1w3p80y,875,drug,"The New Coronavirus Pneumonia (NCP, also named as COVID-19 by WHO on Feb 11 2020, is now causing a severe public health emergency in China since.",0.14903460917795286,china,Losartan,Can Losartan treat COVID-19
737,1u12qr97,661,drug,Advance of promising targets and agents against 2019-nCoV in China,0.14903168142922288,advance of promising targets and agents against 2019,Alovudine,Can Alovudine treat COVID-19
738,aeuy92bx,490,drug,"In this report, we generated a novel recombinant protein by connecting the extracellular domain of human ACE2 to the Fc region of the human immunoglobulin IgG1.",0.1490269336453657,immunoglobulin igg1,APN01,Can APN01 treat COVID-19
739,6g34qwer,1127,drug,"Compared to control group, meplazumab treatment significantly improved the discharged (p=0.006) and case severity (p=0.021) in critical and severe patients.",0.14902472512286574,significantly improved the discharged ( p = 0 . 006 ) and case severity ( p = 0 . 021 ) in critical and severe patients,mercaptopurine,Can mercaptopurine treat COVID-19
740,yb5kf0u2,37,drug,"SARS Coronavirus (SARS-CoV), MERS Coronavirus (MERS-CoV), and the novel coronavirus, previously dubbed 2019-nCoV, and now officially named SARS-CoV-2, are the causative agents of the SARS, MERS, and COVID-19 disease outbreaks, respectively.",0.1490230860290024,covid-19,Recombinant human angiotensin- converting enzyme 2,Can Recombinant human angiotensin- converting enzyme 2 treat COVID-19
741,ptnmtvzj,997,drug,"Additional therapies included broad spectrum antibiotics (n=30), steroids (n=39) or various interferons (n=12).",0.14902003723097804,antibiotics,AZT,Can AZT treat COVID-19
742,pidar1gz,128,drug,"Considering the potential threat of a pandemic, scientists and physicians have been racing to understand this new virus and the pathophysiology of this disease to uncover possible treatment regimens and discover effective therapeutic agents and vaccines.",0.14900161100469095,possible treatment regimens and discover effective therapeutic agents and vaccines,TAF,Can TAF treat COVID-19
743,szsb1oan,247,drug,"The costs of the epidemic are not limited to medical aspects, as the virus has led to significant sociological, psychological and economic effects globally.",0.14899141174401548,costs of the epidemic are not limited to medical aspects,Naproxen,Can Naproxen treat COVID-19
744,b518n9dx,715,drug,"So far, the number of infectious cases has increased globally to more than 100 thousand and defined as a pandemic situation, but there are still no “specific drug” available.",0.14898444725114185,there are still no “ specific drug ” available,Tocilizumab,Can Tocilizumab treat COVID-19
745,7jkzbmsf,788,drug,"So far, no nosocomial infections and medication errors have occurred, which has stabilized the mood of the staff and boosted the pharmacists' confidence in fighting the epidemic.",0.14897929765113993,no nosocomial infections and medication errors have occurred,Naproxen,Can Naproxen treat COVID-19
746,rziv5342,205,drug,"As of 26 February 2020, the disease has been detected on all continents, except for Antarctica.",0.1489720575016507,"as of 26 february 2020 , the disease has been detected on all continents , except for antarctica",Losartan,Can Losartan treat COVID-19
747,yb5kf0u2,36,drug," Background Coronaviruses pose a serious threat to global health as evidenced by Severe Acute Respiratory Syndrome (SARS), Middle East Respiratory Syndrome (MERS), and COVID-19.",0.14896038100336242,covid-19,Sarilumab,Can Sarilumab treat COVID-19
748,6g34qwer,1129,drug,The percentages of patients recovered to the normal lymphocyte count and CRP concentration were also increased remarkably and rapidly in meplazumab group.,0.14895329673106028,meplazumab,AZT,Can AZT treat COVID-19
749,5i2dxg8z,906,drug,"Moreover, by linking seamlessly with related databases in CNCB/NGDC, 2019nCoVR offers virus data submission and sharing services for raw sequence reads and assembled sequences.",0.1489499660281135,2019ncovr offers virus data submission and sharing services,Losartan,Can Losartan treat COVID-19
750,5i2dxg8z,902,drug,The virus causing this pneumonia was then named as the 2019 novel coronavirus (2019-nCoV) by the World Health Organization.,0.14894763020851606,2019,TAF,Can TAF treat COVID-19
751,pidar1gz,129,drug,"To support the current research and development, CAS has produced a special report to provide an overview of published scientific information with an emphasis on patents in the CAS content collection.",0.14892657488405858,patents,Tocilizumab,Can Tocilizumab treat COVID-19
752,x95h80nq,67,drug,"As of 24 January 2020, there were 887 confirmed cases of 2019-nCoV infection, including 26 deaths, reported in China and other countries.",0.1489216740820823,ncov infection,Naproxen,Can Naproxen treat COVID-19
753,ld0vo1rl,10,drug,"We then propose that an ""Sp/Nsp cocktail vaccine"" containing a structural protein(s) (Sp) and a non-structural protein(s) (Nsp) would stimulate effective complementary immune responses.",0.14891361551006296,would stimulate effective complementary immune responses,TAF,Can TAF treat COVID-19
754,b1iyr42n,144,drug,"Our data suggests that 2019-nCoV is newly spilled coronavirus into humans in China is closely related to SARS-CoV, which has only 12.8% of difference with SARS-CoV in S protein and has 83.9% similarity in minimal receptor-binding domain with SARS-CoV.",0.14890858113781688,2019-ncov is newly spilled coronavirus into humans in china,Losartan,Can Losartan treat COVID-19
755,plxz5mkg,504,drug,"In this review, we summarize the key events occurred during the early stage of SARS-CoV-2 outbreak, the basic characteristics of the pathogen, the signs and symptoms of the infected patients as well as the possible transmission pathways of the virus.",0.14890484460758655,cov-2,RhACE2,Can RhACE2 treat COVID-19
756,ctd9sutv,225,drug,"ADE also requires prior exposure to similar antigenic epitopes, presumably circulating in local viruses, making it a possible explanation for the observed geographic limitation of severe cases and deaths.",0.14890118398584593,"ade also requires prior exposure to similar antigenic epitopes , presumably circulating in local viruses",Atovaquone,Can Atovaquone treat COVID-19
757,80m78jh2,75,drug,The screened epitopes were further validated for their binding with their respective HLA allele binders and TAP (Transporter associated with antigen processing) molecule by molecular docking.,0.14889783634270073,binding with their respective hla allele binders and tap ( transporter associated with antigen processing ) molecule by molecular docking,APN01,Can APN01 treat COVID-19
758,3r0nqzgu,1176,drug,"The expression of ACE2 is gradually increased from healthy control, adenoma to colorectal cancer patients in our cohort as well as in the external Asian datasets.",0.14889610960251504,colorectal cancer,Losartan,Can Losartan treat COVID-19
759,m0q7rm6z,804,drug,"The research includes the study of drugs that are already available in the market and being used for other diseases to accelerate clinical recovery, in other words repurposing of existing drugs.",0.1488945133019916,the research includes the study of drugs that are already available in the market and being used for other diseases,CAP-1002,Can CAP-1002 treat COVID-19
760,k0te068l,1147,drug,Whether this finding is secondary to COVID-19 or a pre-existing gastrointestinal comorbidity is unknown.,0.14889325026361985,whether this finding is secondary to covid-19 or a pre-existing gastrointestinal comorbidity is unknown,Naproxen,Can Naproxen treat COVID-19
761,2uvibr2j,25,drug,"Seven antigenic proteins were taken as targets and different epitopes (B-cell, T-cell and IFN-γ inducing) were predicted.",0.14888981005856433,seven antigenic proteins were taken as targets,Losartan,Can Losartan treat COVID-19
762,6g34qwer,1120,drug,"Eligible patients were add-on administered 10 mg meplazumab intravenously at days 1, 2, and 5.",0.14888353979364854,"eligible patients were add-on administered 10 mg meplazumab intravenously at days 1 , 2 , and 5",Losartan,Can Losartan treat COVID-19
763,tomsdx3z,651,drug,"Herein we scrutinize a series of available studies by global scientists on the clinical manifestations, detection methods and treatment options of 2019 novel coronavirus pneumonia, also propose potential strategies for preventing the infection.",0.14888071317818385,treatment options of 2019 novel coronavirus pneumonia,Losartan,Can Losartan treat COVID-19
764,679qfp2s,230,drug,"Given the high need and the absence of specific antivirals for treatment of COVID-19 (the disease caused by severe acute respiratory syndrome-associated coronavirus-2 [SARS-CoV-2]), human immunodeficiency virus (HIV) protease inhibitors are being considered as therapeutic alternatives.",0.14887898134891706,absence of specific antivirals for treatment of covid-19,Tocilizumab,Can Tocilizumab treat COVID-19
765,vxqdfiel,559,drug,"Hence, we performed a search in March 2020 of the clinicaltrials.gov database.",0.14887710927522368,"hence , we performed a search in march 2020",IDX-184,Can IDX-184 treat COVID-19
766,5xyt8d5u,914,drug,Drug hypersensitivity (11.4%) and urticaria (1.4%) were self-reported by several patients.,0.1488722165698131,drug hypersensitivity,Losartan,Can Losartan treat COVID-19
767,athjtu2j,986,drug,Epidemiology dynamics is a mathematical model based on a susceptibility-infection-recovery epidemic model.,0.1488594985604369,susceptibility-infection,AZT,Can AZT treat COVID-19
768,80m78jh2,76,drug,"The screened epitopes were further utilized to design novel two multi-epitope vaccines (MEVs) composed of CTL, HTL and B cell epitopes overlaps with potential to elicit humoral as well as cellular immune response against SARS-CoV-2.",0.14885851649515008,potential to elicit humoral as well as cellular immune response against sars-cov-2,Recombinant human angiotensin- converting enzyme 2,Can Recombinant human angiotensin- converting enzyme 2 treat COVID-19
769,5fg87lvu,459,drug,Governments are under increased pressure to stop the outbreak spiraling into a global health emergency.,0.1488525959791807,governments are under increased pressure to stop the outbreak spiraling into a global health emergency,TAF,Can TAF treat COVID-19
770,nn15iyqd,1068,drug,SARS-CoV2 spread from China where the first infections were described in December 2019 and is responsible for the respiratory symptoms that can lead to acute respiratory distress syndrome.,0.14885124603984695,sars-cov2 spread from china where the first infections were described in december 2019 and is responsible for the respiratory symptoms that can lead to acute respiratory distress syndrome,Sargramostim,Can Sargramostim treat COVID-19
771,b4joa5tx,579,drug,"In an effort to rapidly discover lead compounds targeting Mpro, two compounds (11a and 11b) were designed and synthesized, both of which exhibited excellent inhibitory activity with an IC50 value of 0.05 μM and 0.04 μM respectively.",0.14884448427708327,inhibitory activity,Vitamin C,Can Vitamin C treat COVID-19
772,971d0sir,524,drug,"We are utilizing the One Health concept to understand the emergence of the virus, as well as to point to some possible control strategies that might reduce the spread of the virus across the globe; thus, containment of such virus would be possible.",0.14883883689223135,reduce the spread of the virus across the globe,Aspirin,Can Aspirin treat COVID-19
773,tomsdx3z,649,drug,But the cause and consequence of the pneumonia still remain unknown.,0.14883851781212054,pneumonia,halidomide,Can halidomide treat COVID-19
774,2uvibr2j,32,drug,"Molecular docking followed by molecular dynamics (MD) simulation analysis, demonstrated a stable and strong binding affinity of MEV with human pathogenic toll-like receptors (TLR), TLR3 and TLR8.",0.14883489195698954,"demonstrated a stable and strong binding affinity of mev with human pathogenic toll-like receptors ( tlr ) , tlr3 and tlr8 .",Recombinant human angiotensin- converting enzyme 2,Can Recombinant human angiotensin- converting enzyme 2 treat COVID-19
775,c4u0gxp5,269,drug,"To promptly identify patients and prevent further spreading, physicians should be aware of travel or contact history for patients with compatible symptoms.",0.14883163335559468,physicians should be aware of travel or contact history for patients with compatible symptoms,TAF,Can TAF treat COVID-19
776,l6rqsqs2,396,drug,Science in the fight against the novel coronavirus disease,0.14882492093994082,science in the fight against the novel coronavirus disease,velpatasvir,Can velpatasvir treat COVID-19
777,647zcjgu,779,drug,"However, since ACE2 is predominantly expressed in intestines, testis, and kidney, fecal-oral and other routes of transmission are also possible.",0.14881887455213275,fecal-oral and other routes of transmission are also possible,Recombinant human angiotensin- converting enzyme 2,Can Recombinant human angiotensin- converting enzyme 2 treat COVID-19
778,801t0728,427,drug,Of particular concern is the proximity between the patient and ophthalmologist during the slit lamp microscope examination.,0.14880484144305414,proximity between the patient and ophthalmologist during the slit lamp microscope examination,Naproxen,Can Naproxen treat COVID-19
779,6lngz7y1,1015,drug,Its impacts on public health make it paramount to clarify the clinical features with other pneumonias.,0.1488017974764649,pneumonias,Aspirin,Can Aspirin treat COVID-19
780,73a7uvyz,376,drug,"Recently, a new emerged HCoV isolated from the respiratory epithelium of unexplained pneumonia patients in the Wuhan seafood market caused a major disease outbreak and has been named the severe acute respiratory syndrome coronavirus 2 (SARS-CoV-2).",0.14878692546888256,severe acute respiratory syndrome coronavirus 2,velpatasvir,Can velpatasvir treat COVID-19
781,epcel2ez,498,drug,"Intensive research on the novel emerging human infectious coronaviruses is urgently needed to elucidate their route of transmission and pathogenic mechanisms, and to identify potential drug targets, which would promote the development of effective preventive and therapeutic countermeasures.",0.14877253105392985,coronaviruses,Losartan,Can Losartan treat COVID-19
782,w84qtud6,895,drug,Six lead compounds with binding energies within the range of -9 to -9.6 Kcal/mol were selected for molecular docking analyses against 6lu7.,0.14877175212609609,molecular docking analyses against 6lu7,APN01,Can APN01 treat COVID-19
783,iy9vjpuh,281,drug,"In the early stages of this epidemic the case fatality rate is estimated to be approximately 2%, with the majority of deaths occurring in special populations.",0.14874669110588384,"in the early stages of this epidemic the case fatality rate is estimated to be approximately 2 % , with the majority of deaths occurring in special populations .",Peginterferon Lambda-1a,Can Peginterferon Lambda-1a treat COVID-19
784,5xyt8d5u,918,drug,Lymphopenia (75.4%) and eosinopenia (52.9%) were observed in most patients.,0.14873498136974986,lymphopenia ( 75 . 4 % ) and eosinopenia ( 52 . 9 % ) were observed in most patients,Traditional Chinese Medicine,Can Traditional Chinese Medicine treat COVID-19
785,tpmgrk14,525,drug,New threat: 2019 novel Coronavirus infection and infection control perspective in Turkey,0.14872684247000673,coronavirus infection and infection control perspective in turkey,TAF,Can TAF treat COVID-19
786,mu413rvc,181,drug,"Hence, there is a chance of no secondary reinfections from the recovered population as the rate of incidence of the recovered population vanishes, that is, B=0.",0.14872663755308518,no secondary reinfections from the recovered population,Traditional Chinese Medicine,Can Traditional Chinese Medicine treat COVID-19
787,vbayngh0,565,drug,Cell entry of coronaviruses depends on binding of the viral spike (S) proteins to cellular receptors and on S protein priming by host cell proteases.,0.1487262241134932,coronaviruses,Azithromycin,Can Azithromycin treat COVID-19
788,0xhho1sh,674,drug,Bilateral lung involvement with ground-glass opacity was the most common finding from computed tomography images of the chest.,0.1487230165539124,bilateral lung involvement with ground-glass opacity,Naproxen,Can Naproxen treat COVID-19
789,566pbuic,924,drug,": Since early December 2019, the 2019 novel coronavirus disease (COVID-19) has caused pneumonia epidemic in Wuhan, Hubei province of China.",0.14871917674978535,pneumonia,Aspirin,Can Aspirin treat COVID-19
790,75cotmn2,630,drug,This manuscript presents a proposal for action with general and specific recommendations to protect and prevent infection in this vulnerable population such as kidney transplant recipients.,0.14871300080578173,kidney transplant recipients,APN01,Can APN01 treat COVID-19
791,hnoovm03,620,drug,Convalescent plasma as a potential therapy for COVID-19,0.14870292703507834,convalescent plasma as a potential therapy for covid-19,Bevacizumab,Can Bevacizumab treat COVID-19
792,6g34qwer,1119,drug,Methods: All patients received recommended strategy from Diagnosis and Treatment for 2019 Novel Coronavirus Diseases released by National Health Commission of China.,0.1487007792660557,all patients received recommended strategy from diagnosis and treatment for 2019 novel coronavirus diseases,TAF,Can TAF treat COVID-19
793,8gncbgot,59,drug,"However, serological assays as well as point-of-care testing kits have not been developed but are likely in the near future.",0.14869682245866378,serological assays as well as point-of-care testing kits have not been developed but are likely in the near future,TAF,Can TAF treat COVID-19
794,5xyt8d5u,908,drug,: Coronavirus Disease 2019 (COVID-19) caused by Severe Acute Respiratory Syndrome Coronavirus -2 (SARS-CoV-2) infection has been widely spread.,0.1486917534209154,coronavirus disease 2019,Losartan,Can Losartan treat COVID-19
795,ztcyvsoi,1179,drug,There is a new public health crises threatening the world with the emergence and spread of 2019 novel coronavirus (2019-nCoV) or the severe acute respiratory syndrome coronavirus 2 (SARS-CoV-2).,0.1486909569134415,severe acute respiratory syndrome coronavirus 2,Losartan,Can Losartan treat COVID-19
796,p1w3p80y,876,drug,"The number of diagnosed cases is more than 40,000 until the submission of this manuscript.",0.1486887631771575,"the number of diagnosed cases is more than 40 , 000 until the submission of this manuscript",TAF,Can TAF treat COVID-19
797,d52yx420,250,drug,Coronavirus disease (COVID-19): The need to maintain regular physical activity while taking precautions,0.14868101585806676,coronavirus disease ( covid-19 ) : the need to maintain regular physical activity while taking precautions,Losartan,Can Losartan treat COVID-19
798,c4pcztdc,201,drug,"Angiotensin-converting enzyme 2 (ACE2) was found to be the receptor of 2019-nCoV.This review provides a brief overview of human coronavirus receptors and their applications, with a view to providing references for the tracing, cross-species transmission, epidemiological analysis and antiviral and vaccine studies of 2019-nCoV.",0.14867515016002508,antiviral,TAF,Can TAF treat COVID-19
799,a6p6ka8w,404,drug,"Measurements: We extracted tweets matching hashtags related to COVID-19 and measured frequency of keywords related to infection prevention practices, vaccination, and racial prejudice.",0.14867402260892384,"measurements : we extracted tweets matching hashtags related to covid-19 and measured frequency of keywords related to infection prevention practices , vaccination , and racial prejudice",Losartan,Can Losartan treat COVID-19
800,ptnmtvzj,1003,drug,"Conclusion: The current evidence for the effectiveness and safety of antiviral therapies for coronavirus is inconclusive and suffers from a lack of well-designed prospective trials or observational studies, preventing any treatment recommendations from being made.",0.14866809929488373,preventing any treatment recommendations from being made,Traditional Chinese Medicine,Can Traditional Chinese Medicine treat COVID-19
801,rziv5342,204,drug,The WHO named the disease COVID-19 on 11 February 2020.,0.14865993376895306,who named the disease covid-19,Losartan,Can Losartan treat COVID-19
802,80m78jh2,74,drug,"In the present study we have screened 38 CTL, 42 HTL and 12 B cell epitopes by utilizing different in silico tools.",0.14865790179727656,"38 ctl , 42 htl and 12 b cell epitopes",Losartan,Can Losartan treat COVID-19
803,13jupb26,336,drug,KRSFIEDLLFNKV was found to be particularly well conserved in this study and corresponds to the region around one of the known cleavage sites of the SARS virus that are believed to be required for virus activation for cell entry.,0.14865503941609726,krsfiedllfnkv was found to be particularly well conserved in this study and corresponds to the region around one of the known cleavage sites of the sars virus,velpatasvir,Can velpatasvir treat COVID-19
804,rziv5342,203,drug,A novel coronavirus was reported to the World Health Organization (WHO) in China on 31 December 2019.,0.1486547211303025,coronavirus was reported to the world health organization ( who ) in china,Losartan,Can Losartan treat COVID-19
805,1mmqfp7g,663,drug,The viral 3-chymotrypsin-like cysteine protease (3CLpro) enzyme controls coronavirus replication and is essential for its life cycle.,0.14864264626716125,coronavirus,lopinavir/ritonavir,Can lopinavir/ritonavir treat COVID-19
