,pid,newpid,category,sent,newscore,answer,keyword,question
283,b1iyr42n,143,drug,The structural divergence was determined by using SuperPose Version 1.0 based on cryo-EM structure of the SARS coronavirus spike glycoprotein.,0.15184179500128425,coronavirus,lopinavir/ritonavir,Can lopinavir/ritonavir treat COVID-19
284,ork04nx8,500,drug,The novel Coronavirus (SARS-CoV-2) is a one health issue,0.15184038385970755,the novel coronavirus ( sars-cov-2 ) is a one health issue,Naproxen,Can Naproxen treat COVID-19
285,1yka7ej9,843,drug,The PRCC method is used to analyze the sensitivities of model parameters and the drug effects on virus growth are also implemented to analyze the model.,0.15182248860574254,drug effects on virus growth,Vitamin C,Can Vitamin C treat COVID-19
286,hicqy5sj,258,drug,"In addition, the spike protein of 2019-nCoV shows a significantly lower free energy than that of SARS-CoV, suggesting that 2019-nCoV is more stable and able to survive a higher temperature than SARS-CoV.",0.15181292833564702,2019-ncov is more stable and able to survive a higher temperature than sars-cov .,Losartan,Can Losartan treat COVID-19
287,7e8zlt3t,486,drug,Combinational therapy may help to reduce the effective concentration of compounds below the therapeutic plasma concentrations and provide better clinical benefits.,0.15181045389259135,combinational therapy may help to reduce the effective concentration of compounds below the therapeutic plasma concentrations,AZT,Can AZT treat COVID-19
288,yqiggzk9,966,drug,We try to describe the epidemiological and clinical characteristics of COVID-19 in non-Wuhan area，and explore its effective treatment.,0.15180939939946464,explore its effective treatment,TAF,Can TAF treat COVID-19
289,gu2mt6zp,118,drug,This virus is responsible for the ongoing outbreak that causes severe respiratory illness and pneumonia-like infection in humans.,0.15180586120065054,this virus,sirolimus,Can sirolimus treat COVID-19
290,szsb1oan,248,drug,"Unfortunately, emergence of SARS-CoV-2 has led to numerous reports of Asians being subjected to racist behavior and hate crimes across the world.",0.15180237632306534,sars-cov-2,RhACE2,Can RhACE2 treat COVID-19
291,qopcs6jy,1084,drug,We evaluate 11 complete genome sequence of different coronavirus using BAST and MAFFT software.,0.15180173709092898,coronavirus,Remdesivir,Can Remdesivir treat COVID-19
292,hi38itc9,1106,drug,38 cases had a history of chronic diseases.,0.15179816522653322,38 cases had a history of chronic diseases,Naproxen,Can Naproxen treat COVID-19
293,b1iyr42n,138,drug,"Therefore, the present study has been planned to determine the sequence variation, structural and antigenic divergence of S glycoprotein which may be helpful for the management of 2019-nCoV infection.",0.1517940884524804,2019-ncov infection,Naproxen,Can Naproxen treat COVID-19
294,b518n9dx,720,drug,"We started from the structure, immunogenicity, and pathogenesis of coronavirus infections of the novel coronavirus.",0.15179323881407647,coronavirus infections of the novel coronavirus,Losartan,Can Losartan treat COVID-19
295,2hgwa6pq,686,drug,• Integrin may act as an alternative receptor for SARS-CoV-2 and could be implicated in its transmission and pathology.,0.15179195961452746,integrin may act as an alternative receptor for sars-cov-2 and could be implicated in its transmission and pathology,Recombinant human angiotensin- converting enzyme 2,Can Recombinant human angiotensin- converting enzyme 2 treat COVID-19
296,z0qzgu5m,601,drug,"Three drugs-cepharanthine (CEP), selamectin and mefloquine hydrochloride exhibited complete inhibition of cytopathic effects in cell culture at 10 μmol/L.",0.15179155736654376,inhibition of cytopathic effects,Vitamin C,Can Vitamin C treat COVID-19
297,xieqswct,766,drug,We designed and screened a group of CRISPR RNAs (crRNAs) targeting conserved viral regions and identified functional crRNAs for cleaving SARS-CoV-2.,0.1517839387495179,cleaving sars-cov-2,APN01,Can APN01 treat COVID-19
298,647zcjgu,771,drug,We performed a structural analysis of the receptor binding domain (RBD) of spike glycoprotein responsible for entry of coronaviruses into host cells.,0.1517811970253795,coronaviruses into host cells,Losartan,Can Losartan treat COVID-19
299,6g34qwer,1115,drug,"Background: SARS-CoV-2 is a novel human coronavirus, there is no specific antiviral drugs.",0.15177145034888462,there is no specific antiviral drugs,AZT,Can AZT treat COVID-19
300,4pxmr5cw,388,drug, This letter aims to describe how Korea can improve its emergency response to the outbreak of COVID-19.,0.15176982073878376,korea can improve its emergency response to the outbreak of covid-19,Losartan,Can Losartan treat COVID-19
301,0xhho1sh,673,drug,"Among patients with pneumonia caused by SARS-CoV-2 (novel coronavirus pneumonia or Wuhan pneumonia), fever was the most common symptom, followed by cough.",0.15176795503402352,pneumonia caused by sars-cov-2,Recombinant human angiotensin- converting enzyme 2,Can Recombinant human angiotensin- converting enzyme 2 treat COVID-19
302,4pxmr5cw,390,drug,"Similarly, neighboring nations could form a national framework of networks among stakeholders.",0.15176663139841215,neighboring nations could form a national framework of networks among stakeholders,efavirenz,Can efavirenz treat COVID-19
303,yb5kf0u2,47,drug,"Most importantly, these MNA delivered SARS-CoV-2 S1 subunit vaccines elicited potent antigen-specific antibody responses that were evident beginning 2 weeks after immunization.",0.1517633388205594,sars-cov-2 s1 subunit vaccines,TAF,Can TAF treat COVID-19
304,nn15iyqd,1067,drug,"It shares homology with SARS and MERS-CoV, responsible for past outbreaks in China and in Middle East.",0.15173658017226938,it shares homology with sars and mers-cov,TAF,Can TAF treat COVID-19
305,b31ctbat,659,drug,Possible targets of these compounds and potential drugs acting on a certain target were predicted.,0.15173237162394193,possible targets of these compounds and potential drugs acting on a certain target,Tranexamic acid tablets,Can Tranexamic acid tablets treat COVID-19
306,szsb1oan,237,drug, The 2019-nCoV is officially called SARS-CoV-2 and the disease is named COVID-19.,0.15171716859302015,the 2019-ncov is officially called sars-cov-2 and the disease is named covid-19,Recombinant human angiotensin- converting enzyme 2,Can Recombinant human angiotensin- converting enzyme 2 treat COVID-19
307,7jkzbmsf,791,drug,"The hospital pharmacy department timely adjusted the work mode, and the formed management practices is a powerful guarantee for the prevention and control of the COVID-19 epidemic.",0.15171622801353468,"the hospital pharmacy department timely adjusted the work mode , and the formed management practices is a powerful guarantee for the prevention and control of the covid-19 epidemic",Tocilizumab,Can Tocilizumab treat COVID-19
308,qopcs6jy,1080,drug,SARS-CoV-2 is closest to SARS-CoV and MERS-CoV in structure.,0.15171495148007827,sars-cov-2,Huaier Granule,Can Huaier Granule treat COVID-19
309,ctd9sutv,223,drug,One possible answer is antibody dependent enhancement (ADE) of SARS-CoV-2 due to prior exposure to other coronaviruses.,0.15171162551698242,one possible answer is antibody dependent enhancement ( ade ) of sars-cov-2 due to prior exposure to other coronaviruses,Recombinant human angiotensin- converting enzyme 2,Can Recombinant human angiotensin- converting enzyme 2 treat COVID-19
310,7jkzbmsf,787,drug,"During the outbreak, the pharmaceutical department of THJU completed its assigned workload to ensure drug supply.",0.1516975818226466,pharmaceutical department of thju completed its assigned workload to ensure drug supply,TAF,Can TAF treat COVID-19
311,6lngz7y1,1014,drug,The infection may result into severe pneumonia with clusters illness onsets.,0.1516891167768461,severe pneumonia,Naproxen,Can Naproxen treat COVID-19
312,a6p6ka8w,397,drug,Background: Twitter has been used to track trends and disseminate health information during viral epidemics.,0.15168168426549306,twitter,TAF,Can TAF treat COVID-19
313,535lw99y,373,drug,"Interestingly, we found that the slower association between virus and receptor can result in longer incubation period, while still maintaining a relatively higher level of viral concentration in human body.",0.15167725753326233,slower association between virus and receptor can result in longer incubation period,Aspirin,Can Aspirin treat COVID-19
314,8o6yjxwe,958,drug,"Therefore, liver function monitoring and evaluation should be strengthened during the treatment of such patients.",0.15166287735925366,liver function monitoring and evaluation should be strengthened during the treatment of such patients,Traditional Chinese Medicine,Can Traditional Chinese Medicine treat COVID-19
315,ejg393zs,286,drug,"After extensive speculation, eventually a new species of coronavirus introduced as the causative pathogen of the disease.",0.1516607913002692,coronavirus,Anakinra,Can Anakinra treat COVID-19
316,fvig79k3,855,drug,"Furthermore, site prediction on the surface glycoprotein of 2019-nCoV suggests some core amino acid area may be a novel drug target against 2019-nCoV.",0.15164549211540784,may be a novel drug target against 2019-ncov .,Naproxen,Can Naproxen treat COVID-19
317,uifnjio5,468,drug,The levels and the time course of SARS-CoV-2-specific NAbs and the spike-binding antibodies were monitored at the same time.,0.15163489279646447,cov-2,RhACE2,Can RhACE2 treat COVID-19
318,yqiggzk9,982,drug,"For the treatment of COVID-19, in addition to oxygen inhalation and antiviral treatment, attention should be paid to the dialectical treatment of traditional Chinese medicine, regulation of intestinal flora, nutritional support treatment and other comprehensive treatment.",0.15161367572436718,for the treatment of covid-19,Naproxen,Can Naproxen treat COVID-19
319,ejg393zs,298,drug,The mortality rate in healthy subjects is less than 1%.,0.15159404831760814,the mortality rate in healthy subjects,Traditional Chinese Medicine,Can Traditional Chinese Medicine treat COVID-19
320,hicqy5sj,257,drug,"It was shown that the RBD-ACE2 binding free energy for 2019-nCoV is significantly lower than that for SARS-CoV, which is consistent with the fact that 2019-nCoV is much more infectious than SARS-CoV.",0.15158321210377984,2019-ncov is much more infectious,Recombinant human angiotensin- converting enzyme 2,Can Recombinant human angiotensin- converting enzyme 2 treat COVID-19
321,6rs86u5v,1134,drug,There is a high mortality and long hospitalization period for severe cases with 2019 novel coronavirus disease (COVID-19) pneumonia.,0.15156975310416368,there is a high mortality and long hospitalization period for severe cases with 2019 novel coronavirus disease ( covid-19 ) pneumonia,Losartan,Can Losartan treat COVID-19
322,1qniriu0,585,drug,"Currently, there is no effective treatment for this epidemic.",0.1515639958157644,there is no effective treatment,Naproxen,Can Naproxen treat COVID-19
323,9igk3ke1,393,drug,The individual preventive and protective measures drive the personal risk of getting the disease.,0.15155500435948088,individual preventive and protective measures,TAF,Can TAF treat COVID-19
324,6y9n69g5,798,drug,"There are other 16 nonstructural proteins (NSPs), which can also be considered from the drug design perspective.",0.1515481772022649,"nonstructural proteins ( nsps ) , which can also be considered from the drug design perspective",Losartan,Can Losartan treat COVID-19
325,6lngz7y1,1026,drug,CT scan may be a reliable test for screening NCOVID-19 cases.,0.15154247692214384,ct scan may be a reliable test for screening ncovid-19 cases,Naproxen,Can Naproxen treat COVID-19
326,da61tfr9,824,drug,SARS-CoV-2 is the aetiological agent of coronavirus disease 2019 (COVID-19) characterised by pulmonary infection in humans.,0.15154137341623106,sars-cov-2 is the aetiological agent of coronavirus disease 2019,Recombinant human angiotensin- converting enzyme 2,Can Recombinant human angiotensin- converting enzyme 2 treat COVID-19
327,hicqy5sj,262,drug,"With the rising temperature, 2019-nCoV is expected to decrease its infection ability much faster than SARS-CoV, and get controlled more easily.",0.151533654463633,"ncov is expected to decrease its infection ability much faster than sars-cov , and get controlled more easily",Losartan,Can Losartan treat COVID-19
328,80m78jh2,73,drug,The effective countermeasures against SARS-CoV-2 infection requires the design and development of specific and effective vaccine candidate.,0.15153153337482328,effective countermeasures against sars-cov-2 infection,BCG Vaccine,Can BCG Vaccine treat COVID-19
329,uifnjio5,477,drug,"The correlation of NAb titers with age, lymphocyte counts, and blood CRP levels suggested that the interplay between virus and host immune response in coronavirus infections should be further explored for the development of effective vaccine against SARS-CoV-2 virus.",0.15152245732545425,effective vaccine against sars-cov-2 virus,BCG Vaccine,Can BCG Vaccine treat COVID-19
330,wbxtz30s,419,drug,"Whereas pregnant women infected with coronavirus may have an increased risk of adverse neonatal outcomes, gametes do not transmit COVID-19.",0.1515209091777286,gametes do not transmit covid-19,Naproxen,Can Naproxen treat COVID-19
331,xhachzby,553,drug,These structures will form the basis for further development of these compounds to antiviral drugs.,0.15151024450013473,antiviral drugs,Vitamin C,Can Vitamin C treat COVID-19
332,fmumym1x,170,drug,"It is worth mentioning that all of the 6 dominated epitopes were absolutely conservative in nearly 1000 SARS-CoV-2 genomes, and they deserved further study.",0.15150986613379536,sars-cov-2,TAF,Can TAF treat COVID-19
333,ztcyvsoi,1192,drug,The global impact of this new epidemic is yet uncertain.,0.15149708305035448,the global impact of this new epidemic is yet uncertain,Bevacizumab,Can Bevacizumab treat COVID-19
334,ld0vo1rl,6,drug,"Besides the commonly used S protein, the nsp3 protein has not been tested in any coronavirus vaccine studies and was selected for further investigation.",0.1514966374168477,nsp3 protein has not been tested in any coronavirus vaccine studies,TAF,Can TAF treat COVID-19
335,athjtu2j,984,drug,How to face this new coronavirus epidemic outbreak is an important issue.,0.15149649131605386,coronavirus,Remdesivir,Can Remdesivir treat COVID-19
336,1cc9ig04,964,drug,"Further, we also provide basic characteristics of the system.",0.15149441028061722,basic characteristics of the system,Budesonide,Can Budesonide treat COVID-19
337,qdt90c22,544,drug,"Furthermore, broad library protease inhibitors obtained from PubChem and ZINC (www.zinc.docking.org) were evaluated.",0.15149393013971635,broad library protease inhibitors,TAF,Can TAF treat COVID-19
338,uifnjio5,469,drug,Findings SARS-CoV-2 NAbs were unable to cross-reactive with SARS-CoV virus.,0.1514885447915758,findings sars-cov-2 nabs were unable to cross-reactive with sars-cov virus,Losartan,Can Losartan treat COVID-19
339,a5udnv5f,346,drug,"Herein, the host immune responses against SARS-CoV discussed in this review provide implications for developing NAbs and understanding clinical interventions against SARS-CoV-2.",0.15147762637265433,clinical interventions against sars-cov-2,Recombinant human angiotensin- converting enzyme 2,Can Recombinant human angiotensin- converting enzyme 2 treat COVID-19
340,aeuy92bx,493,drug,Both fusion proteins has high affinity binding to the receptor-binding domain (RBD) of SARS-CoV and 2019-nCoV and exerted desired pharmacological properties.,0.15147229614473862,2019-ncov,Naproxen,Can Naproxen treat COVID-19
341,w84qtud6,892,drug,At the moment there is no available drug(s) and vaccine(s) for the treatment or prevention of COVID-19.,0.15146566145238052,no available drug ( s ) and vaccine ( s ) for the treatment or prevention of covid-19,DAS181,Can DAS181 treat COVID-19
342,vj2z52vg,456,drug,Public health authorities are monitoring the situation closely.,0.15146149991416208,public health authorities are monitoring the situation closely,TAF,Can TAF treat COVID-19
343,9595vm0k,323,drug,"Using serum samples from patients with PCR-confirmed infections of SARS-CoV-2, other coronaviruses, or other respiratory pathogenic infections, we validated and tested various antigens in different in-house and commercial ELISAs.",0.15143940382631416,using serum samples from patients with pcr-confirmed infections of sars-cov-2,TAF,Can TAF treat COVID-19
344,9595vm0k,321,drug,"Validated serologic assays are important for contact tracing, identifying the viral reservoir and epidemiological studies.",0.15143861530703784,viral,Anakinra,Can Anakinra treat COVID-19
345,t996fbad,699,drug,Our results suggest a number of potential diagnosis biomarkers and angiotensin receptor blocker (ARB) drugs for potential repurposing treatment of 2019-nCoV infection.,0.15143446873618527,potential repurposing treatment of 2019-ncov infection,APN01,Can APN01 treat COVID-19
346,6g34qwer,1116,drug,It has been proved that host-cell-expressed CD147 could bind spike protein of SARS-CoV-2 and involve in host cell invasion.,0.1514263790028192,it has been proved that host-cell-expressed cd147 could bind spike protein of sars-cov-2 and involve in host cell invasion,Recombinant human angiotensin- converting enzyme 2,Can Recombinant human angiotensin- converting enzyme 2 treat COVID-19
347,uifnjio5,464,drug,"Currently, neutralizing antibodies (NAbs) versus this virus are expected to correlate with recovery and protection of this disease.",0.15142187521465994,neutralizing antibodies,TAF,Can TAF treat COVID-19
348,hicqy5sj,261,drug,That means that 2019-nCoV will be much more temperature-sensitive in terms of human infection than SARS-CoV.,0.1514112327449642,2019-ncov will be much more temperature-sensitive,Losartan,Can Losartan treat COVID-19
349,ljli6a2z,356,drug,"In this study, we propose a compression-complexity based distance measure for automatic identification of SARS coronavirus strains from a set of viruses using only short fragments of nucleotide sequences.",0.1513995842871754,compression-complexity based distance measure for automatic identification of sars coronavirus strains,AZT,Can AZT treat COVID-19
350,za3qypgg,640,drug,"Although there are potential targets in the JAK-STAT pathway that can be manipulated in treatment for coronaviruses and it is evident that IL-1 is elevated in patients with a coronavirus, there is currently no evidence for a role of these drugs in treatment of COVID-19.",0.15138625095204522,there is currently no evidence for a role of these drugs in treatment of covid-19,WJ-MSCs,Can WJ-MSCs treat COVID-19
351,a6p6ka8w,412,drug,Conclusion: Tweets with negative sentiment and emotion parallel the incidence of cases for the COVID-19 outbreak.,0.15138591472974094,covid-19,halidomide,Can halidomide treat COVID-19
352,uifnjio5,465,drug,"However, the characteristics of these antibodies have not been well studied in association with the clinical manifestations in patients.",0.15138585504869556,antibodies,Aspirin,Can Aspirin treat COVID-19
353,szsb1oan,245,drug,Lessons learned from SARS resulted in faster determination of the nucleic acid sequence and a more robust quarantine strategy.,0.15138268265486846,faster determination of the nucleic acid sequence and a more robust quarantine strategy,Vitamin D,Can Vitamin D treat COVID-19
354,m40kwgcg,1200,drug,2019-nCoV was detected in all patients by real-time RT-PCR.,0.15136697832109874,2019,TAF,Can TAF treat COVID-19
355,p5ecpcll,736,drug,The nutritional status of patients with common and mild pneumonia should be considered.,0.15136139426853654,the nutritional status of patients with common and mild pneumonia,Vitamin C,Can Vitamin C treat COVID-19
356,13akn7dm,713,drug,"Therefore, to better understand the development of COVID-19 and the impacts of cardiovascular diseases will add valuable measures to the management of COVID-19 patients.",0.15134772638695645,will add valuable measures to the management of covid-19 patients,TAF,Can TAF treat COVID-19
357,hicqy5sj,260,drug,"It was also revealed that the RBD of 2019-nCoV is much more flexible especially near the binding site and thus will have a higher entropy penalty upon binding ACE2, compared to the RBD of SARS-CoV.",0.15134520777668858,sars-cov,TAF,Can TAF treat COVID-19
358,9595vm0k,322,drug,"Here, we developed serological assays for the detection of SARS-CoV-2 neutralizing, spike- and nucleocapsid-specific antibodies.",0.1513420622860216,"neutralizing , spike-and nucleocapsid-specific antibodies",TAF,Can TAF treat COVID-19
359,yqiggzk9,979,drug,"The main clinical symptoms of patients with COVID-19 were fever, cough and asthenia，Some patients had obvious dyspnea.",0.1513338109847912,some patients had obvious dyspnea,Traditional Chinese Medicine,Can Traditional Chinese Medicine treat COVID-19
360,0lyxvex0,515,drug,The responders had a moderate level of knowledge about the COVID-19 infection and adequate knowledge about its preventive aspects.,0.1513234672223981,the responders had a moderate level of knowledge about the covid-19 infection and adequate knowledge about its preventive aspects,TAF,Can TAF treat COVID-19
361,a5udnv5f,343,drug,"Epidemiology, genomics, and pathogenesis of the SARS-CoV-2 show high homology with that of SARS-CoV.",0.1513052036892156,sars-cov-2,Recombinant human angiotensin- converting enzyme 2,Can Recombinant human angiotensin- converting enzyme 2 treat COVID-19
362,za3qypgg,633,drug,": Cancer and transplant patients with COVID-19 have a higher risk of developing severe and even fatal respiratory diseases, especially as they may be treated with immune-suppressive or immune-stimulating drugs.",0.1513048435152901,may be treated with immune-suppressive or immune-stimulating drugs,AZT,Can AZT treat COVID-19
363,b1iyr42n,149,drug,"Further, demonstration of novel Cytotoxic T lymphocyte epitopes may impart opportunities for the development of peptide based vaccine for the prevention of 2019-nCoV.",0.15130465292737874,prevention of 2019-ncov,TAF,Can TAF treat COVID-19
364,8eh90ber,538,drug,We reviewed TH17 responses in patients with SARS-CoV-2 and proposed an FDA approved JAK2 inhibitor Fedratinib for reducing mortality of patients with TH17 type immune profiles.,0.1513026435664959,proposed an fda approved jak2 inhibitor fedratinib for reducing mortality of patients with th17 type immune profiles,TAF,Can TAF treat COVID-19
365,190zxwwj,1050,drug,Conclusions Cancer patients show deteriorating conditions and poor outcomes from the COVID-19 infection.,0.15130254160905404,cancer patients show deteriorating conditions and poor outcomes,Losartan,Can Losartan treat COVID-19
366,rxrlbw60,103,drug,We offer a research perspective on the next steps for the generation of vaccines.,0.1513008325558844,vaccines,Losartan,Can Losartan treat COVID-19
367,zb434ve3,755,drug," The infection of a novel coronavirus found in Wuhan of China (SARS-CoV-2) is rapidly spreading, and the incidence rate is increasing worldwide.",0.15129459197563785,sars-cov-2,Recombinant human angiotensin- converting enzyme 2,Can Recombinant human angiotensin- converting enzyme 2 treat COVID-19
368,2hgwa6pq,690,drug,"• Integrin binding may be a promising therapeutics target, and should be tested experimentally.",0.15128609469437365,integrin binding may be a promising therapeutics target,TAF,Can TAF treat COVID-19
369,2uvibr2j,26,drug,Highly antigenic and overlapping epitopes were shortlisted.,0.15126466216790252,highly antigenic and overlapping epitopes,Kaletra,Can Kaletra treat COVID-19
370,xieqswct,767,drug,The approach is effective in reducing respiratory cell viral replication for H1N1 IAV.,0.15126332151701394,reducing respiratory cell viral replication,BCG Vaccine,Can BCG Vaccine treat COVID-19
371,uifnjio5,467,drug,"Spike-binding antibody in plasma were determined by ELISA using RBD, S1, and S2 proteins of SARS-CoV-2.",0.1512606800877246,sars-cov-2,RhACE2,Can RhACE2 treat COVID-19
372,b31ctbat,654,drug,"Because of time consuming process of new drug development, drug repositioning may be the only solution to the epidemic of sudden infectious diseases.",0.1512604828142075,may be the only solution to the epidemic of sudden infectious diseases .,Recombinant human angiotensin- converting enzyme 2,Can Recombinant human angiotensin- converting enzyme 2 treat COVID-19
373,yb5kf0u2,49,drug,Progressive scientific and technological efforts enable quicker responses to emerging pandemics.,0.15125679104596448,progressive scientific and technological efforts enable quicker responses to emerging pandemics,saquinavir,Can saquinavir treat COVID-19
374,2tu707ng,219,drug,"In conclusion, we suggest that all the potential interventions be implemented to control the emerging COVID-19 if the infection is uncontrollable.",0.15125669854067925,if the infection is uncontrollable,velpatasvir,Can velpatasvir treat COVID-19
375,aeuy92bx,489,drug,"Very recently report had suggested that novel CoV would use the same cell entry receptor, ACE2, as the SARS-CoV.",0.1512563295617726,"novel cov would use the same cell entry receptor , ace2 , as the sars-cov",TAF,Can TAF treat COVID-19
376,ld0vo1rl,0,drug,"To ultimately combat the emerging COVID-19 pandemic, it is desired to develop an effective and safe vaccine against this highly contagious disease caused by the SARS-CoV-2 coronavirus.",0.15124880692711962,to ultimately combat the emerging covid-19 pandemic,velpatasvir,Can velpatasvir treat COVID-19
377,gu2mt6zp,122,drug,Neither an effective anti-viral nor a vaccine is currently available to treat this infection.,0.15123183432526802,neither an effective anti-viral nor a vaccine is currently available,velpatasvir,Can velpatasvir treat COVID-19
