,sent
137,"Background: To identify safe and effective medical countermeasures (e.g., antivirals/antibodies) to address the current outbreak of a novel coronavirus (COVID-19) Methods: Comprehensive literature searches were developed by an experienced librarian for MEDLINE, EMBASE, the Cochrane Library, and biorxiv.org/medrxiv.org; additional searches for ongoing trials and unpublished studies were conducted in clinicaltrials.gov and the Global Infectious Diseases and Epidemiology Network (GIDEON)."
138,"In the absence of a known efficient therapy and because of the situation of a public-health emergency, it made sense to investigate the possible effect of chloroquine/hydroxychloroquine against SARS-CoV-2 since this molecule was previously described as a potent inhibitor of most coronaviruses, including SARS-CoV-1."
139,"Prezcobix/Rezolsta is a fixed-dose combination of 800 mg of the HIV protease inhibitor darunavir (DRV) and 150 mg cobicistat, a CYP3A4 inhibitor, which is indicated in combination with other antiretroviral agents for the treatment of HIV infection."
140,"In the difficulty where new synthesized drug cannot be applied immediately to patients, “conventional drug in new use” has become a feasible solution."
141,"(§) Also on January 31, the president of the United States signed a ""Proclamation on Suspension of Entry as Immigrants and Nonimmigrants of Persons who Pose a Risk of Transmitting 2019 Novel Coronavirus,"" which limits entry into the United States of persons who traveled to mainland China to U.S. citizens and lawful permanent residents and their families (3)."
142,"An ongoing outbreak of pneumonia caused by a novel coronavirus, currently designated as the severe acute respiratory syndrome coronavirus-2 (SARS-CoV-2), was reported recently."
143,"Coronavirus has caused several epidemic situations world widely, but the present contagious disease caused by 2019 new Coronavirus is unprecedentedly fulminating."
144,Puzzle of highly pathogenic human coronaviruses (2019-nCoV)
145,"Since the outbreak of the novel coronavirus disease COVID-19, caused by the SARS-CoV-2 virus, this disease has spread rapidly around the globe."
146,"A new coronavirus, SARS-CoV-2, has recently emerged to cause a human pandemic."
147,"This virus causes acute lung symptoms, leading to a condition that has been named as &ldquo;coronavirus disease 2019&rdquo; (COVID-19)."
148,"The CDC designed and manufactured the test kit, which detects the RNA genome of the virus, called severe acute respiratory syndrome coronavirus 2 (SARS-CoV-2)."
149,"The cases reported to date suggest that most are older adults; it is currently unclear whether comorbidities reflect the age group affected or whether they are risk factors for severe disease.4, 5 Early studies using data before the institution of public health interventions in China suggest that SARS‐CoV‐2 is as transmissible as SARS coronavirus and probably more transmissible than influenza viruses.6, 7 The timing of infectiousness relative to symptom onset is a particularly important parameter with implications for public health control."
150,"With the possibility that a considerable proportion of the world’s population soon could receive COVID-19 pharmacotherapies with torsadogenic potential for therapy or postexposure prophylaxis, this document serves to help health care professionals mitigate the risk of drug-induced ventricular arrhythmias while minimizing risk of COVID-19 exposure to personnel and conserving the limited supply of personal protective equipment."
151,"Further investigation revealed these cases to result from infection with a newly identified coronavirus, termed the 2019-nCoV."
152,"ABSTRACTThe outbreak of the coronavirus disease 2019 (COVID-19), caused by the Severe Acute Respiratory Syndrome coronavirus 2 (SARS-CoV-2), has infected more than 100,000 people worldwide with over 3,000 deaths since December 2019."
153,"Herein we scrutinize a series of available studies by global scientists on the clinical manifestations, detection methods and treatment options of 2019 novel coronavirus pneumonia, also propose potential strategies for preventing the infection."
154," At the end of December 2019, a novel coronavirus, 2019-nCoV, caused an outbreak of pneumonia spreading from Wuhan, Hubei province, to the whole country of China, which has posed great threats to public health and attracted enormous attention around the world."
155,"An emerging coronavirus causing pneumonia outbreak in Wuhan, China: calling for developing therapeutic and prophylactic strategies"
156,Our bioinformatic analysis showed a group of only six crRNAs can target more than 90% of all coronaviruses.
157,Chloroquine for the 2019 novel coronavirus SARS-CoV-2
158," The novel Coronavirus disease 2019 (COVID-19) is caused by SARS-CoV-2, which is the causative agent of a potentially fatal disease that is of great global public health concern."
159,The emergence of SARS-CoV-2 has been marked as the third introduction of a highly pathogenic coronavirus into the human population after the severe acute respiratory syndrome coronavirus (SARS-CoV) and the Middle East respiratory syndrome coronavirus (MERS-CoV) in the twenty-first century.
160,"The virus spreads faster than its two ancestors the SARS-CoV and Middle East respiratory syndrome coronavirus (MERS-CoV), but has lower fatality."
161,"Besides the commonly used S protein, the nsp3 protein has not been tested in any coronavirus vaccine studies and was selected for further investigation."
162,This motif is absent from other coronaviruses.
163,"Based on our molecular insight that the hepatitis C virus and the coronavirus use a similar viral genome replication mechanism, we reasoned that the FDA-approved drug EPCLUSA (Sofosbuvir/Velpatasvir) for the treatment of hepatitis C will also inhibit the above coronaviruses, including 2019-nCoV."
164, Aims To analyze the potential mechanism of cardiovascular dysfunctions induced by Coronavirus Disease 2019 (COVID-19) and to evaluate more effective therapeutic pathways for patients with cardiovascular diseases.
165,"The goal of this review is to provide a timely overview on efforts to develop a vaccine for the 2019 novel coronavirus SARS-CoV-2, the causative agent of coronavirus disease (COVID-19)."
166,How to face this new coronavirus epidemic outbreak is an important issue.
167,There are currently no registered therapies for treating coronavirus infections.
168,"More than 500 patents disclose methodologies of these four biologics with the potential for treating and preventing coronavirus infections, which may be applicable to COVID-19."
169,"The first cases were noted as a cluster of patients with pneumonia who were all linked to a live animal market, and testing found the presence of a previously unknown coronavirus."
170,2019-nCoV is a newly identified coronavirus with high similarity to SARS-CoV.
171,"Coronavirus is an enveloped RNA virus, from the genus Betacoronavirus, that is distributed in birds, humans, and other mammals."
172,"COVID-19 is compared with two related coronavirus epidemics, SARS and MERS, in terms of the number of reported human infections, deaths, countries, major country clusters, timelines, and the likelihood of discovering a safe, effective, and approved vaccine."
173,"Coronavirus disease 2019 (COVID-19) is a name for the disease, and the virus that causes it is known SARS-CoV-2."
174,"Involved in the formation of the coronavirus replication complex, the viral main protease (Mpro, also called 3CLpro) represents an attractive target for therapy."
175,"The coronavirus spike (S) protein, a characteristic structural component of the viral envelope, is considered a key target for vaccines for the prevention of coronavirus infection."
176,An Imperative Need for Research on the Role of Environmental Factors in Transmission of Novel Coronavirus (COVID-19)
177,"In this regard, we conducted a systematic review to identify major druggable targets in coronavirus (CoV)."
178,"This is the third serious Coronavirus outbreak in less than 20 years, following SARS in 2002–2003 and MERS in 2012."
179,"Starting from December 2019, a novel coronavirus, named 2019-nCoV, was found to cause Severe Acute Respiratory (SARI) symptoms and rapid pandemic in China."
180,"Our data suggests that 2019-nCoV is newly spilled coronavirus into humans in China is closely related to SARS-CoV, which has only 12.8% of difference with SARS-CoV in S protein and has 83.9% similarity in minimal receptor-binding domain with SARS-CoV."
181," Background Coronaviruses pose a serious threat to global health as evidenced by Severe Acute Respiratory Syndrome (SARS), Middle East Respiratory Syndrome (MERS), and COVID-19."
182,We here share the therapeutic experiences of NCP treatment with literature review.
183,This recent emergence of a previously unknown coronavirus in China leads to huge impacts on humans globally.
184,"However, it is clear that the existing body of evidence is weighted heavily towards ribavirin (41/54 studies), which has not shown conclusive evidence of effectiveness and may cause harmful adverse events so future investigations may consider focusing on other candidates for antiviral therapy."
185,"This paper aggregates and consolidates the epidemiology, clinical manifestations, diagnosis, treatments and preventions of this new type of coronavirus."
186,"Furthermore, titration of NAb is helpful prior to the use of convalescent plasma for prevention or treatment."
187, One of the most perplexing questions regarding the current COVID-19 coronavirus epidemic is the discrepancy between the severity of cases observed in the Hubei province of China and those occurring elsewhere in the world.
188,"To date, there are no clinically approved vaccines or antiviral drugs available for these human coronavirus infections."
189,"Among patients with pneumonia caused by SARS-CoV-2 (novel coronavirus pneumonia or Wuhan pneumonia), fever was the most common symptom, followed by cough."
190,Coronavirus disease 2019 (COVID-19) is a highly infective disease caused by the severe acute respiratory syndrome coronavirus 2 virus (SARS-CoV-2).
191," Aims A newly emerged Human Coronavirus (HCoV) is reported two months ago in Wuhan, China (COVID-19)."
192,"In order to assess the potential of the Wuhan 2019-nCoV to cause maternal, fetal and neonatal morbidity and other poor obstetrical outcomes, this communication reviews the published data addressing the epidemiological and clinical effects of SARS, MERS, and other coronavirus infections on pregnant women and their infants."
193," There is a current worldwide outbreak of the novel coronavirus Covid-19 (coronavirus disease 2019; the pathogen called SARS-CoV-2; previously 2019-nCoV), which originated from Wuhan in China and has now spread to 6 continents including 66 countries, as of 24:00 on March 2, 2020."
194,"A cytokine storm has been shown in patients who develop fatal complications, as observed in past coronavirus infections."
195,"The disease is officially named as Coronavirus Disease-2019 (COVID-19, by WHO on February 11, 2020)."
196," Background In December, 2019, a pneumonia associated with the 2019 novel coronavirus (2019-nCoV) emerged in Wuhan, China."
197,A newly identified novel coronavirus (SARS-CoV-2) is causing pneumonia-associated respiratory syndrome across the world.
198,"The entire process—from vaccine design, to manufacturing, to shipment—took only 7 weeks."
199,WHO has named the novel coronavirus disease as COVID-19.
200,"Wuhan coronavirus, called 2019-nCoV, is a newly emerged virus that infected more than 9692 people and leads to more than 213 fatalities by January 30, 2020."
201,2019 novel coronavirus (2019-nCoV) is a new member of coronavirus family that can cause serious respiratory diseases after the emergence of severe acute respiratory syndrome-coronavirus (SARS-CoV) and middle east respiratory syndrome-coronavirus (MERS-CoV).
202,"Owing to the lack of efficient and specific treatments and the need to contain the epidemic, drug repurposing appears to be the best tool to find a therapeutic solution."
203,Timely blood glucose management for the outbreak of 2019 novel coronavirus disease (COVID-19) is urgently needed
204,"Chloroquine, remdesivir, lopinavir, ribavirin and ritonavir have shown efficacy to inhibit coronavirus in vitro."
205,China has also taken immediate action to put remdesivir into clinical trials with the purpose of applying it into clinical therapeutics for Corona Virus Disease 2019 (COVID-19).
206,"Coronavirus disease 2019 (COVID-19) associated pneumonia caused by severe acute respiratory coronavirus 2 (SARS-COV-2) was first reported in Wuhan, China in December 2019."
207,This work could be extended further to enable medical practitioners in automatically identifying and characterizing SARS coronavirus strain in a fast and efficient fashion using short and/or incomplete segments of nucleotide sequences.
208,"These observations suggest that the effect of ciclesonide was specific to coronavirus, suggesting this is a candidate drug for treatment of patients suffering MERS or COVID-19."
209,This implies that as a pandemic as declared by WHO (2020) the COVID-19 coronavirus does not have a curative vaccine yet and precautionary measures are advised through quarantine and observatory procedures.
210,We highlight the current state of knowledge of coronavirus biology while answering questions concerning the current outbreak of SARS-CoV-2.
211,Novel coronavirus is putting the whole world on alert
212,"In facing of the increasingly serious epidemic of 2019 novel coronavirus pneumonia and the urgent needs in drug treatment strategies, this paper reviewed the current research situation and progress in antiviral treatment for the newly identified disease."
213,"These studies included patients with severe acute respiratory syndrome (SARs, n=33), middle east respiratory syndrome (MERS, n=16), COVID-19 (n=3), and unspecified coronavirus (n=2)."
214,"Here, we have conducted an online search for all treatment options related to coronavirus infections as well as some RNA virus infection and we have found that general treatments, coronavirus-specific treatments, and antiviral treatments should be useful in fighting COVID-19."
215,"SARS-CoV-2 is closely related to two bat-derived severe acute respiratory syndrome-like coronaviruses, bat-SL-CoVZC45 and bat-SL-CoVZXC21."
216,Changes in serum proalbumin may contribute to the early warning of novel coronavirus pneumonia.
217,"The World Health Organization (WHO) was informed on December 2019 about a coronavirus pneumonia outbreak in Wuhan, Hubei province (China)."
218,The recent emergence of severe acute respiratory syndrome coronavirus 2 (SARS-CoV-2) from the Hubei province in China in late 2019 demonstrates the epidemic potential of coronaviruses.
219,In the first step we conducted a literature search for natural compounds that had been biologically confirmed as against sever acute respiratory syndrome coronavirus or Middle East respiratory syndrome coronavirus.
220,One possible answer is antibody dependent enhancement (ADE) of SARS-CoV-2 due to prior exposure to other coronaviruses.
221,Drug treatment options for the 2019-new coronavirus (2019-nCoV)
222,"Further, we analyzed the pharmacological actions and previous trials of remdesivir to identify the feasibility of conducting experiments on COVID-19."
223,"Coronaviruses are a group of viruses that affect both animals and humans, and several (OC43, 229E, HKU1 and NL63) are a cause of the common cold.1, 2 However, two coronaviruses have previously caused significant outbreaks associated with more severe disease: the SARS coronavirus in 2002–2003 and the Middle East respiratory syndrome coronavirus that emerged in 2012.1, 2 Chinese authorities and researchers should be commended for their rapid sharing of viral sequences which enabled laboratories worldwide to develop diagnostic tests within weeks of discovery of the pathogen.3 An Australian laboratory subsequently isolated the virus from a clinical sample (the first to do so outside of China), and rapidly shared this virus with relevant global agencies, further aiding diagnostic, therapeutic and vaccine development efforts."
224,"Although there are potential targets in the JAK-STAT pathway that can be manipulated in treatment for coronaviruses and it is evident that IL-1 is elevated in patients with a coronavirus, there is currently no evidence for a role of these drugs in treatment of COVID-19."
225,A novel coronavirus was reported to the World Health Organization (WHO) in China on 31 December 2019.
226,SARS-CoV-2 is the aetiological agent of coronavirus disease 2019 (COVID-19) characterised by pulmonary infection in humans.
227,"We started from the structure, immunogenicity, and pathogenesis of coronavirus infections of the novel coronavirus."
228,Science in the fight against the novel coronavirus disease
229, The recent outbreak of coronavirus disease 2019 (COVID-19) caused by SARS-CoV-2 in December 2019 raised global health concerns.
230,: Coronavirus Disease 2019 (COVID-19) caused by Severe Acute Respiratory Syndrome Coronavirus -2 (SARS-CoV-2) infection has been widely spread.
231,"On Feb. 25, the US National Institutes of Health (NIH) said it had begun a Phase II clinical trial of remdesivir, an experimental small-molecule drug made by Gilead Sciences, for treatment of those infected with SARS-CoV-2."
232,"The coronavirus disease 19 (COVID-19) is a highly transmittable and pathogenic viral infection caused by severe acute respiratory syndrome coronavirus 2 (SARS-CoV-2), which emerged in Wuhan, China and spread around the world."
233,It was found that the S-protein from the SARS coronavirus (SARS-CoV) bind stronger to ACE2 than 2019-nCoV.
234,It is essential to emphasize that this article only captured trials listed in the clinicaltrials.gov database.
235,"It is currently believed that this deadly Coronavirus strain originated from wild animals at the Huanan market in Wuhan, a city in Hubei province."
236,Real time RT-PCR was used to detect the new coronavirus in respiratory samples.
237,Strategies against the novel coronavirus: Possible applications of the experimental Ebola drug remdesivir are being tested
238,The Author's Response: Case of the Index Patient Who Caused Tertiary Transmission of Coronavirus Disease 2019 in Korea: the Application of Lopinavir/Ritonavir for the Treatment of COVID-19 Pneumonia Monitored by Quantitative RT-PCR
239," As the coronavirus disease 19 (COVID-19) global pandemic rages across the globe, the race to prevent and treat this deadly disease has led to the “off-label” repurposing of drugs such as hydroxychloroquine and lopinavir/ritonavir, which has the potential for unwanted QT-interval prolongation and a risk of drug-induced sudden cardiac death."
240,"The emergence of severe acute respiratory syndrome coronavirus 2 (SARS-CoV-2) in December 2019 which causes coronavirus disease-2019 (COVID-19), an acute respiratory disease marked the third introduction of a highly pathogenic coronavirus into the human population in the twenty-first century."
241,"Cytotoxic chemotherapy has been shown to be a specific inhibitor for severe acute respiratory syndrome coronavirus in in vitro studies, but no specific studies exist as of yet for COVID-19."
242,Interpretation MNA delivery of coronaviruses-S1 subunit vaccines is a promising immunization strategy against coronavirus infection.
243,"The effort to evaluate the disease equilibrium shows that unless there is a dedicated effort from government, decision makers and stakeholders, the world would hardly be reed of the COVID-19 coronavirus and further spread is eminent and the rate of infection will continue to increase despite the increased rate of recovery because of the absence of vaccine at the moment."
