,sent
0,"The nsp3 was found to be more conserved among SARS-CoV-2, SARS-CoV, and MERS-CoV than among 15 coronaviruses infecting human and other animals."
1,"A novel pneumonia-associated respiratory syndrome named coronavirus disease-2019 (COVID-19), which caused by SARS-CoV-2 and broken in Wuhan, China in the end of 2019."
2,New threat: 2019 novel Coronavirus infection and infection control perspective in Turkey
3,A rapid fatal evolution of Coronavirus Disease-19 (COVID-19) in an advanced lung cancer patient with a long time response to nivolumab
4,Human coronaviruses continue to pose a threat to human health.
5," Coronavirus disease 2019 (COVID-19) is a kind of viral pneumonia with an unusual outbreak in Wuhan, China, in December 2019, which is caused by severe acute respiratory syndrome coronavirus 2 (SARS-CoV-2)."
6,"Although 26% of the amino acids in this SARS-CoV-2 macrodomain differ from those seen in other corona-viruses, the protein retains the ability to bind ADP-ribose, which is an important characteristic of beta coronaviruses, and potential therapeutic target."
7,"To ultimately combat the emerging COVID-19 pandemic, it is desired to develop an effective and safe vaccine against this highly contagious disease caused by the SARS-CoV-2 coronavirus."
8," The outbreak of Coronavirus Disease 2019 (COVID-19) causing novel coronavirus-infected pneumonia (NCIP), has affected the lives of 71,429 people globally."
9,"Preliminary trials of chloroquine repurposing in the treatment of COVID-19 in China have been encouraging, leading to several new trials."
10,Patients with advanced basal cell carcinomas in treatment with sonic hedgehog inhibitors during the coronavirus disease 2019 (COVID-19) period: Management and adherence to treatment
11,"Severe acute respiratory syndrome coronavirus 2 (SARS-CoV-2) (previously called 2019 novel coronavirus (2019-nCoV) is the causative agent of coronavirus disease 2019 (COVID-19), a disease recently declared a global public health emergency by the World Health Organization."
12,METHODS: A 2019-nCoV related pangolin coronavirus GX_P2V/pangolin/2017/ Guangxi was described.
13,"Novel Coronavirus (2019-nCoV) is an emerging pathogen that was first identified in Wuhan, China in late December 2019."
14,"The pathogen was a new coronavirus, named 2019 NovelCoronavirus (2019-nCoV) by WHO."
15,The novel coronavirus outbreak declared a Public Health Emergency of International Concern on 30 January 2020.
16,"However, the viral protease of a coronavirus is well-known to be essential for its replication and thus is an effective drug target."
17,SARS-CoV-2 shares 82% genome sequence similarity to SARS-CoV and 50% genome sequence homology to Middle East respiratory syndrome coronavirus (MERS-CoV)—all three coronaviruses are known to cause severe respiratory symptoms.
18,We evaluate 11 complete genome sequence of different coronavirus using BAST and MAFFT software.
19,Methods: All patients received recommended strategy from Diagnosis and Treatment for 2019 Novel Coronavirus Diseases released by National Health Commission of China.
20,"Since the novel coronavirus has been reported to be capable of endangering thousands of lives, it is extremely important to find out how the coronavirus is transmitted in human organs."
21,"RESULTS: The spike protein of coronavirus GX_P2V shares 92.2% amino acid identity with that of 2019-nCoV isolate Wuhan-hu-1, and uses ACE2 as the receptor for infection just like 2019-nCoV."
22,Diagnostic PCR protocols can be found at https://www.who.int/health-topics/coronavirus/laboratory-diagnostics-for-novel-coronavirus.
23,Traditional Chinese medicine is a resource for drug discovery against 2019 novel coronavirus (SARS-CoV-2)
24,The efforts of international health authorities have since focused on rapid diagnosis and isolation of patients as well as the search for therapies able to counter the most severe effects of the disease.
25,"Intensive research on the novel emerging human infectious coronaviruses is urgently needed to elucidate their route of transmission and pathogenic mechanisms, and to identify potential drug targets, which would promote the development of effective preventive and therapeutic countermeasures."
26,"The most common treatment was ribavirin (n=41), followed by oseltamivir (n=10) and the combination of lopinavir/ritonavir (n=7)."
27,Background The COVID-19 pandemic caused by SARS-CoV-2 coronavirus threatens global public health.
28,A commentary on “World Health Organization declares global emergency: A review of the 2019 novel Coronavirus (COVID-19)”
29,"Fortunately, the sequence identity of the 2019-nCoV protease and that of severe-acute respiratory syndrome virus (SARS-CoV) is as high as 96.1%."
30,CONCLUSIONS: Our pangolin coronavirus GX_P2V is a workable model for 2019-nCoV research.
31,"Moreover, websites such as the World Health Organization (WHO) and the Centers for Disease Control and Prevention (CDC) were searched to retrieve updated data and statistics regarding the novel coronavirus."
32,"Materials and Methods: Several databases such as PubMed, Scopus, Google scholar, and BioRxiv were searched for publications reporting on the novel coronavirus up to 29 February 2020."
33,Conclusion: The results of this multicenter retrospective study suggests that novel coronavirus pneumonia combined with liver damage is more likely to be caused by adverse drug reactions and systemic inflammation in severe patients receiving medical treatment.
34,The emergence of 2019 novel coronavirus (2019-nCoV) is of global concern and might have emerged from RNA recombination among existing coronaviruses.
35,"The infection of a novel coronavirus found in Wuhan of China (2019-nCoV) is rapidly spreading, and the incidence rate is increasing worldwide."
36,The response to the novel coronavirus outbreak in China suggests that many of the lessons from the 2003 SARS epidemic have been implemented and the response improved as a consequence.
37,The PAC-MAN approach is potentially a rapidly implementable pan-coronavirus strategy to deal with emerging pandemic strains.
38,"Coronaviruses are the well-known cause of severe respiratory, enteric and systemic infections in a wide range of hosts including man, mammals, fish, and avian."
39,"Methods: Clinical data of 36 patients with novel coronavirus pneumonia in isolation area of Kunming Third People's Hospital from January 31 to February 15, 2020 were collected, and the basic situation, clinical characteristics, laboratory examination and CT imaging characteristics were analyzed."
40,The viral 3-chymotrypsin-like cysteine protease (3CLpro) enzyme controls coronavirus replication and is essential for its life cycle.
41,Clinical isolates were found to contain a novel coronavirus with similarity to bat coronaviruses.
42,"Consequently, the polydisperse, natural products of heparan sulfate and the allied polysaccharide, heparin have been found to be involved and prevent infection by a range of viruses including S-associated coronavirus strain HSR1."
43,The pangolin coronavirus model was used to identify drug candidates for treating 2019-nCoV infection.
44,"In the current review, we summarize and comparatively analyze the emergence and pathogenicity of COVID-19 infection and previous human coronaviruses severe acute respiratory syndrome coronavirus (SARS-CoV) and middle east respiratory syndrome coronavirus (MERS-CoV)."
45,This may also provide insights into the evolution of 2019-nCoV because SARS-like coronaviruses are thought to have originated in bats that are known to have a higher body-temperature than humans.
46,"Since December, 2019, an outbreak of pneumonia caused by the new coronavirus (2019-nCoV) has hit the city of Wuhan in the Hubei Province."
47,"As these fusion proteins exhibit cross-reactivity against coronaviruses, they could have potential applications for diagnosis, prophylaxis, and treatment of 2019-nCoV."
48,The rapid spread of Coronavirus disease 2019 (COVID-19) presents China with a critical challenge.
49,Therapeutic neutralizing antibodies (NAbs) against SARS-CoV-2 will be greatly important therapeutic agents for the treatment of coronavirus disease 2019 (COVID-19).
50,"Teicoplanin, an antibiotic used to treat staphylococcal infections, previously showed efficacy to inhibit the first stage of the Middle East respiratory syndrome coronavirus (MERS-CoV) viral life cycle in human cells."
51,Coronavirus disease (COVID-19): The need to maintain regular physical activity while taking precautions
52, The SARS-CoV-2 (Covid-19) coronavirus pandemic is evolving very quickly and means a special risk for both immunosuppressed and comorbid patients.
53,"Another animal to human transmission of a coronavirus occurred in December 2019 on a live animal market in the Chinese city of Wuhan causing an epidemic in China, reaching now different continents."
54,Relevant reports have pointed out the novel coronavirus has 80% homology with SARS.
55,We evaluated the in vitro antiviral effect of compounds that were previously reported to inhibit coronavirus replication and compounds that are currently under evaluation in clinical trials for SARS-CoV-2 patients.
56,"Similar to such other coronaviruses as those causing the Middle East respiratory syndrome (MERS) and severe acute respiratory syndrome (SARS), the new coronavirus was reported to spread via natural aerosols from human-to-human."
57,Early batches of a kit developed by the US government to diagnose the novel coronavirus infection have been plagued by problems that initially limited their use and cast doubt on their accuracy.
58," The Coronavirus-associated disease, that was first identified in 2019 in China (CoViD-19), is a pandemic caused by a bat-derived beta-coronavirus, named SARS-CoV2."
59,"However, the mortality rate of COVID-19 is lower than that of other coronaviruses diseases such as SARS or MERS and other viruses like HIV and Ebola."
60,"First identified in the late December 2019, in Wuhan, China, a novel coronavirus (2019-nCoV) has rampantly spread to lots of provinces in China, and multiple countries are affected."
61,"Given the high need and the absence of specific antivirals for treatment of COVID-19 (the disease caused by severe acute respiratory syndrome-associated coronavirus-2 [SARS-CoV-2]), human immunodeficiency virus (HIV) protease inhibitors are being considered as therapeutic alternatives."
62,3CLpro is a proven drug discovery target in the case of severe acute respiratory syndrome coronavirus (SARS-CoV) and middle east respiratory syndrome coronavirus (MERS-CoV).
63,"Therefore, in a bid to answer a burning question of reinfection in the recovered class, the model equations which exhibits the disease-free equilibrium (E_0 ) state for COVID-19 coronavirus was developed in this study and was discovered to both exist as well as satisfy the criteria for a locally or globally asymptotic stability with a basic reproductive number R_0=0 for and endemic situation."
64,"An ongoing outbreak of a novel coronavirus infection in Wuhan, China since December 2019 has led to 31,516 infected persons and 638 deaths across 25 countries (till 16:00 on February 7, 2020)."
65,"A possible threat in the ophthalmology clinic While the 2019-nCoV transmission route is still unknown, countries have been preparing measures based on past experiences with coronaviruses namely SARS-CoV and MERS-CoV."
66,"ABSTRACT In December 2019, a novel coronavirus, named severe acute respiratory syndrome coronavirus 2 (SARS-CoV-2), emerged from China causing pneumonia outbreaks, first in the Wuhan region of China and then spread worldwide because of its probable high transmission efficiency."
67,"An outbreak of a novel coronavirus, now formally named severe acute respiratory syndrome coronavirus 2 (SARS‐CoV‐2) and causing coronavirus disease 2019 (COVID‐19), emerged in the city of Wuhan in Hubei province in central China in December 2019."
68,The retrospective study using the past SARS-CoV and MERS-CoV data demonstrated that our machine learning based method can successfully predict effective drug candidates against a specific coronavirus.
69," Since the outbreak of the new coronavirus epidemic, novel coronavirus has infected nearly 100,000 people in more than 110 countries."
70,Bilateral lung involvement with ground-glass opacity was the most common finding from computed tomography images of the chest.
71,"The molecular docking results indicate that, the 3CLpro of SARS-CoV-2 has a higher binding affinity for all the studied inhibitors than its SARS homologue."
72,"Whereas pregnant women infected with coronavirus may have an increased risk of adverse neonatal outcomes, gametes do not transmit COVID-19."
73,"In this study, we propose a compression-complexity based distance measure for automatic identification of SARS coronavirus strains from a set of viruses using only short fragments of nucleotide sequences."
74,Our analysis revealed 20 compounds that could be clustered into three groups based on their chemical features.
75,"Since it has been reported that the HIV-1 protease inhibitors can be used as anti-SARS drugs by tegarting SARS-CoV 3CLpro, we choose six approved anti-HIV-1 drugs to investigate their binding interactions between 3CLpro, and to evaluate their potential to become clinical drugs for the new coronavirus pneumonia (COVID19) caused by SARS-CoV-2 infection."
76," The pneumonia caused by novel coronavirus (SARS-CoV-2) in Wuhan, China in December 2019 is a highly contagious disease."
77,"However, drug screening using live 2019-nCoV requires high-level biosafety facilities, which imposes an obstacle for those without such facilities or 2019-novel coronavirus (2019-nCoV)."
78,"Objective In this study we execute a rational screen to identify Chinese medical herbs that are commonly used in treating viral respiratory infections and also contain compounds that might directly inhibit 2019 novel coronavirus (2019-nCoV), an ongoing novel coronavirus that causes pneumonia."
79,"Rapid diagnostics, vaccines and therapeutics are important interventions for the management of the 2019 novel coronavirus (2019-nCoV) outbreak."
80,"It is timely to systematically review the potential of these interventions, including those for Middle East respiratory syndrome-Coronavirus (MERS-CoV) and severe acute respiratory syndrome (SARS)-CoV, to guide policymakers globally on their prioritization of resources for research and development."
81,Resulting compounds were cross-checked for listing in the Traditional Chinese Medicine Systems Pharmacology Database.
82,"By performing target-based virtual ligand screening, a total of 21 targets (including two human targets) were screened against compound libraries including ZINC drug database and our own database of natural products."
83,"The outbreak of coronavirus disease 2019 (COVID-19), caused by severe acute respiratory syndrome coronavirus 2 (SARS-CoV-2), first reported in China, in December, 2019, now affects the whole world."
84,"Coronaviruses such as the newly discovered virus from Wuhan, China, 2019-nCoV, and the viruses that cause SARS and MERS, have resulted in regional and global public health emergencies."
85,This study shows that the disease free equilibrium (E_0 ) for COVID-19 coronavirus does not satisfy the criteria for a locally or globally asymptotic stability.
86,The sequences of spike glycoprotein of 2019-nCoV and SARS coronavirus (SARS-CoV) were used for the comparison.
87,"With a diagnosis of post-infectious acute myelitis and comprehensive treatment, paralysis of bilateral lower extremities ameliorated."
88,"In late December 2019, a previous unidentified coronavirus, currently named as the 2019 novel coronavirus#, emerged from Wuhan, China, and resulted in a formidable outbreak in many cities in China and expanded globally, including Thailand, Republic of Korea, Japan, United States, Philippines, Viet Nam, and our country (as of 2/6/2020 at least 25 countries)."
89,[Image: see text] The recent outbreak of coronavirus disease 2019 (COVID-19) highlights an urgent need for therapeutics.
90,"Conclusion: The outbreak caused by the novel coronavirus is larger than the previous human coronaviruses, showing that the SARS-CoV-2 is an extremely contagious virus."
91,COVID-19 from veterinary medicine and one health perspectives: What animal coronaviruses have taught us
92,There is a new public health crises threatening the world with the emergence and spread of 2019 novel coronavirus (2019-nCoV) or the severe acute respiratory syndrome coronavirus 2 (SARS-CoV-2).
93,The spike protein on the coronavirus envelope is critical for host cell infection and virus vitality.
94,"After the outbreak of the severe acute respiratory syndrome (SARS) in the world in 2003, human coronaviruses (HCoVs) have been reported as pathogens that cause severe symptoms in respiratory tract infections."
95,"Angiotensin-converting enzyme 2 (ACE2) was found to be the receptor of 2019-nCoV.This review provides a brief overview of human coronavirus receptors and their applications, with a view to providing references for the tracing, cross-species transmission, epidemiological analysis and antiviral and vaccine studies of 2019-nCoV."
96,Conclusion: The clinical characteristics of the novel coronavirus pneumonia in Kunming are different from those in Wuhan.
97,The eligibility criteria for the retrieved studies were: contain a clinicaltrials.gov base identifier number; describe the number of participants and the period for the study; describe the participants’ clinical conditions; and utilize interventions with medicines already studied or approved for any other disease in patients infected with the novel coronavirus SARS-CoV-2 (2019-nCoV).
98,Objective: To analyze the clinical characteristics of cases of novel coronavirus pneumonia and a preliminary study to explore the relationship between different clinical classification and liver damage.
99, Coronavirus disease (COVID-19) is caused by SARS-COV2 and represents the causative agent of a potentially fatal disease that is of great global public health concern.
100,"Currently, the research on novel coronavirus is still in the primary stage."
101,"A novel severe acute respiratory syndrome coronavirus (SARS-CoV-2) was identified from respiratory illness patients in Wuhan, Hubei Province, China, which has recently emerged as a serious threat to the world public health."
102,"Conclusion: The current evidence for the effectiveness and safety of antiviral therapies for coronavirus is inconclusive and suffers from a lack of well-designed prospective trials or observational studies, preventing any treatment recommendations from being made."
103,An outbreak of a novel coronavirus (COVID-19 or 2019-CoV) infection has posed significant threats to international health and the economy.
104," The current pandemic of Coronavirus Disease 2019 (COVID-19) has focused the attention of medical-care providers away from non-life-threatening diseases, including infertility."
105,"Some of these proteins, such as the RNA-dependent RNA polymers, helicase and main protease, are well conserved between SARS-CoV-2 and the original SARS virus, but several others are not."
106,"Due to the increasing number of cases in China and outside China, the WHO declared coronavirus as a global health emergency."
107,"This new virus, called 2019 novel coronavirus (2019-nCoV) uses the same receptor called Angiotensinconverting enzyme 2 (ACE2) to attack humans as the coronavirus that caused the severe acute respiratory syndrome (SARS) seventeen years ago."
108," The recent emergence of the novel, pathogenic SARS-coronavirus 2 (SARS-CoV-2) in China and its rapid national and international spread pose a global health emergency."
109,The virus causing this pneumonia was then named as the 2019 novel coronavirus (2019-nCoV) by the World Health Organization.
110,We performed a structural analysis of the receptor binding domain (RBD) of spike glycoprotein responsible for entry of coronaviruses into host cells.
111,There is a high mortality and long hospitalization period for severe cases with 2019 novel coronavirus disease (COVID-19) pneumonia.
112,The 2019-novel coronavirus (nCoV) is a major source of disaster in the 21(th) century.
113,"n a piece of research accomplished with astonishing speed, scientists from the University of Texas at Austin and the National Institutes of Health have released a cryo-electron microscopy (cryo-EM) structure of part of severe acute respiratory syndrome coronavirus 2 (SARS-CoV-2), the novel coronavirus that has infected tens of thousands of people and killed more than 2,000 since the end of December (Science 2020, DOI: 10.1126/science.abb2507)."
114,"Up to 10 commercial medicines that may form hydrogen bounds to key residues within the binding pocket of 2019-nCoV Mpro were identified, which may have higher mutation tolerance than lopinavir/ritonavir and may also function as inhibitors for other coronaviruses with similar Mpro binding sites and pocket structures."
115, The novel coronavirus infection that initially found at the end of 2019 has attracted great attention.
116,"To promote the data sharing and make all relevant information of 2019-nCoV publicly available, we construct the 2019 Novel Coronavirus Resource (2019nCoVR, https://bigd.big.ac.cn/ncov)."
117,"The 2019 novel coronavirus (COVID19 / Wuhan coronavirus), officially named as Severe Acute Respiratory Syndrome Coronavirus 2 (SARS-CoV-2), is a positive-sense single-stranded RNA coronavirus."
118,It highlights antiviral strategies involving small molecules and biologics targeting complex molecular interactions involved in coronavirus infection and replication.
119,"Our results strongly suggest that CEP is a wide-spectrum inhibitor of pan-betacoronavirus, and clinical trial of CEP for treatment of 2019-nCoV infection is warranted."
120,"On January 7, 2020, Chinese health officials confirmed that a novel coronavirus (2019-nCoV) was associated with this initial cluster (1)."
121,"In late December 2019 a previous unidentified coronavirus, currently named as the 2019 novel coronavirus (2019-nCoV), emerged from Wuhan, China and resulted in a formidable outbreak in many cities in China and expanding globally, including Thailand, Republic of Korea, Japan, USA, Philippines, Viet Nam, and our country (as of 2/6/2020 at least 25 countries)."
122, The coronavirus disease-19 (COVID-19) is caused by the novel severe acute respiratory syndrome coronavirus that was first detected at the end of December 2019.
123,"On January 21, 2020, the CDC activated its Emergency Operations Center and the WHO released its first situation report about coronavirus disease 2019 (COVID-19), sparking significant media attention."
124,"After two times negative novel coronavirus RNA nasopharyngeal swabs tests, he was discharged and transferred to a designated hospital for isolation treatment and rehabilitation therapy."
125,"Using serum samples from patients with PCR-confirmed infections of SARS-CoV-2, other coronaviruses, or other respiratory pathogenic infections, we validated and tested various antigens in different in-house and commercial ELISAs."
126,"However, using Q-UEL systems to access relevant and emerging literature, and to interact with standard publically available bioinformatics tools on the Internet, did help quickly identify sequences of amino acids that are well conserved across many coronaviruses including 2019-nCoV."
127,KRSFIEDLLFNKV was found to be particularly well conserved in this study and corresponds to the region around one of the known cleavage sites of the SARS virus that are believed to be required for virus activation for cell entry.
128,"Background: SARS-CoV-2 is a novel human coronavirus, there is no specific antiviral drugs."
129,"Then, these structures could serve as leading compounds to develop a series of derivatives optimizing their activity against SARS-CoV-2 and other coronaviruses."
130,"UT Austin’s Jason McLellan and his colleagues, who have spent many years studying other coronaviruses, had already figured out how to use select"
131,"SARS Coronavirus (SARS-CoV), MERS Coronavirus (MERS-CoV), and the novel coronavirus, previously dubbed 2019-nCoV, and now officially named SARS-CoV-2, are the causative agents of the SARS, MERS, and COVID-19 disease outbreaks, respectively."
132,"Sanofi will build on work on a vaccine against SARS, another coronavirus that circulated in the early 2000s."
133,"While reports suggest that asymptomatic infection and transmission may result from minimally symptomatic cases, the contribution of this to transmission is not yet known.8 Careful analysis of early data suggests that the mean incubation period is 6 days, with a range of up to 14 days.9 Reports of large outbreaks, particularly associated with hospitals and closed communities, raise the possibility of “superspreading” events, a feature of previous coronavirus outbreaks.10 The importance of infection control is also reinforced by a report that 41% of cases in Wuhan were acquired nosocomially (including 40 health care workers and 17 patients).4 As at 26 February 2020, there were 23 confirmed cases of COVID‐19 in Australia, across five jurisdictions."
134,": A novel coronavirus (2019-nCoV) has raised world concern since it emerged in Wuhan Hubei China in December, 2019."
135," On 10 January 2020, a new coronavirus causing a pneumonia outbreak in Wuhan City in central China was denoted as 2019-nCoV by the World Health Organization (WHO)."
136,Coronavirus 2019-nCoV: Is the genie already out of the bottle?
