,sent
155,"The known genetic diversity of the hepaciviruses and pegiviruses has increased greatly in recent years through the discovery of viruses related to hepatitis C virus and human pegivirus in bats, bovines, equines, primates, and rodents."
156,Viral species metacommunities associated with bats was dominated by random structures along all spatial scales.
157,MERS-CoV sequences have since been found in a bat and the virus appears to be enzootic among dromedary camels across the Arabian Peninsula and in parts of Africa.
158," In December 2019, the outbreak of the novel coronavirus disease (COVID-19) in China spread worldwide, becoming an emergency of major international concern."
159,"Here, we evaluated the utility of ChAdOx1, a promising replication-deficient simian adenovirus vaccine vector platform with an established safety profile in humans and dromedary camels, for MERS-CoV vaccine development."
160,There are similarities and differences in the epidemiology and clinical features between these two diseases.
161,"In this study, we assembled the genomes of coronaviruses identified in sick pangolins."
162,"The continuing introductions of MERS-CoV from dromedary camels, the subsequent travel-related viral spread, the unprecedented nosocomial outbreaks and the high case-fatality rates highlight the need for prophylactic and therapeutic measures."
163,"The virus spreads faster than its two ancestors the SARS-CoV and Middle East respiratory syndrome coronavirus (MERS-CoV), but has lower fatality."
164,An effective DNA vaccine platform for Middle East respiratory syndrome coronavirus
165,": The pathogenesis and immune response to Middle East respiratory syndrome (MERS) caused by a recently discovered coronavirus, MERS-CoV, have not been fully characterized because a suitable animal model is currently not available."
166,"The MERS-CoV spike (S) protein, a characteristic structural component of the viral envelope, is considered as a key target of vaccines against coronavirus infection."
167, Background Cancer patients are regarded as a highly vulnerable group in the current Coronavirus Disease 2019 (COVID-19) pandemic.
168,Study validation was demonstrated via experimental quality control measures and meta-analysis of independent experiments performed under similar conditions.
169,"However, the central processes in the evolution of emerging viruses are unclear, particularly the selection pressures faced by viruses in new host species."
170,We analyzed the possibility of aerosol transmission for the novel coronavirus.
171,"The 2017 Gertrude Elion Memorial Lecture Award by Michael Sofia highlighted one of the most important accomplishments in recent drug discovery in antiviral research, the identification of the hepatitis C virus direct-acting antiviral sofosbuvir and new alternatives to combat hepatitis B virus (HBV) infection."
172,"Both recombinant viruses stably expressed the corresponding SARS-CoV proteins, grew to similar end titres as the parental strain and induced high antibody titres against MV and the vectored SARS-CoV antigens (S and N) in transgenic mice susceptible to measles infection."
173,"Previously, it was shown that MyD88, an adaptor protein necessary for signaling by multiple TLRs, is a required component of the innate immune response to mouse-adapted SARS-CoV infection in vivo."
174,"The emergence of new pathogens, such as severe acute respiratory syndrome coronavirus (SARS-CoV), Middle East respiratory syndrome coronavirus (MERS-CoV), and Ebola virus, poses serious challenges to global public health and highlights the urgent need for novel antiviral approaches."
175,The envelope (E) protein from coronaviruses is a small polypeptide that contains at least one α-helical transmembrane domain.
176,"The disease carries a high case fatality rate of 34.5%, and there is no internationally or nationally recommended therapy."
177,Emergence of the Middle East Respiratory Syndrome Coronavirus
178,The other significant event in hepatitis C virus (HCV) research has been the development of a cell culture system.
179,"The recent emergence of another coronavirus causing severe disease, Middle East respiratory syndrome (MERS), in humans, has made it clear that coronaviruses pose a major threat to human health, and that more research is urgently needed to elucidate their replication mechanisms, identify potential drug targets, and develop effective countermeasures."
180,"Taken together, our findings suggest that alphacoronavirus nsp1 is an essential virulence determinant, providing a potential paradigm for the development of a new attenuated vaccine based on modified nsp1."
181,The prevalence of antibodies and viral RNA in different bat species and the characteristics of the bat SARS-like coronavirus were elucidated.
182,Our results also revealed that the BetaCoV/bat/Yunnan/RaTG13/2013 virus was more similar to the SARS-CoV-2 virus than the coronavirus obtained from the two pangolin samples (SRR10168377 and SRR10168378).
183, A new type of coronavirus has been identified as the causative agent underlying Middle East Respiratory Syndrome (MERS).
184,"As the virus infected cases and mortality rate of this disease is increasing exponentially, scientists and researchers all over the world are relentlessly working to understand this new virus along with possible treatment regimens by discovering active therapeutic agents and vaccines."
185,This summary discusses recent advances in coronavirus research that will facilitate the identification of crucial molecular targets for the rational design of SARS therapeutics.
186,"Middle East respiratory syndrome coronavirus (MERS-CoV) causes severe respiratory disease in humans with a case fatality rate of over 39%, and poses a considerable threat to public health."
187,"On September 20, 2012, a Saudi Arabian physician reported the isolation of a novel coronavirus from a patient with pneumonia on ProMED-mail."
188,"Background: After the outbreak of novel coronavirus (2019-nCoV) starting in late 2019, a number of researchers have reported the predicted the virus transmission dynamics."
189,"The emergence of severe acute respiratory syndrome coronavirus 2 (SARS-CoV-2) in December 2019 which causes coronavirus disease-2019 (COVID-19), an acute respiratory disease marked the third introduction of a highly pathogenic coronavirus into the human population in the twenty-first century."
190,"Out of three respiratory viruses—porcine respiratory coronavirus (PRCV), porcine reproductive and respiratory syndrome virus (PRRSV) and swine influenza virus (SIV)—only SIV induced acute respiratory disease and severe lung damage by itself."
191,"An emerging coronavirus causing pneumonia outbreak in Wuhan, China: calling for developing therapeutic and prophylactic strategies"
192,HCoV-EMC may represent a sporadic spillover to humans from an unknown animal reservoir.
193,"In addition, the diphyllin nanoparticles were well tolerated in mice following high-dose intravenous administration."
194,"Within each genus, several well-supported lineages were identified and viral diversity was structured by both host species and location of sampling."
195,"Recent studies (Huang et al ., Chan et al ., and Zhou et al .)"
196,Interpretation 2019-nCoV is sufficiently divergent from SARS-CoV to be considered a new human-infecting betacoronavirus.
197,"Our understanding of the forces driving seasonal disappearance and recurrence of infectious diseases remains fragmentary, thus limiting any predictions about whether, or when, SARS will recur."
198,The novel Coronavirus SARS-CoV-2 (CoV) has induced a world-wide pandemic and subsequent non-pharmaceutical interventions (NPI) in order to control the spreading of the virus.
199,The phylogenetic analyses based on avian and mammalian coronaviruses showed the analysed IBV as closely related to turkey coronaviruses and distantly related to thrush and munia coronaviruses.
200,"Ten years later, a novel human coronavirus (Middle East respiratory syndrome coronavirus, MERS-CoV), associated with severe pneumonia, arose in the Kingdom of Saudi Arabia."
201,"Ribavirin was found to further potentiate the antiviral effect of alisporivir in these cell culture-based infection models, but this combination treatment was unable to improve the outcome of SARS-CoV infection in a mouse model."
202,Six weeks into the 2019 coronavirus disease (COVID-19) outbreak- it is time to consider strategies to impede the emergence of new zoonotic infections
203,"A novel coronavirus has caused thousands of human infections in China since December 2019, raising a global public health concern."
204,Coronavirus disease 2019 (COVID-19) is a novel human respiratory disease caused by the SARS-CoV-2 virus.
205,"In addition, BCX4430 exhibits broad-spectrum antiviral activity against numerous viruses, including bunyaviruses, arenaviruses, paramyxoviruses, coronaviruses and flaviviruses."
206,The genome sequences of bat SARS-like coronavirus had about 88–92% nt identity with that of the SARS-CoV.
207,"Currently available evidence about the antiviral effects of remdesivir against coronaviruses is primarily based on in vitro and in vivo studies (including some on a chemically related compound, GS-441524™), which have demonstrated largely favorable findings."
208,"To date, there are no approved vaccines or direct acting antiviral drugs to combat coronavirus infections in humans."
209,Background: Middle East respiratory syndrome coronavirus (MERS-CoV) was first identified in humans in 2012.
210,"Using a reverse-genetics system based on CRISPR/Cas9 technology to construct a recombinant TGEV in which this specific nsp1 motif was altered, we found that this mutation does not affect virus replication in cell culture but significantly reduces TGEV pathogenicity in pigs."
211,"It shares homology with SARS and MERS-CoV, responsible for past outbreaks in China and in Middle East."
212,2019-nCoV is a newly identified coronavirus with high similarity to SARS-CoV.
213,"For instance, there are now eight paramyxoviruses, four coronaviruses and four orthomxoviruses that cause recurrent epidemics in humans but were once confined to other hosts."
214,"In this study, we developed a Bats-Hosts-Reservoir-People transmission network model for simulating the potential transmission from the infection source (probable be bats) to the human infection."
215,"In comparison of SARS-CoV-2 WIV04 with Bat-SARSr-CoV RaTG13, the ratios of non-synonymous to synonymous substitution rates (dN/dS) was the lowest among all performed comparisons, reconfirming the evolution of SARS-CoV-2 under stringent selective pressure."
216,Efforts towards developing a vaccine for Middle East respiratory syndrome coronavirus (MERS-CoV) have yielded promising results.
217,"Here, we tested the efficacy of prophylactic and therapeutic remdesivir treatment in a nonhuman primate model of MERS-CoV infection, the rhesus macaque."
218,The increased human cases and high mortality rate of MERS-CoV infection make it essential to develop safe and effective vaccines.
219,"The outbreak of this novel disease, caused by a novel coronavirus (the SARS-coronavirus), hit hardest in the Asian Pacific region, though eventually it spread to five continents."
220,"Inflammatory leukocyte infiltrations, hemorrhages and fibrosis of alveolar walls can be observed 2–11 days after MHV-A59 infection."
221,"Despite the tremendous efforts to control the disease, COVID-19 has now spread to over 100 countries and caused a global pandemic."
222,"Human pathogens in the Orthomyxoviridae and Coronaviridae families, especially pandemic H1N1 and avian H5N1 influenza A viruses and severe acute respiratory syndrome coronavirus (SARS-CoV), were investigated."
223,"However, compensatory mutations in S1 and some distant regions of S2 were required for restoration of the cell–cell fusion activity of S protein carrying L857 and for the infectivity of the recovered variants in cultured cells."
224,"We found that 2019-nCoV shows a rich composition of AT nucleotides that strongly influences its codon usage, which appears to be not optimized to human host."
225,The requirement for the virus to be manipulated in a biosafety level three (BSL-3) facility has impeded development of urgently-needed antiviral agents.
226,A mouse line transgenic for the receptor of human coronavirus-229E (HCoV-229E) was created using human APN (hAPN) cDNA driven by a hAPN promoter.
227,"With the spread of the new coronavirus accelerating, person-to-person transmission in family homes or hospitals, and intercity spread of 2019-nCoV occurred."
228,"[Image: see text] As the infection of 2019-nCoV coronavirus is quickly developing into a global pneumonia epidemic, the careful analysis of its transmission and cellular mechanisms is sorely needed."
229,"The role of the C terminus of betacoronavirus nsp1 in virulence has been characterized, but the location of the alphacoronavirus nsp1 region that is important for virulence remains unclear."
230,"The virus emerged in the US in 2013, resulting in severe production losses."
231," The precise mechanism of severe acute respiratory syndrome (SARS), which is caused by SARS-associated coronavirus (SARS-CoV), is still unclear."
232,The emergence or re-emergence of CoVs from animal reservoirs is a potential concern for public health.
233,"In the current study, we investigate the ability of WIV1-CoV to infect Rousettus aegyptiacus bats."
234,Nasal swabs from 1113 dromedary camels (39 farms) and 34 sheep (1 farm) and sputum samples from 2 MERS-CoV-infected camel farm owners and 1 MERS-CoV-infected sheep farm owner were collected.
235,MAb 201 is a severe acute respiratory syndrome–associated coronavirus (SARS-CoV)–specific MAb that prevents establishment of viral replication in vitro and prevents viral replication in vivo when administered prophylactically.
236,Diagnostic PCR protocols can be found at https://www.who.int/health-topics/coronavirus/laboratory-diagnostics-for-novel-coronavirus.
237,"Coronaviruses are a group of viruses that affect both animals and humans, and several (OC43, 229E, HKU1 and NL63) are a cause of the common cold.1, 2 However, two coronaviruses have previously caused significant outbreaks associated with more severe disease: the SARS coronavirus in 2002–2003 and the Middle East respiratory syndrome coronavirus that emerged in 2012.1, 2 Chinese authorities and researchers should be commended for their rapid sharing of viral sequences which enabled laboratories worldwide to develop diagnostic tests within weeks of discovery of the pathogen.3 An Australian laboratory subsequently isolated the virus from a clinical sample (the first to do so outside of China), and rapidly shared this virus with relevant global agencies, further aiding diagnostic, therapeutic and vaccine development efforts."
238,Hepatitis C virus (HCV) is among the most relevant causes of liver cirrhosis and hepatocellular carcinoma.
239,"Solving the crystal structure of full-length TGEV at 1.85-Å resolution and conducting several biochemical analyses, we observed that a specific motif (amino acids 91–95) of alphacoronavirus nsp1 is a conserved region that inhibits host protein synthesis."
240,"Camostat has been clinically used to treat chronic pancreatitis, and thus represents an exciting potential therapeutic for respiratory coronavirus infections."
241, Objectives Previous studies on the pneumonia outbreak caused by the 2019 novel coronavirus disease (COVID-19) were based on information from the general population.
242,"Since most animal models fail to faithfully recapitulate the clinical course of SARS-CoV in humans, the virus and host factors that mediate disease pathogenesis remain unclear."
243,"Importantly, the NSP16 mutation can be paired with other attenuating approaches to provide robust protection from heterologous challenge and in vulnerable populations."
244,"To understand how and when these clusters emerged, respiratory samples were taken from dromedary camels, a known host of MERS-CoV, in the same geographic regions as the human clusters."
245,"Human coronavirus sensitivity (HCVS) was expressed as a dominant phenotype in hybrids, indicating that mouse cells do not actively suppress 229E replication."
246,"These outbreaks of emerging/reemerging viruses can be triggered by cross-species viral transmission from wild animals to humans, or zoonoses."
247,"We mapped the predictive risk for filovirus, Nipah, Rift Valley Fever and coronavirus diseases."
248,"In addition, diphyllin delivered by polymeric nanoparticles consisting of poly(ethylene glycol)-block-poly(lactide-co-glycolide) (PEG-PLGA) further demonstrates an improved safety profile and enhanced inhibitory activity against FIPV."
249,"Unlike SARS-CoV that resolved within a year, continued introductions of MERS-CoV present an on-going public health threat."
250,Human coronaviruses cause both upper and lower respiratory tract infections in humans.
251,Enhanced surveillance and further investigation are ongoing.
252,Background Estimation of the fraction and contagiousness of undocumented novel coronavirus (COVID-19) infections is critical for understanding the overall prevalence and pandemic potential of this disease.
253,"Despite years of research, the precise determinants of coronavirus replication and pathogenesis remain unidentified."
254,"As a means of understanding the human infection, we characterized in vivo the neurotropic and neuroinvasive properties of HCoV-OC43 through the development of an experimental animal model."
255,"Diversity of coronavirus surface proteins likely contributes to epidemic disease, an important and timely topic given the recent emergence of the human SARS coronavirus."
256, An inactivated vaccine for severe acute respiratory syndrome (SARS)-associated coronavirus (SARS-CoV) was evaluated in rhesus monkeys.
257,The recent appearance of severe acute respiratory syndrome coronavirus (SARS-CoV) highlights the continual threat to human health posed by emerging viruses.
258,"Full genomic analyses of the two new SL-CoVs from Zhoushan (ZXC21 and ZC45) showed that their genomes were 29,732 nucleotides (nt) and 29,802 nt in length, respectively, with 13 open reading frames (ORFs)."
259,These studies demonstrate the importance of the conserved 2′O-MTase activity for CoV pathogenesis and highlight NSP16 as a conserved universal target for rapid live attenuated vaccine design in an expanding CoV outbreak setting.
260,The high fatality rate (35.4%) of this novel coronavirus and its persistent wide spread infectiousness in animal reservoirs have generated tremendous global public health concern.
261,"This review briefly describes the structure of the MERS-CoV spike (S) protein and its receptor-binding domain (RBD), discusses the current status of MERS vaccine development and illustrates the strategies used to develop RBD-based subunit vaccines against MERS."
262,"However, many key issues need to be addressed, including identification of the proximate, presumably zoonotic, source of the infection, the prevalence of the infection in human populations, details regarding clinical and pathological features of the human infection, the establishment of a small rodent model for the infection, and the virological and immune basis for the severe disease observed in most patients."
263," Three miscellaneous positive-strand RNA viruses are described briefly with an emphasis on the genome structure: caliciviruses, togaviruses, and coronaviruses."
264,A new pandemic out of China: the Wuhan 2019-nCoV coronavirus syndrome
265,"However, the mode of virus transmission is not well understood."
266,"Since the emergence of the first cases in Wuhan, China, the novel coronavirus (2019-nCoV) infection has been quickly spreading out to other provinces and neighboring countries."
267,Two out of twelve bats showed a modest increase in coronavirus specific antibodies post challenge.
268,The occurrence of a third significant coronavirus emergence in 17 years together with the high prevalence and virus diversity in bats implies that these viruses are likely to cross species boundaries again.
269,"Coronaviruses are enveloped, single-stranded RNA viruses that are distributed worldwide."
270,"Here, protein sequences of homologous nonstructural protein 4 of beta coronavirus are collected and conserved regions present in them are investigated via phylogenetic study to determine the most immunogenic part of protein."
271," Phase I human clinical studies involving therapeutics for emerging and biodefense pathogens with low incidence, such as the severe acute respiratory syndrome coronavirus (SARS-CoV), requires at a minimum preclinical evaluation of efficacy in two well-characterized and robust animal models."
272,"The S proteins from SARS-CoV-1 and SARS-CoV-2 are similar2, but structural differences in the receptor binding domain (RBD) preclude the use of SARS-CoV-1–specific neutralizing antibodies to inhibit SARS-CoV-23."
273,"The highly infectious porcine transmissible gastroenteritis virus (TGEV), which belongs to the coronaviruses (CoVs), causes diarrhea and high mortality rates in piglets, resulting in severe economic losses in the pork industry worldwide."
274," Viral metagenomics, modeling of protein structure, and manipulation of viral genetics are key approaches that have laid the foundations of our understanding of coronavirus biology."
275,The risk of SARS reemergence in humans remains high due to the large animal reservoirs of SARS-CoV-like coronavirus and the genome instability of RNA coronaviruses.
276,"In fact, due to this restricted host range, a robust immunocompetent small animal model is still lacking, hampering mechanistic analysis of virus pathogenesis, immune control and prophylactic vaccine development."
277,"Novel viruses from the families Picorna-, Papilloma-, and Anelloviridae as well as known viruses from the families Astro-, Corona-, Parvo-, and Hepeviridae were identified in different ferret cohorts."
278," Coronaviruses may cause respiratory, enteric and central nervous system diseases in many species, including humans."
279,": The ongoing new coronavirus pneumonia (Corona Virus Disease 2019, COVID-19) outbreak is spreading in China, but it has not yet reached its peak."
280,"Chinese government has taken strong measures in response to the epidemic of new coronavirus (2019-nCoV) from Jan.23, 2020."
281," The infection of a novel coronavirus found in Wuhan of China (SARS-CoV-2) is rapidly spreading, and the incidence rate is increasing worldwide."
282,The novel coronavirus (2019-nCoV) is a recently emerged human pathogen that has spread widely since January 2020.
283,The outbreak of coronavirus disease 2019 (COVID-19) has been spreading rapidly in China and the Chinese government took a series of policies to control the epidemic.
284,"The high case fatality rate, growing geographic distribution and vaguely defined epidemiology of this novel pathogen have created an urgent need for effective public health countermeasures, including safe and effective treatment strategies."
285,Background: The novel coronavirus (SARS-CoV-2) pandemic is driving many countries to adopt global isolation measures in an attempt to slow-down its spread.
286,"Phylogenetic analysis revealed that 2019-nCoV fell within the subgenus Sarbecovirus of the genus Betacoronavirus, with a relatively long branch length to its closest relatives bat-SL-CoVZC45 and bat-SL-CoVZXC21, and was genetically distinct from SARS-CoV."
287,"During this early period, published research primarily explored the epidemiology, causes, clinical manifestation and diagnosis, as well as prevention and control of the novel coronavirus."
288,Middle East respiratory syndrome coronavirus (MERS-CoV) causes a highly lethal pulmonary infection with ∼35% mortality.
289,"Arabidopsis or potato plants were genetically transformed with cDNAs constructs encoding the N-terminal domain (aa residues 1–750) or the full-length glycoprotein S of TGEV, responsible for the neutralizing antibody induction against the virus, under the control of the cauliflower mosaic virus 35S (CaMV 35S) promoter."
290,"Within a few days the same virus was detected in a Qatari patient receiving intensive care in a London hospital, a situation reminiscent of the role air travel played in the spread of Severe Acute Respiratory Syndrome coronavirus (SARS-CoV) in 2002."
291," As of March 24, 2020, novel severe acute respiratory syndrome coronavirus 2 (SARS-CoV-2) has been responsible for 379,661 infection cases with 16,428 deaths globally and the number is still increasing rapidly."
292,"In particular, the current coronavirus disease 2019 (COVID-19) pandemic has quickly intensified interest in developing treatment options to mitigate impact on human life."
293,"Elseways, the recurrent virus exposure over a short time-lapse might result in the Antibody Dependent Enhancement, triggering the violent immune reaction responsible for the severe clinical outcomes observed in the Hubei province."
294, Introduction Rapid worldwide spread of Coronavirus Disease 2019 (COVID-19) has resulted in a global pandemic.
