,sent
0,"An ideal animal model should reflect the clinical signs, viral replication and pathology seen in humans."
1,Lack of small animal model hinders MERS coronavirus research
2,"Apart from masked palm civets and bats, 29 other animal species had been tested for the SARS-CoV, and the results are summarized in this paper."
3,"We performed phylogenetic, split network, transmission network, likelihood-mapping, and comparative analyses of the genomes."
4,"Using a mouse model of hepatitis C, we examined the therapeutic effects of a recombinant vaccinia virus (rVV) that encodes an HCV protein."
5,The recombinant viruses replicated efficiently in cell culture and demonstrated variable sensitivities to neutralization with antibodies.
6,This article forms part of a symposium in Antiviral Research on “From SARS to MERS: research on highly pathogenic human coronaviruses.”
7," Infection with virulent biotypes of feline coronavirus (FCoV) can result in the development of feline infectious peritonitis (FIP), a typically fatal immune mediated disease for which there is currently no effective antiviral treatment."
8,"Bats, snakes and pangolins have been cited as potential carriers based on the sequence homology of CoV isolated from these animals and the viral nucleic acids of the virus isolated from SARS-CoV-2 infected patients."
9,The potential mutability of the coronavirus genome may pose problems in the control of future SARS outbreaks.
10,"However, the amino acid sequence of COVID-19 differs from other coronaviruses specifically in the regions of 1ab polyprotein and surface glycoprotein or S-protein."
11,Here we use computational tools from structural biology and machine learning to identify 2019-nCoV T-cell and B-cell epitopes based on viral protein antigen presentation and antibody binding properties.
12,This inevitably hinders understanding of virushost interaction and development of appropriate countermeasures.
13,"Of six family members who travelled to Wuhan, five were identified as infected with the novel coronavirus."
14,"Blocking MERS-CoV zoonotic transmission from dromedary camels, the animal reservoir, could potentially reduce the number of primary human cases."
15,"In this chapter, we describe the pathology of SARS-CoV infection in humans and explore the use of two models of the human conducting airway to develop a better understanding of the replication and pathogenesis of SARS-CoV in relevant in vitro systems."
16,"Data Synthesis COVID-19 mainly invades the lungs, causing its serious damage."
17,FCoV exhibits 2 biotypes: the pathogenic disease and a benign infection with feline enteric coronavirus (FECV).
18,"Similar to its homologous virus, SARS-CoV, which caused SARS in thousands of people in 2003, SARS-CoV-2 might also be transmitted from the bats and causes similar symptoms through a similar mechanism."
19,"Based on evolutionary analyses of coronavirus DNA sequences, encompassing an approximately 13kb stretch of the SARS-TOR2 genome, we provide evidence that SARS-CoV has a recombinant history with lineages of types I and III coronavirus."
20,Human monoclonal antibodies (MAbs) that neutralize SARS-associated coronavirus (SARSCoV) could provide protection for exposed individuals.
21," Two species of primates, Owl and African green monkeys, were inoculated intracerebrally with either the neurotropic mouse hepatitis virus JHM or the putative multiple sclerosis brain coronavirus isolate SD."
22,"The continuous increase of MERS cases has posed a serious threat to public health worldwide, calling for development of safe and effective MERS vaccines."
23,The outbreak of coronavirus disease 2019 (COVID-19) in Wuhan has aroused widespread concern and attention from all over the world.
24,The Bayesian phylogeographic reconstruction shows that the 2019–2020 nCoV most probably originated from the Bat SARS-like Coronavirus circulating in the Rhinolophus bat family.
25,Coronavirus COVID-19 spreads through the population mostly based on social contact.
26,The encoded domains are used first in a triage to identify potential Coronaviridae sequences and then processed using a Random Forest method to classify the sequences to the Coronaviridae genus level.
27,The transmission of the virus was expected to be from the camels found in Middle Eastern countries via the animal and human interaction.
28,Middle East Respiratory Syndrome Coronavirus (MERS-CoV) is an emerging zoonotic virus considered as one of the major public threat with a total number of 2 298 laboratory-confirmed cases and 811 associated deaths reported by World Health Organization as of January 2019.
29,Majority of these viruses are responsible for the outbreaks of pathogenic lethal infections.
30,2019-nCoV which was identified is a kind of beta coronavirus belongs to one of four coronavirus genera.
31, The origins and evolutionary history of the Severe Acute Respiratory Syndrome (SARS) coronavirus (SARS-CoV) remain an issue of uncertainty and debate.
32,World Health Organization has declared the ongoing outbreak of coronavirus disease 2019 (COVID-19) a Public Health Emergency of International Concern.
33,An oral Lactobacillus casei (L. casei) vaccine against anti-transmissible gastroenteritis virus developed in our laboratory was used to study mucosal immune responses.
34,SARS-CoV infected over 8000 people with approximately 10% mortality rate.
35,"There is still no effective method to prevent or treat severe acute respiratory syndrome (SARS), which is caused by SARS coronavirus (CoV)."
36,"SARS-CoV is a zoonotic virus that crossed the species barrier, most likely originating from bats or from other species including civets, raccoon dogs, domestic cats, swine, and rodents."
37,"Herein, we present a global portrait of some of the most prevalent or emerging human respiratory viruses that have been associated with possible pathogenic processes in CNS infection, with a special emphasis on human coronaviruses."
38,The development of transgenic mice expressing HCV proteins and the successful repopulation of SCID/Alb-uPA mice with human hepatocytes provides an important tool for unraveling virus–host interactions in vivo.
39,"Here, we present an overview of the current knowledge on both human coronaviruses, focusing on similarities and differences."
40,Clinical isolates were found to contain a novel coronavirus with similarity to bat coronaviruses.
41,The high morbidity and mortality of this potentially pandemic infection demands a rapid research response to develop effective antiviral treatment and vaccine.
42,"Since then, much progress has been made in the virological and molecular characterization of the proteins encoded by SARS-coronavirus (SARS-CoV) genome, which contains 14 potential open reading frames (ORFs)."
43,"For an effective immune prophylaxis in humans, broad coverage of different strains of SARS-CoV and control of potential neutralization escape variants will be required."
44,"The discovery of the SARS-CoV, which caused an outbreak of >8000 people in >30 countries with fatality of about 10%, resulted in intense search for novel coronaviruses with potentially high pathogenicity."
45,"However, limited data was available for severe acute respiratory syndrome coronavirus 2 (SARS-CoV-2) reactivation."
46,Interpretation MNA delivery of coronaviruses-S1 subunit vaccines is a promising immunization strategy against coronavirus infection.
47,Neutralizing antibodies from individuals who have recovered from an infection confer therapeutic protection to others infected with the same pathogen.
48,Each article will be identified in the last line of its abstract as belonging to the series “From SARS to MERS: 10years of research on highly pathogenic human coronaviruses.”
49,"In 2005, horseshoe bats were identified as the natural reservoir of a group of coronaviruses that are distantly related to SARS-CoV."
50,"However, as for the recent novel coronavirus, few studies have discussed systematically about the role of daily weather in the epidemic transmission of the virus."
51,Many patients with SARS-CoV experienced an exacerbated form of disease called acute respiratory distress syndrome (ARDS) requiring mechanical ventilation and supplemental oxygen and half of these patients died.
52,The emergence of this novel coronavirus prompts the need for a small animal model to study the pathogenesis of this virus and to test the efficacy of potential intervention strategies.
53,"The disease remains incurable, and there is no effective vaccine available."
54,"Then, we study the evolutionary pressures influencing the codon usage and evolutionary rates of the sequences of five conserved genes that encode the corresponding proteins (viral replicase, spike, envelope, membrane and nucleocapsid) characteristic of coronaviruses."
55, Middle East Respiratory Syndrome Coronavirus (MERS-CoV) continues to be a threat to human health in the Middle East.
56,"Several recently identified viruses remain to be ‘orphan’ but have a potential for further emergence (such as Tioman, Menangle, and Pulau viruses)."
57,"The prevalence of RVC in wild boar population reached 12.8%, PTV was detected in 20.2%, PSV in 8.9%, and EV-G in 2.5% of samples."
58,Severe acute respiratory syndrome (SARS)-like WIV1-coronavirus (CoV) was first isolated from Rhinolophus sinicus bats and can use the human angiotensin converting enzyme 2 (ACE2) receptor.
59,The identification of any clinically approved drug that could be repurposed to combat COVID-19 would allow the rapid implementation of potentially life-saving procedures to complement social distancing and isolation protocols.
60, Aims To analyze the potential mechanism of cardiovascular dysfunctions induced by Coronavirus Disease 2019 (COVID-19) and to evaluate more effective therapeutic pathways for patients with cardiovascular diseases.
61,"Two novel coronaviruses have emerged in humans in the 21(st) century, Severe Acute Respiratory Syndrome Coronavirus (SARS-CoV) and Middle East Respiratory Syndrome human coronavirus (MERS-CoV), both of which cause acute respiratory distress syndrome (ARDS) and have high mortality rates."
62,Background: As the outbreak of coronavirus disease 2019 (COVID19) is a worldwide pandemic it is rapidly expanding in Iran realtime analyses of epidemiological data are needed to increase situational awareness and inform interventions.
63,"Coronaviruses (CoVs) have a penchant for sudden emergence, as evidenced by severe acute respiratory syndrome coronavirus (SARS-CoV), Middle East respiratory syndrome CoV (MERS-CoV) and most recently, swine acute diarrhea syndrome coronavirus (SADS-CoV)."
64,Coronavirus spike (S) glycoproteins promote entry into cells and are the main target of antibodies.
65,"Because of availability and shown efficacy, the use of interferons may be considered should SARS-CoV or a related coronavirus (re)-emerge."
66,"The primary cause of severe acute respiratory syndrome (SARS) is a newly discovered coronavirus(1,2,3,4,5,6,7)."
67,Sars Coronavirus Accessory ORFs Encode Luxury Functions
68,"The rapid progress in the aetiology, the development of laboratory diagnostic tests, and the defining of routes of viral transmission were facilitated through a unique WHO-coordinated virtual network of laboratories, which shared information on a real-time basis through daily teleconferences."
69,"Although there are potential targets in the JAK-STAT pathway that can be manipulated in treatment for coronaviruses and it is evident that IL-1 is elevated in patients with a coronavirus, there is currently no evidence for a role of these drugs in treatment of COVID-19."
70," Aims A newly emerged Human Coronavirus (HCoV) is reported two months ago in Wuhan, China (COVID-19)."
71,"To date, 114 human cases of MERS-CoV have been reported, with 54 fatalities."
72,The scientific community is focussed on developing antiviral therapies to mitigate the impacts of the ongoing novel coronavirus disease (COVID-19) outbreak.
73,The evolutionary relationship between 2019-nCoV and the other human respiratory illness-causing coronavirus is not closely related.
74, This study investigates the propagation power and effects of the coronavirus disease 2019 (COVID-19) in light of published data.
75,"As exemplified by coronaviruses and influenza viruses, bats and birds are natural reservoirs for providing viral genes during evolution of new virus species and viruses for interspecies transmission."
76,This program generated 47 transcriptomic and proteomic datasets from 30 studies that investigate in vivo and in vitro host responses to viral infections.
77,A total of five potentially novel virus species or strains were identified.
78,"The etiology of this illness is now attributed to a novel virus belonging to the coronavirus (CoV) family, COVID-19."
79,"PCR amplification of the conserved coronaviral protein RdRp detected coronaviruses in 26.65% of bats belonging to this region, and this number was influenced by seasonal changes."
80,"In the authors’ laboratory, studies were undertaken to investigate the relationship between viral respiratory disease and bioactive lung lavage levels of IFN-α, TNF-α, IL-1 and IL-6."
81,Virus particles found in thin sections had a mean diameter of 68 nm.
82,"While coronaviruses were first identified nearly 60 years ago, they received notoriety in 2003 when one of their members was identified as the etiological agent of the Severe Acute Respiratory Syndrome (SARS-CoV) 1."
83,A newly identified novel coronavirus (SARS-CoV-2) is causing pneumonia-associated respiratory syndrome across the world.
84,"The coronavirus main protease (M(pro)), which plays a pivotal role in viral gene expression and replication through the proteolytic processing of replicase polyproteins, is an attractive target for anti-CoV drug design."
85,"Due to the lack of effective treatment options for SARS-CoV-2, various strategies are being tested in China, including drug repurposing."
86,"Hepatitis C virus is considered a major public health problem, infecting 2%–3% of the human population."
87,"Unfortunately, the similarities and differences between the two coronavirus diseases remain to be unknown."
88,"Despite high similarity of canine respiratory coronavirus (CRCoV), bovine coronavirus, (BCoV) and human coronavirus OC43 (HCoV-OC43), these viruses differ in species specificity."
89, The novel severe acute respiratory syndrome (SARS) coronavirus caused severe disease and heavy economic losses before apparently coming under complete control.
90,"Coronavirus disease 2019 (COVID-19) caused by severe acute respiratory syndrome coronavirus 2 (SARS-CoV-2) was first reported in Wuhan, China, and rapidly spread worldwide."
91,"By using genomic, sequence, structural and evolutionary analysis, we show that Alpha- and Beta-CoVs possess several novel families of immunoglobulin (Ig) domain proteins, including ORF8 and ORF7a from SARS-related coronaviruses and two protein groups from certain Alpha-CoVs."
92,"In addition, SARS- and MERS-coronavirus can use serine proteases localized at the cell surface, for their activation."
93," The newly emerged Middle East respiratory syndrome coronavirus (MERS-CoV) is currently spreading among humans, making development of effective MERS vaccines a high priority."
94,Nonhuman primate models are considered the gold standard for preclinical evaluation of therapeutic countermeasures.
95,"CTL responses were also detected to SARS DNA-transfected type II alveolar epithelial cells (T7 cell clone), which are thought to be initial target cells for SARS virus infection in human."
96,"Middle East respiratory syndrome CoV (MERS-CoV), identified in 2012, has caused 182 cases to date, with ~43% mortality, and no small animal model has been reported."
97,We have developed an improved method for Epstein-Barr virus transformation of human B cells.
98,"Here, we review such mAbs with an emphasis on antibodies of human origin, and highlight recent results as well as technologies and mechanisms related to their potential as therapeutics."
99,Middle East respiratory syndrome coronavirus is a recently emerged pathogen associated with severe human disease.
100," Severe acute respiratory syndrome (SARS) is a newly emerging infectious disease caused by a novel coronavirus (SARS-CoV), which has overwhelmed more than 30 countries claiming nearly 8400 cases with over 800 fatalities."
101,"Proof that a newly identified coronavirus, severe acute respiratory syndrome coronavirus (SARS-CoV) is the primary cause of severe acute respiratory syndrome (SARS) came from a series of studies on experimentally infected cynomolgus macaques (Macaca fascicularis)."
102,The coronavirus 2019-nCoV epidemic: Is hindsight 20/20?
103,"Since the identification of the outbreak the infection quickly spread involving in one month more than 31,000 confirmed cases with 638 death."
104,"In our present study, an epitope-based peptide vaccine against nonstructural protein 4 of beta coronavirus, using a combination of B cell and T cell epitope predictions, followed by molecular docking methods are performed."
105,The emergence of Middle East respiratory syndrome-coronavirus (MERS-CoV) in the Middle East since 2012 has caused more than 900 human infections with ∼40% mortality to date.
106,Collaborations across countries and sectors as a One Health World could be a milestone.
107,"In addition, the SARS Coronavirus (SARS-CoV) was also analyzed in the same way."
108,A novel human coronavirus (HCoV-EMC/2012) was isolated from a man with acute pneumonia and renal failure in June 2012.
109,"Infections cause a variety of diseases including bronchitis, gastroenteritis, hepatitis, and encephalitis, with symptoms ranging from being nearly undetectable to rapidly fatal."
110,"Adenovirus-positive participants with FRI episodes tended to be protected against subsequent infection with adenovirus, coronavirus, enterovirus/rhinovirus, and influenza virus (P = .062–.093), while men with influenza virus–positive FRI episodes tended be protected against subsequent infection with adenovirus (P = .044) and influenza virus (P = .081)."
111," This article introduces a series of invited papers in Antiviral Research marking the 10th anniversary of the outbreak of severe acute respiratory syndrome (SARS), caused by a novel coronavirus that emerged in southern China in late 2002."
112,The recently identified Middle East Respiratory Syndrome Coronavirus (MERS-CoV) causes severe and fatal acute respiratory illness in humans.
113,Recent outbreak of novel coronavirus infected and killed thousands of people in the world.
114,"The primer and probe sets were designed to react with this novel coronavirus and its closely related viruses, such as SARS coronavirus."
115,"Middle East respiratory syndrome (MERS) is an acute, high-mortality-rate, severe infectious disease caused by an emerging MERS coronavirus (MERS-CoV) that causes severe respiratory diseases."
116,The outcome of SARS-CoV-2 infection is largely determined by virus-host interaction.
117,"Using synthetic biology and reverse genetics, we describe the construction of a panel of isogenic SARS coronavirus (SARS-CoV) strains bearing variant spike glycoproteins that are representative of zoonotic strains found in palm civets and raccoon dogs, as well as isolates spanning the early, middle, and late phases of the SARS-CoV epidemic."
118,"In conclusion, WIV1-CoV was unable to cause a robust infection in Rousettus aegyptiacus bats."
119,"Understanding the evolution, zoonotic transmission, and source of this novel virus would help accelerating containment and prevention efforts."
120,"Further, the drug hexamethylene amiloride (HMA), but not amiloride, inhibited in vitro ion channel activity of some synthetic coronavirus E proteins, and also viral replication."
121,"No small-animal model for this infection is currently available, but studies suggest that virus entry factors can confer virus susceptibility."
122,"Previously, groups had targeted conserved coronavirus proteins as a strategy to generate live-attenuated vaccine strains against current and future CoVs."
123,"Some of these ORFs encode for genes that are homologous to proteins found in all known coronaviruses, namely the replicase genes (ORFs 1a and 1b) and the four structural proteins: nucleocapsid, spike, membrane and envelope, and these proteins are expected to be essential for the replication of the virus."
124,The aetiological agent was eventually identified as a coronavirus and designated Middle East respiratory syndrome coronavirus (MERS-CoV).
125,"Currently, there is a lack of effective antiviral treatment options or vaccine available."
126,"These cases of human-to-human transmission involve close contact and have occurred primarily in healthcare settings, and they are suspected to result from repeated zoonotic introductions."
127,The novel Coronavirus pathogen Covid-19 is a cause of concern across the world as the human-to-human infection caused by it is spreading at a fast pace.
128,"Overall, the molecular and biologic characteristics of the strain HSR1 provide evidence that SARS-CoV forms a fourth genetic coronavirus group with distinct genomic and biologic features."
129,"In summary, rewiring the TRN is a feasible strategy for limiting reversion in an effective live-attenuated coronavirus vaccine candidate that is potentially portable across the Nidovirales order."
130, The causative agent of Severe Acute Respiratory Syndrome (SARS) was identified as a coronavirus (CoV) following the outbreak of 2002–2003.
131, Murine antisera with neutralising activity for the coronavirus causative of Middle East respiratory syndrome (MERS) were induced by immunisation of Balb/c mice with the receptor binding domain (RBD) of the viral Spike protein.
132,"Hepatitis C virus (HCV) infection is a major cause of chronic liver disease and hepatocellular carcinoma, yet fully efficacious treatments are missing."
133,"To date, there is no evidence for an animal reservoir of viruses closely related to hepatitis C virus which may have crossed the species barrier to cause disease in humans and resulted in the current pandemic."
134,COVID-19: a novel zoonotic disease caused by a coronavirus from China: what we know and what we don’t
135,"Here we used comparative pangenomic analysis of all sequenced Betacoronaviruses to reveal that, among all core gene clusters present in these viruses, the envelope protein E shows a variant shared by SARS and SARS-Cov2 with two completely-conserved key functional features, an ion-channel and a PDZ-binding Motif (PBM)."
136,"Coronaviruses (CoVs) can infect humans and multiple species of animals, causing a wide spectrum of diseases."
137,"These warm-blooded vertebrates display high species biodiversity, roosting and migratory behavior, and a unique adaptive immune system, which are favorable characteristics for asymptomatic shedding, dissemination, and mixing of different viruses for the generation of novel mutant, recombinant, or reassortant RNA viruses."
138,"As reported by the World Health Organization, a novel coronavirus (2019-nCoV) was identified as the causative virus of Wuhan pneumonia of unknown etiology by Chinese authorities on 7 January, 2020."
139,Infection by the Middle East respiratory syndrome coronavirus (MERS-CoV) causes respiratory illness and has a high mortality rate (~35%).
140,"Although some other livestock animal species have been shown to be susceptible to MERS-CoV, it is not fully understood why the spread of the virus in these animal species has not been observed in the field."
141, The nucleotide sequence of the unique region of coronavirus MHV-A59 mRNA 2 has been determined.
142,The emergence of a novel coronavirus (2019-nCoV) has awakened the echoes of SARS-CoV from nearly two decades ago.
143,: The Severe Acute Respiratory Syndrome Coronavirus 2 (SARS-CoV-2) first broke out in Wuhan (China) and subsequently spread worldwide.
144,"However, few broad-spectrum antiviral drugs have been evaluated against COVID-19 in clinical trials, resulted in clinical recovery."
145," The causative agent of severe acute respiratory syndrome (SARS), which affected over 8000 individuals worldwide and was responsible for over 700 deaths in the 2002–2003 outbreak, is a coronavirus that was unknown before the outbreak."
146, Bovine respiratory syncytial virus (BRSV) and bovine coronavirus (BCoV) are considered widespread among cattle in Norway and worldwide.
147,"Background: As reported by Iranian governments, the first cases of coronavirus (COVID-19) infections confirmed in Qom, Iran on February 19, 2020 (30 Bahman 1398)."
148,"To date, 55 human cases have been reported, including 31 fatal cases."
149,"In this review, the current state of vaccine development against human severe acute respiratory syndrome (SARS) coronavirus, focusing on recently published data is assessed."
150,"Molecular analysis suggest that 2019-nCoV could be originated from bats after passaging in intermediate hosts, highlighting the high zoonotic potential of coronaviruses."
151," The emergence of the Middle East respiratory syndrome coronavirus (MERS-CoV) in 2012 marked the second time that a new, highly pathogenic coronavirus has emerged in the human population in the 21st century."
152,"As the pandemic progresses, information from human compassionate use cases will continue to accumulate before the clinical trials are concluded."
153,"The former is raised from the fact that axonal damage has been reported in several virus infections, including human immunodeficiency virus, human T-lymphotropic virus 1, herpes simplex virus and coronavirus, which also cause demyelination."
154,"They are relatively inexpensive and easily accessible, but their use in SARS research is limited because they do not develop illness following infection."
