,sent
2149,"Together with other reports concerning the inhibitory effect of lithium salts on IBV in cell culture, our results indicate that LiCl may be a potent agent against porcine and avian coronaviruses."
2150,"Compared to SARS, MERS progresses more rapidly to respiratory failure and acute kidney injury, is more often observed as severe disease in patients with underlying illnesses and is more often fatal."
2151,The rationale for and outcomes with treatments used for SARS and MERS is discussed.
2152,"Then, these structures could serve as leading compounds to develop a series of derivatives optimizing their activity against SARS-CoV-2 and other coronaviruses."
2153,"However, caution should be taken in using the inactivated SARS-CoV as a vaccine since it may also cause harmful immune and/or inflammatory responses."
2154,We postulate that the versatility of cell receptor binding strategies has immediate implications on therapeutic strategies.One Sentence Molecular dynamics simulations reveal a temporal dimension of coronaviruses interactions with the host receptor.
2155,SARS-CoV VLPs are highly immunogenic and induce neutralizing antibodies and provide protection against lethal challenge.
2156,Both coronaviruses entered polarized LMR cells only through the apical surface.
2157,"With an exchange of nearly one-third of the genome with other members of alphacoronaviruses, the new emerging virus could gain new antigenicity, posing a threat to cats that either have been infected with a type I virus before or never have been infected with FCoV."
2158,"Hence, our study has also identified anti-SARS-CoV-2 therapy candidates that can be readily tested in patients."
2159,Dromedary camels are natural host of the Middle East respiratory syndrome coronavirus (MERS-CoV).
2160,: The continual Middle East respiratory syndrome (MERS) threat highlights the importance of developing effective antiviral therapeutics to prevent and treat MERS coronavirus (MERS-CoV) infection.
2161,"Similar to such other coronaviruses as those causing the Middle East respiratory syndrome (MERS) and severe acute respiratory syndrome (SARS), the new coronavirus was reported to spread via natural aerosols from human-to-human."
2162,"SRFBP1 facilitates host cell penetration by all seven HCV genotypes, but not of vesicular stomatitis virus and human coronavirus."
2163,"In contrast, highly pathogenic hCoVs such as severe acute respiratory syndrome CoV (SARS-CoV) and Middle East respiratory syndrome CoV (MERS-CoV) predominantly infect lower airways and cause fatal pneumonia."
2164,"The phylogenetic tree showed that 2019.nCoV significantly clustered with Bat SARS-like Coronavirus sequence isolated in 2015, whereas structural analysis revealed mutation in S and nucleocapsid proteins."
2165,"Coronaviruses (CoVs) are a large group of enveloped viruses with a single-strand RNA genome, which continuously circulate in mammals and birds and pose a threat to livestock, companion animals, and humans."
2166,"Pathogens were detected in 82 samples, which included Respiratory syncytial viruses (RSV) A / B (35.4%), Human rhinovirus (25.6%), Adenovirus (22%), Human Parainfluenza viruses (11%), Human bocavirus (9.8), Human metapneumovirus A / B (8.5%), Influenza A (H1N1) pdm 09 (6.1%), Parechovirus (3.7%), Human coronaviruses (3.66%), Haemophilus influenzae type b (6.1%), Chlamydia pneumoniae (2.4%) and Mycoplasma pneumoniae (2.4%)."
2167,"The SARS-CoV emerged in 2002 as an important cause of severe lower respiratory tract infection in humans, and FIPV infection causes a chronic and often fatal peritonitis in cats."
2168,"Currently, treating COVID-19 patients, particularly those afflicted with severe pneumonia, is challenging as no specific drugs or vaccines against SARS-CoV-2 are available."
2169,"However, the emergence of severe acute respiratory syndrome coronavirus (SARS-CoV), and more recently, Middle East respiratory syndrome coronavirus (MERS-CoV), has impelled the development of such drugs."
2170,The proposed assay detected the first SARS-CoV-2 infection in Brazilian Central-West.
2171," The outbreak of COVID-19, a respiratory disease from a novel coronavirus that was first detected in Wuhan City, Hubei Province, China is now a public health emergency and fast approaching a pandemic."
2172,Chloroquine for the 2019 novel coronavirus SARS-CoV-2
2173,"In late December 2019 a previous unidentified coronavirus, currently named as the 2019 novel coronavirus (2019-nCoV), emerged from Wuhan, China and resulted in a formidable outbreak in many cities in China and expanding globally, including Thailand, Republic of Korea, Japan, USA, Philippines, Viet Nam, and our country (as of 2/6/2020 at least 25 countries)."
2174,TGEV does not contain a receptor-destroying enzyme and does not depend on the sialic acid binding activity for infection of cultured cells.
2175,The predicted model is highly consistent with the experimentally determined complex structures.
2176, The SARS-CoV-2 is a new human coronavirus candidate recently detected in China that is now reported in people on inhabited continents.
2177,"Within few weeks, the World Health Organization (WHO) announced a novel coronavirus designated as coronavirus disease 2019 (COVID-19)."
2178,"It is suggested that the therapeutic effect of ritonavir and lopinavir on COVID-19 may be mainly due to their inhibitory effect on CEP_C30, while ritonavir may have stronger efficacy; the inhibitory effect of darunavir on SARS-CoV-2 and its potential therapeutic effect may be mainly due to its inhibitory effect on PLVP."
2179, SARS-CoV-2 causes the recent global COVID-19 public health emergency.
2180,Emergence of SARS-like coronavirus poses new challenge in China
2181,"The emergence of deadly human coronaviruses, severe acute respiratory syndrome coronavirus (SARS-CoV), and Middle East respiratory syndrome coronavirus (MERS-CoV) have bolstered research in these viral and often zoonotic pathogens."
2182,The scientific community is focussed on developing antiviral therapies to mitigate the impacts of the ongoing novel coronavirus disease (COVID-19) outbreak.
2183,"After infection with SARS-CoV, cells were observed for cytopathic effects, and quantitative real-time polymerase chain reaction was used to measure ongoing viral replication."
2184,"Through comprehensive analysis of the available genome sequences of 2019-nCoV strains, we have tracked multiple inheritable SNPs and determined the evolution of 2019-nCoV relative to other coronaviruses.ResultsSystematic analysis of 120 genomic sequences of 2019-nCoV revealed co-circulation of two genetic subgroups with distinct SNPs markers, which can be used to trace the 2019-nCoV spreading pathways to different regions and countries."
2185,Coronaviruses are respiratory viruses whose appearance on electron microscopy looks like tiny crowns (Figure 1).
2186,"In our previous work, we showed that a panel of murine monoclonal antibodies (mAbs) that target the S2 subunit of the S protein are capable of neutralizing SARS-CoV infection in vitro (Lip KM et al, J Virol."
2187,"The World Health Organization (WHO) has issued a warning that, although the 2019 novel coronavirus (COVID-19) from Wuhan City (China), is not pandemic, it should be contained to prevent the global spread."
2188,"Histopathology seen in animals given one of the SARS-CoV vaccines was uniformly a Th2-type immunopathology with prominent eosinophil infiltration, confirmed with special eosinophil stains."
2189, Infectious bronchitis coronavirus (IBV) is the cause of the single most economically costly infectious disease of domestic fowl in the UK—and probably so in many countries that have a developed poultry industry.
2190,• Detection of SARS-CoV-2 within 3.5 h (sample-to-answer-time) by random access real time PCR.
2191,"Viral Nucleocapsid and Spike protein targets seem to co-opt downregulated miR-223 and miR-98 respectively within BASCs to control the various stages of BASC differentiation, activation of inflammatory chemokines, and downregulation of ACE2."
2192,"Additionally, understanding the global diversity of respiratory viruses is also part of emerging disease preparedness, because non-human coronaviruses and paramyxoviruses have been listed as priority concerns in a recent WHO research and development blueprint initiative for emerging infectious diseases."
2193,This review describes the suppressive effects of CsA on coronavirus replication.
2194,A TMPRSS2 inhibitor approved for clinical use blocked entry and might constitute a treatment option.
2195,Cats are susceptible to natural infection with several strains of feline coronavirus that result in either effusive and noneffusive feline infectious peritonitis or enteritis.
2196,"We solved the X-ray crystal structure of six-helical bundle (6-HB) core of the HR1 and HR2 domains in the SARS-CoV-2 S protein S2 subunit, revealing that several mutated amino acid residues in the HR1 domain may be associated with enhanced interactions with the HR2 domain."
2197,"Here, using TGEV nsp1 as a model to explore the function of this protein in alphacoronaviruses, we demonstrate that alphacoronavirus nsp1 inhibits host gene expression."
2198,Biochemical and morphological evidence showed that influenza haemagglutinin on the apical surface serves as a receptor for the superinfecting virus by binding to its sialic acid-bearing envelope proteins.
2199,The majority of studies carried out in SARS-CoV-infected humans and animals attribute a dysregulated/exuberant innate response as a leading contributor to SARS-CoV-mediated pathology.
2200,"Unlike SARS-CoV that resolved within a year, continued introductions of MERS-CoV present an on-going public health threat."
2201,These natural and social factors influenced the general progression and trajectory of the SARS epidemiology.
2202,"A novel severe acute respiratory syndrome coronavirus (SARS-CoV-2) was identified from respiratory illness patients in Wuhan, Hubei Province, China, which has recently emerged as a serious threat to the world public health."
2203,Future research on the molecular virology of SARS-CoV will be important in the understanding of the epidemiology and the natural history of SARS.
2204,"In the present study, we identified transmembrane protease serine 2 (TMPRSS2), whose expression does correlate with SARS-CoV infection in the upper lobe of the lung."
2205,Efforts have been made to develop vaccines against human coronavirus (CoV) infections such as MERS and SARS in the past decades.
2206,"By screening the experimentally-determined SARS-CoV-derived B cell and T cell epitopes in the immunogenic structural proteins of SARS-CoV, we identified a set of B cell and T cell epitopes derived from the spike (S) and nucleocapsid (N) proteins that map identically to SARS-CoV-2 proteins."
2207,"Search terms were, COVID-19, treatment of coronavirus, COVID 19 and following terms; chloroquine, hydroxychloroquine, ibuprofen, ACE-inhibitors or angiotensin receptor blockers, cardiovascular disease, diarrhoea, liver, testis and gastrointestinal disease."
2208,"We show that the protease inhibitor binding sites of 2019-nCoV and SARS-CoV are almost identical, which means all potential anti-SARS-CoV chemotherapies are also potential 2019-nCoV drugs."
2209,A comparison of the properties of these three groups of SARS-CoV proteins with the knowledge that coronavirologists have generated over more than 30 years of research can help us in the prevention and treatment of SARS in the event of the re-emergence of this new infectious disease.
2210,"COVID-19 is similar to Severe Acute Respiratory Syndrome coronavirus (SARS-CoV) virus in its pathogenicity, clinical spectrum, and epidemiology."
2211,"Herein, we hypothesize that BCG vaccination policies adopted by different countries might influence the SARS-CoV-2 transmission patterns and/or COVID-19 associated morbidity and mortality through the vaccine’s capacity to confer heterologous protection."
2212,"Methods We expressed the complete SARS coronavirus envelope spike (S) protein from a recombinant attenuated parainfluenza virus (BHPIV3) that is being developed as a live attenuated, intranasal paediatric vaccine against human parainfluenza virus type 3 (HPIV3)."
2213,"This virus is lethal and is a close relative of a severe acute respiratory syndrome (SARS), which is responsible for more than 3000 deaths in 2002–2003."
2214,The R667A SARS-CoVpp mutant exhibited a lack of virus entry enhancement following protease treatment.
2215,"ACE2, the host cell receptor for severe acute respiratory syndrome coronavirus (SARS), has recently been demonstrated in mediating 2019-nCoV infection."
2216,Bats and pangolins are suspected as the reservoir and the intermediate host.
2217, Effective countermeasures against the recent emergence and rapid expansion of the 2019 novel coronavirus (SARS-CoV-2) require the development of data and tools to understand and monitor its spread and immune responses to it.
2218,"Furthermore, although SARS does not require NPC1 for entry, SARS entry also begins after colocalization with NPC1."
2219,"All of the 21 SARS-positive serum samples could be recognized by our IFA, giving a specificity and sensitivity of 100%, which was compatible with both whole virus-based IFA assays."
2220,"So, there is an urgent requirement of new and effective medications that can treat the disease caused by SARS-CoV-2."
2221,"This outbreak first detected in Wuhan, China in December 2019, has spread to other regions of China and to 25 other countries as of January, 2020."
2222,"In this manuscript, we have extended our preliminary analysis to include SARS-CoV-2 virus as well."
2223,"We also demonstrated, by passive antibody transfer, that the antibody response induced by the vaccine was sufficient for controlling SARS-CoV infection."
2224,These findings suggest that the new virus does not readily transmit between humans and should theoretically not able to cause very serious human infection.
2225,"Emergence of a novel coronavirus causing respiratory illness from Wuhan, China"
2226,"As important, HCoV-EMC does not enter cells using the SARS-CoV receptor, human angiotensin-converting receptor-2 (hACE2)."
2227,The designed multi-epitope vaccine showed potential to elicit specific immune responses against the SARS-COV-2.
2228,"We found that higher concentrations of anti-sera against SARS-CoV neutralized SARS-CoV infection, while highly diluted anti-sera significantly increased SARS-CoV infection and induced higher levels of apoptosis."
2229,"the cell-, organ- or animal species-spectrum) can dramatically change."
2230,Our results showed that RBD-Fc vaccination induced high titer of S-specific antibodies with long-term and potent SARS-CoV neutralizing activity.
2231,"Previously, we have reported the inhibitors that target 3C-like protease (3CLpro) with broad-spectrum activity against important human and animal coronaviruses."
2232,"On the same day, a throat swab was obtained from another passenger on that flight; that passenger was confirmed to have the first known imported case of SARS-CoV-2 infection in Taiwan when the swab was found to be positive for the virus on January 21."
2233,"Because anti-SARS drugs based on S2 heptads have short half-lives and are difficult to manufacture, our findings suggest that the S1B region might be of interest for anti-SARS drug discovery."
2234," Five years after the first severe acute respiratory syndrome (SARS) outbreak, several candidate SARS-coronavirus (CoV) vaccines are at various stages of preclinical and clinical development."
2235,Many patients with SARS-CoV experienced an exacerbated form of disease called acute respiratory distress syndrome (ARDS) requiring mechanical ventilation and supplemental oxygen and half of these patients died.
2236,Phylogenetic analyses of 15 HCoV whole genomes reveal that 2019-nCoV/SARS-CoV-2 shares the highest nucleotide sequence identity with SARS-CoV (79.7%).
2237," Following the boom in respiratory virology in the 1960s, species of rhinoviruses, coronaviruses, enteroviruses, adenoviruses, parainfluenza viruses and respiratory syncytial virus were added to influenza and measles viruses as causes of respiratory tract infection."
2238,"Our data indicate that calves are susceptible to infection by the newly emerged PDCoV, but not by the swine coronavirus, PEDV."
2239,"Since the NIH Clinical Collection consists of compounds that have already been through clinical trials, these small molecule inhibitors have a great potential for rapid development as anti-coronavirus drugs."
2240,The spread of the COVID-19 caused by the SARS-CoV-2 outbreak has been growing since its first identification in December 2019.
2241,These results strongly indicate that host and virus factors such as advanced age and virus adaptation are critical for the development of SARS in rats.
2242,"Coronavirus disease 2019 (COVID-19) is newly emerging human infectious diseases, which is caused by Severe Acute Respiratory Syndrome Coronavirus 2 (SARS-CoV-2, also previously known as 2019-nCoV)."
2243,"Here, we review the genomics of the SARS coronavirus (SARS-CoV), its phylogeny, antigenic structure, immune response and potential therapeutic interventions should the SARS epidemic flare up again."
2244,Recent outbreaks of SARS-Coronavirus and MERS-Coronavirus (CoV) have heightened awareness about the lack of vaccines or antiviral compounds approved for prevention or treatment of human or potential zoonotic CoVs.
2245," Serological, molecular and phylogenetic analyses of a recently imported case of Middle East respiratory syndrome coronavirus (MERS-CoV) in Greece are reported."
2246,"Involved in the formation of the coronavirus replication complex, the viral main protease (Mpro, also called 3CLpro) represents an attractive target for therapy."
2247,: Severe acute respiratory syndrome (SARS) is caused by a newly discovered coronavirus (SARS-CoV).
2248,"The disease was caused by a previously unrecognized coronavirus, SARS-CoV."
2249,"With the continuous development of the epidemic, it has become a national public health crisis and calls for urgent antiviral treatments or vaccines."
2250,We analyzed the characteristics of seven monoclonal antibodies (mAbs) raised against purified HE (hemagglutinin-esterase) glycoprotein of the murine coronavirus DVIM (diarrhea virus of infant mice).
2251,"We assessed the effect of triggering TLR2, TLR3, TLR4, and TLR7 with selected ligands on the susceptibility of the J774A.1 macrophage cell line to infection with murine coronavirus (mouse hepatitis virus, [MHV])."
2252,"These findings suggest a trade-off between the efficacy and spectrum for therapeutic antibodies to different coronaviruses, and hence highlight the possibilities and challenges in developing broadly protecting antibodies and vaccines against SARS-CoV-2 and its future mutants."
2253,"In order to assess the potential of the Wuhan 2019-nCoV to cause maternal, fetal and neonatal morbidity and other poor obstetrical outcomes, this communication reviews the published data addressing the epidemiological and clinical effects of SARS, MERS, and other coronavirus infections on pregnant women and their infants."
2254,Caution in proceeding to application of a SARS-CoV vaccine in humans is indicated.
2255,Our data on the N- and O-glycosylation is strengthened by extensive manual interpretation of each glycopeptide spectra in addition to using bioinformatics tools to confirm the complexity of glycosylation in the spike protein.
2256,"Within the gamma-CoVs the main representative is avian coronavirus, a taxonomic name which includes the highly contagious infectious bronchitis viruses (IBVs) in chickens and similar viruses infecting other domestic birds such as turkeys, guinea fowls, or quails."
2257,Severe acute respiratory syndrome CoV-2 (SARS-CoV-2) caused the Corona Virus Disease 2019 (COVID-19) cases in China has become a public health emergency of international concern (PHEIC).
2258,"Because SARS coronavirus RNA can be detected in the stool of some individuals for at least 9 weeks, recurrence of SARS from persistently shedding human or animal reservoirs is biologically plausible."
2259,"Infection by enveloped coronaviruses (CoVs) initiates with viral spike (S) proteins binding to cellular receptors, and is followed by proteolytic cleavage of receptor-bound S proteins, which prompts S protein-mediated virus-cell membrane fusion."
2260,A novel coronavirus has been recently identified as the causative agent of the severe acute respiratory syndrome (SARS) outbreak that has accounted for more than 8000 infected people worldwide.
2261,"A novel coronavirus has caused thousands of human infections in China since December 2019, raising a global public health concern."
2262,"For those critical pediatric patients with positive SARS-CoV-2 diagnosis, polypnea may be the most common symptom."
2263,This disease had never been observed in man before; the SARS-Coronavirus causing the disease was unknown.
2264,"For all the SARS-CoV associated proteins derivated from the SARS-CoV genome, the physiochemical properties such as the molecular weight, isoelectric point and extinction coefficient of each protein were calculated."
2265," Coronaviruses (CoVs) infect humans and many animal species, and are associated with respiratory, enteric, hepatic, and central nervous system diseases."
2266,"To explore the potential of using non-human coronaviruses for cancer therapy, we first established their ability to kill human tumor cells."
2267,"This review discusses recent progress in studies of virus-host interactions during animal and human coronavirus and arterivirus infections, with emphasis on IBV-host cell interactions."
2268,"The CoV responsible for an outbreak of severe acute respiratory disease (SARS-CoV) in 2002–03 likely originated as a bat coronavirus which, during replication in an intermediate host (such as the palm civet), evolved to be able to infect humans efficiently."
2269,"With the exception of the highly pathogenic SARS and MERS coronaviruses, human coronaviruses (HCoV-NL63, HCoV-OC43, HCoV-229E, and HCoV-HKU1) circulate worldwide and typically cause the common cold."
2270,"Influenza, measles, SARS, MERS, and smallpox illnesses are caused by highly infectious viral pathogens that induce critical illness."
2271,"Of interest, SARS-CoV proteins were detected only in PM that did not produce significant amounts of interferon (IFN)-α, and in one such case, preliminary electron microscope studies demonstrated that SARS-CoV-like particles could enter the cells, possibly via phagocytosis."
2272,Masked palm civets were suspected as the origin of the SARS outbreak in 2003 and was confirmed as the direct origin of SARS cases with mild symptom in 2004.
2273,"Feline enteric coronavirus (FECV) causes inapparent or mild enteritis in cats, but a highly fatal disease, called feline infectious peritonitis (FIP), can arise through mutation of FECV to FIP virus (FIPV)."
2274,"The viruses most commonly isolated from symptomatic patients during the Hajj by PCR were rhinovirus (5.9–48.8% prevalence), followed by influenza virus (4.5–13.9%) and non-MERS coronaviruses (2.7–13.2%) with most infections due to coronavirus 229E; other viruses were less frequently isolated."
2275,Authors conclude that development of successful SARS-CoV vaccines and antivirals depends on the progress we make in these areas in the immediate future.
2276,Ancestral state analyses revealed that SARS-CoV-2 differentiated from its most recent common ancestor with RaTG13 by accumulating a significant number of amino acid changes in the RBD.
2277,"Coronaviruses are a group of viruses that affect both animals and humans, and several (OC43, 229E, HKU1 and NL63) are a cause of the common cold.1, 2 However, two coronaviruses have previously caused significant outbreaks associated with more severe disease: the SARS coronavirus in 2002–2003 and the Middle East respiratory syndrome coronavirus that emerged in 2012.1, 2 Chinese authorities and researchers should be commended for their rapid sharing of viral sequences which enabled laboratories worldwide to develop diagnostic tests within weeks of discovery of the pathogen.3 An Australian laboratory subsequently isolated the virus from a clinical sample (the first to do so outside of China), and rapidly shared this virus with relevant global agencies, further aiding diagnostic, therapeutic and vaccine development efforts."
2278,"Sialylation of red blood cells with limiting amounts of sialic acid indicated that strain JHB/1/66 of influenza C virus requires less Neu5,9Ac2 for agglutination of erythrocytes than the two coronaviruses, both of which were found to be similar in their reactivity with Neu5,9Ac2-containing receptors."
2279,"In this open-label nonrandomized control study, FPV showed significantly better treatment effects on COVID-19 in terms of disease progression and viral clearance; if causal, these results should be important information for establishing standard treatment guidelines to combat the SARS-CoV-2 infection."
2280,"To understand the mechanism by which a virus escapes from antibody-mediated neutralization, we have investigated the interactions of non-neutralizing and neutralizing antibodies at an epitope cluster on the spike protein of severe acute respiratory syndrome coronavirus (SARS-CoV)."
2281,The absence of open reading frame (ORF) 3b and significant changes to ORF6 suggest the two key IFN antagonists may not maintain equivalent function in SARS-CoV-2.
2282,"In this work, efficiently transfectable mouse cell lines stably expressing the murine SARS-CoV receptor angiotensin converting enzyme 2 (ACE2) have been generated."
2283,"SARS-CoV, But not HCoV-NL63, Utilizes Cathepsins to Infect Cells: Viral Entry"
