,sent
1433,"This review provides an overview of current information on coronavirus and the application of small interfering RNA in viral therapeutics, with particular reference to SARS-CoV."
1434,An anti-ACE2 polyclonal antiserum (that prevents coronavirus infection in cell cultures) was used as a positive control and allowed to validate the assay for antiviral screening purposes.
1435,"Severe acute respiratory syndrome (SARS)-CoV and Middle East respiratory syndrome (MERS)-CoV both originated from bats, and it is highly likely that bat coronaviruses will cause future outbreaks."
1436,"In this study, we showed that lipid rafts also play an important role in the life cycle of severe acute respiratory syndrome (SARS)-coronavirus (CoV)."
1437,Human Coronavirus 229E can Use CD209L (L-Sign) to Enter Cells
1438,ACE2 is the receptor for both SARS-CoV-2 and SARS-CoV.
1439,Do the vaccines generated to the SARS-CoV or MERS-CoV or their proteins offer protection against 2019-nCoV?
1440,The angiotensin-converting enzyme 2 (ACE-2) has been identified as a functional receptor for SARS-CoV.
1441,The inhibitory effect of LiCl was also observed with porcine epidemic diarrhea coronavirus.
1442,"Cytotoxic chemotherapy has been shown to be a specific inhibitor for severe acute respiratory syndrome coronavirus in in vitro studies, but no specific studies exist as of yet for COVID-19."
1443,"Objectives: The rapidly evolving coronavirus disease 2019 (COVID-19), was declared a pandemic by the World Health Organization on March 11, 2020."
1444,"For bovine coronavirus (BCoV) and related viruses, binding to cell surface components containing N-acetyl-9- O-acetylneuraminic acid is essential for initiation of an infection."
1445,It is of special significance to find a safe and effective vaccine against coronavirus disease 2019 (COVID-19) that can induce T cell and B cell -mediated immune responses.
1446,Further efforts should focus on identifying the etiology of the SARS-associated virus and ruling out conclusively the existence of other possible SARS-related pathogen(s).
1447,All the articles mentioned about the role of chloroquine and /or hydroxychloroquine in limiting the infection with SARS-CoV-2 (the virus causing COVID-19).
1448,"Fully differentiated 3D nasal epithelium cultures were inoculated with picornaviruses, a coronavirus and influenza A viruses in the absence or in the presence of reference antiviral drugs."
1449,The aetiological agent was eventually identified as a coronavirus and designated Middle East respiratory syndrome coronavirus (MERS-CoV).
1450,"Chloroquine exerts direct antiviral effects, inhibiting pH-dependent steps of the replication of several viruses including members of the flaviviruses, retroviruses, and coronaviruses."
1451,"Specifically, Coughlin et al."
1452,"Another interesting finding was that mouse antibodies elicited separately by plasmids encoding S1 and S2 subunits cooperatively neutralized SARS-CoV but neither the S1 nor S2 specific antibodies did, suggesting the possible role of both S1 and S2 subunits in host cell docking and entry."
1453,"The effects of the compounds were specific to NS1, because they had no effect on the ability of the severe acute respiratory syndrome coronavirus papainlike protease protein to block beta interferon promoter activation."
1454,"Further studies using recovered SARS and COVID-19 patients’ sera show limited cross-neutralization, suggesting that recovery from one infection might not protect against the other."
1455,"No specific antivirals are currently available for two emerging infectious diseases, Middle East respiratory syndrome (MERS) and severe acute respiratory syndrome (SARS)."
1456, Tracing the history of molecular changes in coronaviruses using phylogenetic methods can provide powerful insights into the patterns of modification to sequences that underlie alteration to selective pressure and molecular function in the SARS-CoV (severe acute respiratory syndrome coronavirus) genome.
1457,"human immunodeficiency virus—acquired immunodeficiency syndrome (HIV-AIDS), severe acute respiratory syndrome (SARS)), while others were previously known but are rapidly increasing in incidence or geographic range as a result of underlying epidemiological changes (e.g."
1458,The spike (S) glycoprotein is thought to play a complex and central role in the biology and pathogenesis of SARS coronavirus infection.
1459,"At 12h post-infection, SARS-CoV reached titers in the supernatant of 5.2×103 CCID50/ml."
1460,"The Severe Acute Respiratory Syndrome Coronavirus (SARS-CoV) is the etiological agent for the infectious disease, SARS, which first emerged 10 years ago."
1461,The likely reason behind the increased binding affinity of HIV-1 protease inhibitors toward SARS-CoV2 3CLpro than that of SARS-CoV were investigated by MD simulations.
1462,"For this paper, we chose Bombyx mori cypovirus 1 (BmCPV-1) interactions with midgut cells from silkworm, and severe acute respiratory syndrome (SARS) associated coronavirus interactions with Vero E6 cells, as examples to demonstrate the response of eukaryotic cells to two different types of virus from our previous studies."
1463,"Angiotensin-converting enzyme 2 (ACE2), the C-type lectin CD209L (also known L-SIGN), and DC-SIGN bind SARS-CoV, but ACE2 appears to be the key functional receptor for the virus."
1464,Going global – Travel and the 2019 novel coronavirus
1465,Very little is known of the early events in viral clearance and the onset of innate and inflammatory responses during the SARS infection.
1466," The murine coronavirus [murine hepatitis virus (MHV)] is limited to infection of susceptible mice and murine cell lines by the specificity of the spike glycoprotein (S) for its receptor, murine carcinoembryonic antigen cell adhesion molecule 1a (mCEACAM1a)."
1467,"We found that a soluble form of ACE2, but not of the related enzyme ACE1, blocked association of the S1 domain with Vero E6 cells."
1468,The mechanism of SARS pathogenesis may involve both direct viral cytocidal effects on the target cells and immune-mediated mechanisms.
1469,This recombinant baculovirus expressing protein C was first characterized using five SARS convalescent human sera and five normal human sera.
1470,"Only 4 bovine coronavirus isolates have been completely sequenced and thus, the information about the genetics of the virus is still limited."
1471,"Electrodense material scattered in proventricular and gizzard cells was observed, with a structure consistent with that of coronaviruses."
1472,"Finally, we demonstrate that SARS-CoV S murine polyclonal sera potently inhibited SARS-CoV-2 S-mediated entry into target cells, thereby indicating that cross-neutralizing antibodies targeting conserved S epitopes can be elicited upon vaccination."
1473,"Methods We searched on PubMed, EMBASE, and Web of Science up to March 2020 to identify studies documenting diarrhea and mechansism of intestinal inflammation in patients with confirmed diagnosis of SARS-CoV-2 infection."
1474,"In previous studies, it was found that the conformation change in CTD1 was the region where SARS-CoV bound to human ACE2."
1475,Cell entry of coronaviruses depends on binding of the viral spike (S) proteins to cellular receptors and on S protein priming by host cell proteases.
1476,Correction: Coronavirus Cell Entry Occurs through the Endo-/Lysosomal Pathway in a Proteolysis-Dependent Manner
1477,"In the 316 patients with multiple respiratory pathogens, 104 were positive for 2019-nCov and 6/104 had co-infection with coronavirus (3/104), influenza A virus (2/104), rhinovirus (2/104), and influenza A H3N2 (1/104); the remaining 212 patients had influenza A virus (11/202), influenza A H3N2 (11/202), rhinovirus (10/202), respiratory syncytial virus (7/202), influenza B virus (6/202), metapneumovirus (4/202), and coronavirus (2/202)."
1478,"Specifically, MNA delivered MERS-S1 subunit vaccines elicited strong and long-lasting antigen-specific antibody responses."
1479,"Currently, real-time qPCR (RT-qPCR) is used as the gold standard for diagnostics of SARS-CoV-2."
1480," The outbreak of coronavirus disease 2019 (COVID-19) caused by severe acute respiratory syndrome coronavirus 2 (SARS-CoV-2) has posed great threat to human health, which has been declared a public health emergency of international concern (PHEIC) by the WHO."
1481, The global outbreak in 2002–2003 of severe acute respiratory syndrome (SARS) posed a serious threat to public health and had a significant impact on socioeconomic stability.
1482,The results showed that protein C is an authentic antigen against SARS-CoV antibody.
1483,"These findings could provide a further step in understanding the mechanism of these mAbs in the prevention of SARS-CoV infection, as well as an insight into the design and development of novel therapeutic treatments."
1484,"We chose aluminum hydroxide gel (alum) as an adjuvant, because of its long safety history for human use."
1485,"The whole genome sequences of two SARS coronavirus strains after passage in Vero cell culture were determined and were compared with those of early passages, respectively."
1486,"In this mini-review, we will focus on the importance of the endocytic pathway as well as the autophagy process in viral infection of several pathogenic CoVs inclusive of SARS-CoV, MERS-CoV and the new CoV named as severe acute respiratory syndrome coronavirus 2 (SARS-CoV-2), and discuss the development of therapeutic agents by targeting these processes."
1487,"The virus is a novel coronavirus, which may have an origin in wild animals such as civet cats in southern China."
1488,These results indicate that the potent immune response elicited by subcutaneous injection of rDIs containing S is able to control mucosal infection by SARS-CoV.
1489,"Some antibody-treated infected mice survived for 7 days after viral challenge, whereas no mock-treated, infected mice survived beyond day 3 after viral inoculation."
1490,"The spread of the novel coronavirus (SARS-CoV-2) has triggered a global emergency, that demands urgent solutions for detection and therapy to prevent escalating health, social and economic impacts."
1491,"CONCLUSIONS: These data provide a mechanism to overcome neutralization escape by using broadly cross reactive cocktails of cross-neutralizing MAbs that recognize residues within the receptor binding domain, critical for virus replication and virulence."
1492,"In this study, we established persistent infection of SARS-CoV in the Vero E6 cell line."
1493,This article reviews parallels between HIV and SARS and proposes an approach that would accelerate the development of a SARS vaccine.
1494,"Since its launch in 2017, CEPI has mobilized more than US$750 million to support its mission to develop vaccines against agents such as Lassa virus, Middle East respiratory syndrome coronavirus, and Nipah virus, as well as several rapid-response vaccine platforms to accelerate response times to unexpected epidemic threats."
1495,Our results showed that the chimeric antigen could induce specific neutralizing antibodies against both strains leading to protection of immunized mice against H1N1pdm09 and efficient neutralization of MERS-CoV.
1496,"More importantly, NASAR mRNAs delivered by lipid-derived nanoparticles showed dramatic expression of potential SARS-CoV-2 antigens both in vitro and in vivo."
1497,"2019-nCoV uses the same cell entry receptor, angiotensin-converting enzyme 2 (ACE2), as SARS-CoV."
1498,"To predict the potential host range of SARS-CoV-2, we analyzed the key residues of ACE2 for recognizing S protein."
1499,"Detailed biological knowledge is crucial for the development of effective countermeasures, diagnostic tests, vaccines and antiviral drugs against the SARS-CoV."
1500,"To study the release of these viruses from the same cells, we constructed a porcine LLC-PK1 cell line stably expressing the recombinant MHV receptor cDNA (LMR cells)."
1501,The outbreak provides an opportunity for real-time tracking of an animal coronavirus that has just crossed species barrier to infect humans.
1502,COVID-19: a novel zoonotic disease caused by a coronavirus from China: what we know and what we don’t
1503,Together our data indicate that ACE2 is a functional receptor for SARS-CoV.
1504,"However, neutralizing antibody titers and the memory B cell response are short-lived in SARS-recovered patients and the antibody will target primary homologous strain."
1505,Interferon response in murine plasmacytoid dendritic cells after SARS coronavirus infection
1506,"On Feb. 25, the US National Institutes of Health (NIH) said it had begun a Phase II clinical trial of remdesivir, an experimental small-molecule drug made by Gilead Sciences, for treatment of those infected with SARS-CoV-2."
1507,"Important questions concerning the interaction between SARS-CoV-2 and host antiviral defence, including asymptomatic and presymptomatic virus shedding, are also discussed."
1508,"hACE2 Tg mice, which express the human SARS-CoV receptor, are extremely susceptible to infection."
1509,"Half were picornaviruses, with influenza and coronaviruses the next most common."
1510,The pseudotype assay does not require handling live SARS virus; it is a useful tool to determine neutralizing titers during natural infection and the preclinical evaluation of candidate vaccines.
1511,The data might provide an important insight into the mechanism of pathogenesis of SARS-CoV allowing further development of antiviral therapies for treating SARS infections.
1512,"Nearly 35,000 cases were reported and at least 24 other countries or territories have reported coronavirus cases as early on as February."
1513,"Coronaviruses infect many species of animal including humans, causing acute and chronic diseases of many organ systems."
1514,"Here, we will review the most recent findings on the interaction of SARS-CoV and related Coronaviridae members with the type I interferon and cytokine responses and discuss implications for pathogenesis and therapy."
1515,"The novel coronavirus (2019-nCoV) outbreak, which initially began in China, has spread to many countries around the globe, with the number of confirmed cases increasing every day."
1516,"First, we found 28 nCoV peptides identical to Severe acute respiratory syndrome-related coronavirus (SARS CoV) that have previously been characterized immunogenic by T cell assays."
1517,"Using this approach, we elucidated 251 host proteins targeted by SARS-CoV-2 and more than 200 host proteins that are significantly perturbed in COVID-19 derived PBMCs."
1518,"A nasal swab was taken for polymerase chain reaction (PCR) detection of influenza virus, respiratory syncytial virus (RSV), metapneumovirus, rhinovirus, and coronavirus."
1519,"In March 2020, Coronavirus Disease 2019 originating from Wuhan, China, has become pandemic."
1520,"Then we analyzed the phylogenesis of S1 subunit of the coronavirus spike protein (SARS-associated virus, Hong Kong isolate CUHK-W1)."
1521,"Until the appearance of severe acute respiratory syndrome (SARS), caused by the SARS coronavirus (SARS-CoV) in early 2003, coronavirus infection was not considered to be serious enough to be controlled by either vaccination or specific antiviral therapy."
1522,The recombinant virus lacking the E gene (rSARS-CoV-ΔE) was rescued in Vero E6 cells.
1523,The virus was identified as the causative agent of SARS due to the efforts of a WHO-led laboratory network.
1524,"SARS-CoV is a zoonotic virus that crossed the species barrier, most likely originating from bats or from other species including civets, raccoon dogs, domestic cats, swine, and rodents."
1525,"Overall, we present an immunological resource for SARS-CoV-2 that could promote both therapeutic development and mechanistic research."
1526,"However, the reimplementation of the analyses, built on larger scale data sets using state-of-the-art bioinformatics methods and databases, presents clear evidence that rebuts these conclusions."
1527,Results: We report in silico identification of a comprehensive list of immunogenic peptides that can be used as potential targets for 2019 novel coronavirus (2019-nCoV) vaccine development.
1528, The sudden emergence of severe acute respiratory syndrome (SARS) has boosted research on innate immune responses to coronaviruses.
1529," Recent publications have brought attention to the possible benefit of chloroquine, a broadly used antimalarial drug, in the treatment of patients infected by the novel emerged coronavirus (SARS-CoV-2)."
1530,"The sequences of the surface protein of SARS-CoV-2 and its proximal sequences were obtained by BLAST, the sequences of the whole genome of SARS-CoV-2 were obtained from the GenBank."
1531,"Further, we describe the benefits, challenges and considerations of NAbs against SARS-CoV-2."
1532,"The ADMET profile showed that lead compounds lack hepatotoxicity and mutagenicity effects while they show variable immunotoxicity, carcinogenicity and cytotoxicity."
1533,"After 3 weeks, they were challenged with the NS-1 strain of SARS-CoV."
1534,The article concludes with a discussion of the gaps in our knowledge and areas for future research on emerging coronaviruses.
1535,Proposal for vaccination against SARS coronavirus using avian infectious bronchitis virus strain H from The Netherlands
1536,"CONCLUSIONS: The majority of patients with 2019-nCoV coronavirus pneumonia present with fever as the first symptom, and most of them still showed typical manifestations of viral pneumonia on chest imaging."
1537,It can affect all age groups of birds.
1538,"There is a prominent innate immune response to SARS-CoV infection, including acute-phase proteins, chemokines, inflammatory cytokines and C-type lectins such as mannose-binding lectin, which plays a protective role against SARS."
1539,"Based on these findings, we further confirmed that N30 provided a strong inhibition on the replication of respiratory syncytial virus, coronavirus, enterovirus 71 and a diverse strains of coxsackie B virus."
1540,"Even in a situation of no new infections, SARS remains a major health hazard, as new epidemics may arise."
1541,"The spike protein (S) of this virus enables binding to the human receptor ACE2, and hence presents a prime target for vaccines preventing viral entry into host cells1."
1542,A strong neutralizing antibody response generated against the spike (S) glycoprotein of SARS-CoV is completely protective in the susceptible host.
1543,INTERPRETATION: SARS-CoV-2 may cause the liver function damage and the Lopinavir/ritonavir should be applied carefully for the treatment of COVID-19.
1544,"The SARS-CoV-2 virus is most likely of zoonotic origin, but has been shown to have effective human-to-human transmission."
1545,Fluorescence Dequenching Assays of Coronavirus Fusion
1546,Methods This is a narrative review with Pubmed and Google Scholar search till 23 March 2020.
1547," Cases of Middle East respiratory syndrome coronavirus (MERS-CoV) continue to occur, making it one of the WHO´s targets for accelerated vaccine development."
1548,"For instance, there are now eight paramyxoviruses, four coronaviruses and four orthomxoviruses that cause recurrent epidemics in humans but were once confined to other hosts."
1549,"We demonstrated the ability of these three viral polymerase inhibitors, 3′-fluoro-3′-deoxythymidine triphosphate, 3′-azido-3′-deoxythymidine triphosphate and Tenofovir diphosphate (the active triphosphate forms of Alovudine, AZT and TAF, respectively) to be incorporated by SARS-CoV-2 RdRp, where they also terminate further polymerase extension."
1550,"These results from bioinformatics analysis might help us to study the receptor-binding sites of SARS-associated virus and the mechanism of the virus entry into the target cell, and design antiviral drugs and potent vaccines."
1551,Protein-protein docking was performed to test the four regions of the spike that fit tightly in the GRP78 Substrate Binding Domain β (SBDβ).
1552,"These findings indicate that the epitope cluster on the spike protein may serve as an evolutionarily conserved platform at which a dynamic interplay between neutralizing and non-neutralizing antibodies occurs, thereby determining the outcome of SARS-CoV infection."
1553,"The results showed that SARS-CoV is a novel coronavirus which is different from any of the three previously known groups of coronviruses, but it is closer to Bo-CoV and MHV than to other coronaviruses."
1554,"Overall, the oxocarbazate CID 23631927 was a subnanomolar, slow-binding, reversible inhibitor of human cathepsin L that blocked SARS-CoV and Ebola pseudotype virus entry in human cells."
1555, In vitro infection of Vero E6 cells by SARS coronavirus (SARS-CoV) is blocked by hexapeptide Tyr-Lys-Tyr-Arg-Tyr-Leu.
1556,"A cohort of serum samples were collected from cats in Wuhan, including 102 sampled after COVID-19 outbreak, and 39 prior to the outbreak."
1557,"The homology model of the protease was built based on the SARS-coronavirus PLpro structure, and the drugs were docked in S3/S4 pockets of the active site of the enzyme."
1558,Serum IgG blocked binding of the S-protein to the ACE2 receptor and neutralized SARS-CoV infection in vitro.
1559,"There are no FDA approved antivirals or vaccines for any coronavirus, including SARS-CoV-2 (2)."
1560, An outbreak of coronavirus disease 2019 (COVID-19) caused by the 2019 novel coronavirus (SARS-CoV-2) began in the city of Wuhan in China and has widely spread worldwide.
1561,"The sequence identity of the 3CL proteases of 2019-nCoV and SARS is 96%, which provides a sound foundation for structural-based drug repositioning (SBDR)."
1562,SPT is then used to identify fusion intermediates and measure membrane fusion kinetics for FCoV.
1563,These results suggest that the recombinant RBD219-CHO protein has great potential for the development of an effective and safe SARS subunit vaccine.
1564,KRSFIEDLLFNKV was found to be particularly well conserved in this study and corresponds to the region around one of the known cleavage sites of the SARS virus that are believed to be required for virus activation for cell entry.
1565,Infection of Human Airway Epithelia by Sars Coronavirus is Associated with ACE2 Expression and Localization
1566,"Therefore, EAV has been suggested to be included in a virus superfamily, along with coronaviruses and toroviruses."
1567,Coronavirus replication fidelity is approximately 20-fold greater than that of other RNA viruses and is mediated by a 3′-5′ exonuclease activity (ExoN) that likely functions in RNA proofreading.
1568,Our results reveal important commonalities between SARS-CoV-2 and SARS-CoV infection and identify a potential target for antiviral intervention.
1569,"Severe acute respiratory syndrome (SARS) is a newly emerging infectious disease caused by a novel coronavirus, SARS-coronavirus (SARS-CoV)."
1570,"2003), considerable focus has been directed towards the putative interaction between the SARS-CoV-2 Spike protein and ACE2."
1571,The review concludes by noting how understanding of coronavirus entry informs antiviral therapies.
1572,The SARS outbreak has illuminated weaknesses in planning for sudden outbreaks of disease in a modern society and in particular how panic can grip and cause intense economic disruption.
1573," A secreted, glycosylated polypeptide containing amino acids 14 to 762 of the SARS coronavirus (SARS-CoV) spike protein and a polyhistidine tag was expressed in recombinant baculovirus-infected insect cells."
1574,"The MHV spike protein (S) is a major virulence determinant which in addition to binding to cellular receptors to mediate cell entry and facilitate virus spread to adjacent cells by cell–cell fusion, also is a molecular mimic of the FcγRII receptor."
1575,"Detailed methods are presented for expression, purification, and release testing of SARS recombinant spike protein antigen, followed by adjuvant formulation and animal testing."
1576,The severe acute respiratory syndrome coronavirus (SARS-CoV) emerged in 2002 and was responsible for an epidemic that spread to five continents with a fatality rate of 10% before being contained in 2003 (with additional cases reported in 2004).
1577,"Here, we perform structural modeling of the 2019-nCoV spike glycoprotein."
1578,Here we analyze the importance of the sialic acid binding activity for the infection of tracheal organ cultures (TOCs) by different IBV strains.
1579,"subgenomic mRNAs), generally fitted the predicted replication and transcription model for coronaviruses."
1580,These papers complement a rapidly growing base of knowledge concerning the molecular organization and replication of coronaviruses in general.
1581,"The immunotherapy is an effective method for fighting against similar viral infections such as SARS-CoV, and MERS-CoV."
1582,It initiates entry into human cells by binding to angiotensin-converting enzyme 2 (ACE2) via the receptor binding domain (RBD) of its spike protein (S).
1583,"After 10 serial passages, replication and virulence of SARS-CoV were increased in the respiratory tract of young rats without clinical signs."
1584,The evolutionary origins of Middle East respiratory syndrome (MERS) coronavirus (MERS-CoV) are unknown.
1585,COVID-19 causes COVID-19 disease that has similar symptoms as SARS-CoV.
1586,"This review focuses on the diversity of strategies coronaviruses have evolved to proteolytically activate their fusion protein during spike protein biosynthesis and the critical entry step of their life cycle, and highlights important findings on how proteolytic activation of coronavirus spike influences tissue and cell tropism, host range and pathogenicity."
1587,"Taken together, the presented attenuation strategy provides a paradigm for the development of highly efficient coronavirus vaccines."
