,sent
713,"The review summarizes our current knowledge of the genome and proteome of feline coronaviruses (FCoVs), focusing on the viral surface (spike) protein S and the five accessory proteins."
714,Attempts were made to develop a prophylactic vaccine but the SARS epidemic was over before any vaccines could be tested for human efficacy.
715,These results provide insights into understanding the immunological characteristics of spike protein and the development of subunit vaccines against SARS-CoV.
716,Enhancement of SARS-CoV Infection by Proteases
717, A recombinant transmissible gastroenteritis coronavirus (rTGEV) in which E gene was deleted (rTGEV-ΔE) has been engineered.
718,"The rise in fatal cases due to SARS-CoV2 could be a more reliable parameter, since missing of deaths is less likely."
719,ABSTRACTThe respiratory syndrome caused by a new type of coronavirus has been emerging from China and caused more than 1000 death globally since December 2019.
720,The mechanism of viral interspecies transmission is an important scientific question to be addressed.
721,"In conclusion, our findings suggest that RBD, which can induce protective antibodies to SARS-CoV, may be further developed as a safe and effective SARS subunit vaccine."
722,This study shows that the disease free equilibrium (E_0 ) for COVID-19 coronavirus does not satisfy the criteria for a locally or globally asymptotic stability.
723,"RESULTS: We report, however, that chloroquine has strong antiviral effects on SARS-CoV infection of primate cells."
724,"In view of these actions, it is suggested that AA and other unsaturated fatty acids and their metabolites may serve as endogenous anti-viral compounds and their deficiency may render humans susceptible to SARS-CoV-2, SARS and MERS and other similar viruses’ infections."
725,"Genomic analyses of nCoV-2019 determined a 96% resemblance with a coronavirus isolated from a bat in 2013 (RaTG13); however, the receptor binding motif (RBM) of these two genomes share low sequence similarity."
726," Infection of conventional mice with a mouse adapted (MA15) severe acute respiratory syndrome (SARS) coronavirus (CoV) reproduces many aspects of human SARS such as pathological changes in lung, viremia, neutrophilia, and lethality."
727,Coronaviruses infect animals and humans causing a wide range of diseases.
728,"Camostat has been clinically used to treat chronic pancreatitis, and thus represents an exciting potential therapeutic for respiratory coronavirus infections."
729,The gammacoronaviruses primarily infect avian hosts.
730,"Background: SARS-CoV-2 is a novel human coronavirus, there is no specific antiviral drugs."
731,"Here, we show that immunization with rSARS-CoV-ΔE or SARS-CoV-Δ[E,6-9b] (deleted in accessory proteins (6, 7a, 7b, 8a, 8b, 9b) in addition to E) nearly completely protected BALB/c mice from fatal respiratory disease caused by mouse-adapted SARS-CoV and partly protected hACE2 Tg mice from lethal disease."
732,"Findings One peptide, CP-1, derived from the HR2 region, inhibited SARS-CoV infection in the micromolar range."
733,Potential inhibitors against 2019-nCoV coronavirus M protease from clinically approved medicines
734,It is only 79% homologous with the original SARS CoV [1].
735,"A SARS-CoV vaccine should confer long-term protection, especially in vulnerable senescent populations, against both the 2003 epidemic strains and zoonotic strains that may yet emerge from animal reservoirs."
736,"In this communication, we evaluated the efficacy and safety of two SARS vaccine candidates based on the recombinant modified vaccinia Ankara (MVA) expressing SARS-CoV spike or nucleocapsid proteins in ferrets."
737,"Because it is difficult to obtain regulatory approval of vaccine based on live viruses, we constructed a replication-defective single-cycle VSV vector in which we replaced the VSV glycoprotein (G) gene with the SARS-CoV S gene."
738,"SARS-CoV emerged in the human population in China in 2002, causing a worldwide epidemic with severe morbidity and high mortality rates, particularly in older individuals."
739,"The novel coronavirus uses the same receptor, angiotensin-converting enzyme 2 (ACE2) as that for SARS-CoV, and mainly spreads through the respiratory tract."
740,"This method is general to any enveloped virus-host cell pair, but demonstrated here for feline coronavirus (FCoV)."
741,Rota- and Coronavirus infections.
742,"Apoptosis was found to involve large virus-laden peritoneal macrophages more than less mature macrophages, suggesting that macrophage death played a role in virus dissemination."
743,Middle East respiratory syndrome coronavirus (MERS-CoV) continues to cause outbreaks in humans as a result of spillover events from dromedaries.
744,"Further epidemiological studies showed that civets are intermediate hosts of SARS-CoV, and bats are the likely natural reservoir of SARS-CoV and a large number of SARS-like coronaviruses (SL-CoVs)."
745," Avian coronaviruses of the genus Gammacoronavirus are represented by infectious bronchitis virus (IBV), the coronavirus of chicken."
746,COVID-19 from veterinary medicine and one health perspectives: What animal coronaviruses have taught us
747,"The predicted structure, accessibility and mutation rate of the S1B region is also presented."
748,"Parainfluenza type 2 infection appeared to be next most likely to be associated with wheezing, followed by coronavirus infection."
749,"In this study we have produced purified, irradiated SARS-CoV virions that retain their morphology, and are fusogenic in cell culture."
750,"We comprehensively tested the pre-clinical immunogenicity of MERS-CoV vaccines in mice when delivered subcutaneously by traditional needle injection, or intracutaneously by dissolving microneedle arrays (MNAs) by evaluating virus specific IgG antibodies in the serum of vaccinated mice by ELISA and using virus neutralization assays."
751, Infectious bronchitis virus (IBV) is a coronavirus that causes an acute and highly contagious disease in chickens.
752,"Finally, taking into account the persisting lack of specific antiviral treatments (there is, in fact, no specific treatment available to fight coronaviruses infections), the Coronaviridae specificities (i.e."
753,Investigating hypothiocyanite against SARS-CoV-2
754,We developed an attenuated VSV recombinant (VSV-S) expressing the SARS coronavirus (SARS-CoV) spike (S) protein.
755,This review highlights the progress made in identifying molecular aspects of SARS-CoV biology that is relevant in developing disease prevention strategies.
756,"We present 65 peptide sequences that we expect to result in a safe and effective vaccine which can be rapidly tested in DNA, mRNA, or synthetic peptide constructs."
757,"Other viruses, such as the toroviruses, picobirnaviruses, coronavirus, and enterovirus 22, may play a role as well."
758,LF may play a protective role in host defense against SARS-CoV infection through binding to HSPGs and blocking the preliminary interaction between SARS-CoV and host cells.
759,"However, the amino acid sequence of COVID-19 differs from other coronaviruses specifically in the regions of 1ab polyprotein and surface glycoprotein or S-protein."
760,Acute infection of Vero E6 with SARS-CoV produced a lytic infection with characteristic rounding cytopathic effects (CPE) and the production of a large number of infectious particles in the culture fluid within 3 days post-infection.
761,"In this study, we sought to gain insights for vaccine design against SARS-CoV-2 by considering the high genetic similarity between SARS-CoV-2 and SARS-CoV, which caused the outbreak in 2003, and leveraging existing immunological studies of SARS-CoV."
762,"SARS-CoV-2 is a human-to-human pathogen that caused fever, severe respiratory disease and pneumonia (known as COVID-19)."
763,Evaluation of Risks and Benefits Associated with Vaccination against Coronavirus Infections in Cats
764,"The production of effective and safe vaccines to prevent SARS has led to the development of promising vaccine candidates, in contrast to the design of vaccines for other coronaviruses, that in general has been less successful."
765,We also identified possible interactions between the S1 and S2 domains of the SARS-CoV S glycoprotein.
766,"When the outbreak of this apparently novel infectious disease termed severe acute respiratory syndrome (SARS) came to an end in July 2003, it had caused over 8000 probable cases worldwide and more than 700 deaths."
767,Animal models for severe acute respiratory syndrome (SARS) coronavirus infection of humans are needed to elucidate SARS pathogenesis and develop vaccines and antivirals.
768,"Based on the near-identical substrate specificities and high sequence identities, we are of the opinion that some of the previous progress of specific inhibitors development for the SARS-CoV enzyme can be conferred on its SARS-CoV-2 counterpart."
769," Coronavirus disease 2019 (COVID-19) is a kind of viral pneumonia with an unusual outbreak in Wuhan, China, in December 2019, which is caused by severe acute respiratory syndrome coronavirus 2 (SARS-CoV-2)."
770,These observations provided evidence of the genetic diversity and rapid evolution of this novel coronavirus.
771," A SARS vaccine based on a live-attenuated vesicular stomatitis virus (VSV) recombinant expressing the SARS-CoV S protein provides long-term protection of immunized mice from SARS-CoV infection (Kapadia, S.U., Rose, J. K., Lamirande, E., Vogel, L., Subbarao, K., Roberts, A., 2005."
772,Whole genome analysis of SARS-CoV-2 revealed ~96% genomic similarity with bat CoV (RaTG13) and clustered together in phylogenetic tree.
773,"Using this platform, we identify intersections between the pathologic manifestations of COVID-19 and the comprehensive expression profile of the SARS-CoV-2 receptor ACE2."
774,"Here, we present the nferX platform for dynamic inference from over 45 quadrillion possible conceptual associations extracted from unstructured biomedical text, and their triangulation with Single Cell RNA-sequencing based insights from over 25 tissues (https://academia.nferx.com/)."
775,This state revealed by cryo-EM first time could provide an important information for the identification and relevant clinical research of this new coronavirus.
776,"Therefore, the severe acute respiratory syndrome (SARS)-coronaviruses (SARS-CoV) proteases are attractive targets for the development of antiviral drugs to reduce viral replication and pathogenicity."
777,"Most established coronaviruses exhibit winter seasonality, with a unique ability to establish persistent infections in a minority of infected animals."
778,The outbreak and spread of severe acute respiratory syndrome-associated coronavirus and the subsequent identification of its animal origin study have heightened the world's awareness of animal-borne or zoonotic pathogens.
779,This review summarizes the currently available detection methods for coronavirus nucleic acid.
780,"A novel pneumonia-associated respiratory syndrome named coronavirus disease-2019 (COVID-19), which caused by SARS-CoV-2 and broken in Wuhan, China in the end of 2019."
781,ABSTRACTEffective countermeasures against the recent emergence and rapid expansion of the 2019-Novel Coronavirus (2019-nCoV) require the development of data and tools to understand and monitor viral spread and immune responses.
782,The SARS-Coronavirus-host interactome: identification of cyclophilins as target for pan-Coronavirus inhibitors.
783,"ABSTRACT Coronavirus disease 2019 (COVID-19) originated in the city of Wuhan, Hubei Province, Central China, and has spread quickly to 72 countries to date."
784,The coronavirus outbreak took place in December 2019 and continues to spread worldwide.
785,Let’s take inventory on the therapies that are being developed for the coronavirus epidemic.
786,"Therefore, understanding the virulence mechanisms of this pathogen and developing efficacious vaccines are of high importance to prevent epidemics from this and other human coronaviruses."
787,Severe acute respiratory syndrome (SARS) is a new infectious disease caused by a novel coronavirus that leads to deleterious pulmonary pathological features.
788,CEPI has also played a leading role in fostering institutional partnerships between public- and private-sector organizations to optimize allocation of resources for vaccine development against its priority pathogens.
789,It is currently no specific viral protein targeted therapeutics yet.
790,"Since the outbreak of severe acute respiratory syndrome coronavirus 2 (SARS-CoV-2), there is an urgent need to understand the biological behavior of the virus and provide a basis for developing effective therapies."
791,"Treatment of the cells with heparinase or exogenous heparin prevented binding of spike protein to host cells and inhibited SARS pseudovirus infection, demonstrating that HSPGs provide the binding sites for SARS-CoV invasion at the early attachment phase."
792,SARS-CoV-2 and SARS-CoV further differed in their drug sensitivity profiles.
793,The highly pathogenic SARS coronavirus (SARS-CoV) emerged from zoonotic pools in 2002 to cause a global epidemic of severe acute respiratory syndrome (SARS).
794,"One hour later (at 7h post-infection), the levels of extracellular SARS-CoV RNA also began to rise."
795,"The recent emergence of severe acute respiratory syndrome (SARS) was caused by a novel coronavirus, SARS-CoV."
796,We propose that the immunomodulatory effect of hydroxychloroquine also may be useful in controlling the cytokine storm that occurs late-phase in critically ill SARS-CoV-2 infected patients.
797,Direct RNA sequencing using an Oxford Nanopore MinION characterised the transcriptome of SARS-CoV-2 grown in Vero E6 cells.
798,"Needs that have yet to be realized include reliable methods for early identification of individuals with SARS, a full description of SARS pathogenesis and immune response, and animal models that faithfully mimic SARS respiratory symptoms."
799,"The current outbreak of viral pneumonia in the city of Wuhan, China, was caused by a novel coronavirus designated 2019-nCoV by the World Health Organization, as determined by sequencing the viral RNA genome."
800, The open-reading-frame 3a of SARS coronavirus (SARS-CoV) had been demonstrated previously to form a cation-selective channel that may become expressed in the infected cell and is then involved in virus release.
801,The severe acute respiratory syndrome (SARS) CoV briefly emerged into the human population but was controlled.
802,": The ongoing outbreak of the recently emerged novel coronavirus (2019-nCoV) poses a challenge for public health laboratories as virus isolates are unavailable while there is growing evidence that the outbreak is more widespread than initially thought, and international spread through travellers does already occur."
803,"This review in the hope of helping the public effectively recognize and deal with the 2019 novel coronavirus (SARS-CoV-2), and providing a reference for future studies."
804,"The outbreak of the 2019 Novel Coronavirus (SARS-CoV-2) rapidly spread from Wuhan, China to more than 150 countries, areas or territories, causing staggering number of infections and deaths."
805,"While overexpression of LY6E in C3A and A549 cells efficiently inhibited the infection of HCoV-OC43, knockdown of LY6E expression in HepG2 significantly increased its susceptibility to HCoV-OC43 infection."
806,Vaccination led to a substantial reduction in viral load and prevented the severe pneumonia seen in unvaccinated animals.
807,"Here, we show that both HAT and TMPRSS2 are coexpressed with 2,6-linked sialic acids, the major receptor determinant of human influenza viruses, throughout the human respiratory tract."
808,"Like its better-known cousin severe acute respiratory syndrome coronavirus (SARS-CoV), HCoV-EMC appears to have originated from bats."
809,"Furthermore, SARS-CoV-2 also triggers macrophages to produce IL-6, a proinflammatory cytokine that directly promotes lymphocyte necrosis."
810,"Our analyses suggest that the existing anti-influenza virus inhibitors and anti-neuraminidase antibody could be used as a starting point for designing anti-SARS drugs, vaccines and antibodies."
811,"However, the external subdomain of Spike’s receptor binding domain of 2019-nCoV shares only 40% amino acid identity with other SARS-related coronaviruses."
812,"Currently, there is no evidence to support the use of hydroxychloroquine in SARS-CoV-2 infection."
813,Coronaviruses raise serious concerns as emerging zoonotic viruses without specific antiviral drugs available.
814,The newly-emerging Middle East respiratory syndrome coronavirus (MERS-CoV) can cause severe and fatal acute respiratory disease in humans.
815,"But it is unknown whether RBD can also induce protective immunity in an animal model, a key aspect for vaccine development."
816,"In December 2019, a cluster of acute respiratory illness, now known as SARS-CoV-2 pneumonia, occurred in Wuhan, China."
817,"Although little is known about the virus, an examination of the genome sequence shows strong homology with its better-studied cousin, SARS-CoV."
818,The vaccine candidate interacted with immunological receptor TLR3 with high affinity depicting the generation of innate immunity.
819,"In neutralization assays, non-neutralizing 240C disrupted virus neutralization by mAb 341C and/or mAb 540C, whereas a combination of mAbs 341C and 540C blocked virus infectivity synergistically."
820,"The new coronavirus COVID-19, also known as SARS-CoV-2, has infected more than 300,000 patients and become a global health emergency due to the very high risk of spread and impact of COVID-19."
821,Our bioinformatic analysis showed a group of only six crRNAs can target more than 90% of all coronaviruses.
822,The rat-passaged virus more efficiently infected CHO cells expressing rat ACE2 than did the original isolate.
823,"This review gives an example of one such vaccine platform, replication-deficient simian adenoviruses, and describes progress in human and livestock vaccine development for three outbreak pathogens, Ebola virus, Rift Valley Fever Virus and Middle East Respiratory Syndrome Coronavirus."
824,The DNA vaccine contained a plasmid encoding the SARS coronavirus (SARS-CoV) S protein under the control of the human CMV promoter and intron A.
825,Bats are also suspected to be reservoirs based on frequent detection of other betacoronaviruses in these mammals.
826,"Coronaviruses generally have a narrow host range, infecting one or just a few species."
827,The identification of host dependency factors mediating virus infection may provide key insights into effective molecular targets for developing broadly acting antiviral therapeutics against SARS-CoV-2 and other deadly coronavirus strains.
828,"Due to the increasing number of cases in China and outside China, the WHO declared coronavirus as a global health emergency."
829, The world was struck by surprise when a Severe Acute Respiratory Syndrome (SARS) epidemic started in 2003 in China.
830,"Novel coronavirus pneumonia (NCP) is an emerging, highly contagious community acquired pneumonia (CAP) caused by severe acute respiratory syndrome coronavirus 2 (SARS-CoV-2)."
831,"Similar to other coronaviruses, spike (S)-glycoprotein of the virus interacts with a cellular receptor and mediates membrane fusion to allow viral entry into susceptible target cells."
832,"It is currently believed that this deadly Coronavirus strain originated from wild animals at the Huanan market in Wuhan, a city in Hubei province."
833,"The scope of this article is to review screening strategies and recent advances in this area, with a particular emphasis on antivirals targeting the step of viral entry for emerging lipid-enveloped viruses such as Ebola virus and SARS-coronavirus."
834,"Approaches to the development of MERS vaccines are discussed herein, including a summary of previous efforts to develop vaccines useful against human and non-human coronaviruses."
835,"This review tries to summarize the facts that are known about a wide variety of “new” viruses of mammals, such as the simian, human and feline lentiviruses, the feline coronaviruses, the feline parvoviruses, the carnivore morbilliviruses, the influenza A viruses, and the transmissible spongiform encephalopathies."
836,"Emerging and re-emerging RNA viruses occasionally cause epidemics and pandemics worldwide, such as the on-going outbreak of coronavirus SARS-CoV-2."
837, The nucleocapsid (N) protein of a coronavirus plays a crucial role in virus assembly and in its RNA transcription.
838,"Specifically, immunoreactive Spike-1 proteins from SARS-CoV-2 are expressed on the surface of irradiated target I-cells."
839,The natural host of 2019-nCoV may be the bat Rhinolophus affinis as 2019-nCoV showed 96.2% of whole-genome identity to BatCoV RaTG13.
840,Our data indicated that ATA should be considered as a candidate anti-SARS compound for future clinical evaluation.
841,The targeting antibody mediated specific infection of EGFR-expressing human cancer cells by both coronaviruses.
842,Camel and bats have been identified as a potential source of virus for disease spread to human.
843," Highly pathogenic human coronaviruses associated with a severe respiratory syndrome, including Middle East respiratory syndrome coronavirus (MERS-CoV), have recently emerged."
844, The recent pneumonia outbreak caused by a novel coronavirus (SARS-CoV-2) in Chinais posing a great threat to global public health.
845,The knowledge of the 3D structures of SARS-CoV-2 proteins can facilitate the development of therapeutic and diagnostic molecules.
846,"(§) Also on January 31, the president of the United States signed a ""Proclamation on Suspension of Entry as Immigrants and Nonimmigrants of Persons who Pose a Risk of Transmitting 2019 Novel Coronavirus,"" which limits entry into the United States of persons who traveled to mainland China to U.S. citizens and lawful permanent residents and their families (3)."
847," Among the various respiratory viruses infecting human beings, coronaviruses are important pathogens, which usually infect the upper respiratory tract, where they are mainly associated with common colds."
848,"An immuno-informatics approach along with comparative genomic was applied to design a multi-epitope-based peptide vaccine against SARS-CoV-2 combining the antigenic epitopes of the S, M and E proteins."
849,"Previous studies have shown that SARS-CoV-2 infects cells by binding angiotensin-converting enzyme 2 (ACE2), which is the same as SARS-CoV."
850,"Using targeted RNA recombination, we constructed a mutant of the coronavirus mouse hepatitis virus (MHV) in which the ectodomain of the spike glycoprotein (S) was replaced with the highly divergent ectodomain of the S protein of feline infectious peritonitis virus."
851,"A monoclonal antibody (MAb) R-G-4, which blocks infection of Felis catus whole fetus (fcwf-4) cells by type II FIPV, was obtained by immunizing mice with fcwf-4 cells which are highly susceptible to FIPV."
852,Phylogenetic analysis suggests the possibility of non-human origin of the SARS-associated viruses but provides no evidence that they are man-made.
853,A handful of genetic and structural analyses have identified a key feature of the virus — a protein on its surface — that might explain why it infects human cells so readily.
854,"Although the catalytic activity of the ACE2, APN, and DPP4 peptidases is not required for virus entry, co-expression of other host proteases allows efficient viral entry."
855,Therapeutic concentrations of the approved protease inhibitor aprotinin displayed anti-SARS-CoV-2 activity.
856,"Double infections of influenza virus together with another virus were found for adenovirus B and E, bocavirus, coronavirus, enterovirus and for rhinovirus."
857,"In this study, we have further investigated the mechanism of the inhibition process of nitric oxide against SARS-CoV."
858,"Here, we review the discovery, zoonotic origin, animal hosts, transmissibility and pathogenicity of SARS-CoV-2 in relation to its interplay with host antiviral defense."
859,"The emergence of new pathogens, such as severe acute respiratory syndrome coronavirus (SARS-CoV), Middle East respiratory syndrome coronavirus (MERS-CoV), and Ebola virus, poses serious challenges to global public health and highlights the urgent need for novel antiviral approaches."
860,"Together, the results identify key differences in susceptibility to the IFN-I response between SARS-CoV and SARS-CoV-2."
861,Porcine deltacoronavirus (PDCoV) is a newly emerging threat to the global porcine industry.
862,"In this volume we explored special aspects of emerging infectious diseases including: the application of the theory of focality of diseases to infective syndrome; the human-animal inter-face focusing on influenza; the role of bats as main reservoir of emerging and novel human pathogens; Middle East Respiratory Syndrome Coronavirus (MERS-CoV) epidemiology and clinical presentation; immediate impact on human health of the last Zika virus outbreak occurred in Pacific Ocean and the Americas; the role and potential application of animal models for the study of emerging infections, to improve disease knowledge and for developing therapeutic drugs during ongoing outbreak."
863,"However, no approved prophylactic and therapeutic interventions are currently available."
864,A two step inactivation procedure involving sequential formaldehyde and U.V.
865," Aminopeptidase N, or CD13, is a receptor for serologically related coronaviruses of humans, pigs, and cats."
