,pid,newpid,category,sent,newscore,answer,keyword
403,kira7mz6,14906,ADE, Objective This study aims to assess the mood changes induced by mild acute inflammatory stimulation (typhoid vaccination).,0.08794534379506964,typhoid vaccination,antibody dependent enhancement (ADE)
404,8r4xc8tn,5389,ADE,IMPORTANCE Viral subunit vaccines generally show low efficacy.,0.08794171125887276,viral subunit vaccines,antibody dependent enhancement (ADE)
405,l0zgovf3,35955,ADE,"Therefore, selective TLR ligand combinations can increase protective efficacy by increasing the quality rather than the quantity of T cell responses.",0.08794116004761049,t cell responses,antibody dependent enhancement (ADE)
406,sp4w2tva,12583,ADE,Particular attention is given to the ability of Toll-like receptor agonists to act as adjuvants.,0.08794055211258299,toll-like receptor agonists,antibody dependent enhancement (ADE)
407,jrqhilgf,4135,ADE,"In contrast, in the kidney, QX vaccine viral RNA was nearly absent, which coincided with the lack of any morphological changes in this organ.",0.0879323082356776,qx vaccine viral rna,antibody dependent enhancement (ADE)
408,8yu6xqlw,12063,ADE,"In addition, the virulent strain could activate NF-κB pathway more intensively than the CV777 vaccine strain-like isolate, and elicit stronger inflammatory cascades as well.",0.08793141684118637,stronger inflammatory cascades,immunopathology
409,fn8k8q3e,36212,ADE,"Blocking IFN-I signaling resulted in delayed virus clearance, enhanced neutrophil infiltration, and impaired MERS-CoV–specific T cell responses.",0.08792961883989936,"blocking ifn-i signaling resulted in delayed virus clearance , enhanced neutrophil infiltration , and impaired mers-cov – specific t cell responses",immunopathology
410,2behvv3b,17873,ADE,The results showed that rBV activated the CD8(+) T-cell-mediated response much more efficiently than the wild-type BV (wtBV).,0.08792956767365356,cd8 ( + ) t-cell-mediated response,antibody dependent enhancement (ADE)
411,8kdhf123,2769,ADE,"These biological effects appear to be mediated by the ability of PIKA to promote the maturation of dendritic cells, including up-regulation of co-stimulatory molecules, such as CD80 and CD86, and the induction of various cytokines and chemokines.",0.08792245695243506,induction of various cytokines and chemokines,antibody dependent enhancement (ADE)
412,ncb5r6gy,29680,ADE,In the V group a significant increase in PCV2-specific antibody-producing PCs was observed over time.,0.08792215606618355,pcv2-specific antibody-producing pcs,antibody dependent enhancement (ADE)
413,i065tuk9,13796,ADE,Genetic analysis of the S1 region of the strains showed that they were not vaccine related.,0.0879216530058894,they were not vaccine related,immunopathology
414,y8ynk50h,3835,ADE,These results confirm the immunotherapeutic potential of the enriched-Leishmune® vaccine.,0.08791813745593292,immunotherapeutic potential,immunopathology
415,yjzcsdu2,18957,ADE,It was established that timofer was practically nontoxic and exhibited high immunostimulatory activity when combined with viral and bacterial vaccines.,0.08790948305475879,viral and bacterial vaccines,antibody dependent enhancement (ADE)
416,igw16hwb,37846,ADE,Use of ATM and Chk.2 inhibitors resulted in a marked decrease in S phase arrest as well as viral production.,0.08790850747339696,decrease in s phase arrest as well as viral production,immunopathology
417,2gej7h1d,12832,ADE,"In contrast, no effect of either adjuvant on the production of anti-virus antibodies was noticed throughout the study.",0.08790219862357132,no effect of either adjuvant on the production of anti-virus antibodies,immunopathology
418,cmjfqkjz,11543,ADE,Special attention has been provided to the use of transmissible gastroenteritis virus (TGEV) as vector for the expression of PRRSV antigens.,0.0878941276182311,prrsv antigens,antibody dependent enhancement (ADE)
419,lzda8kyn,651,ADE,"Currently, however, there is no specific antiviral treatment or vaccine.",0.08789154972427815,no specific antiviral treatment or vaccine,immunopathology
420,mubgm9s9,22691,ADE,"Interestingly, this strong cellular response drastically reduced viral replication, clinical signs, and pulmonary lesions after a highly virulent challenge.",0.08788981669071412,cellular response,antibody dependent enhancement (ADE)
421,od484ub1,11168,ADE,"Currently, there is no protective vaccine available.",0.0878830243981927,there is no protective vaccine available,immunopathology
422,679qfp2s,633,ADE,"Overall, the data do not support the use of DRV for treatment of COVID-19.",0.08787780581241053,the data do not support the use of drv for treatment of covid-19,interferon
423,33h22ikl,27595,ADE,Human β-defensin-2 and β-defensin-3 were used as adjuvants to enhance the immune response of MEVs.,0.08787611527784259,mevs,antibody dependent enhancement (ADE)
424,gbwb7fqi,17234,ADE,Augmentation of the innate immune response may be an effective alternative for disease amelioration.,0.08787520535444758,innate immune response,antibody dependent enhancement (ADE)
425,bmdnqgvu,16486,ADE,"These motifs are involved in the interruption of antiviral signaling, namely the interaction between the TNF receptor associated factor (TRAF) and mitochondrial antiviral-signaling (MAVS) proteins.",0.08787370977871145,interruption of antiviral signaling,antibody dependent enhancement (ADE)
426,mpe1xrr1,6822,ADE,No significant differences between the HD and SD TIV groups were noted for immune responses.,0.08787232982870374,no significant differences between the hd and sd tiv groups were noted for immune responses,immunopathology
427,qa7nu88c,35294,ADE,One approach is to prevent the activation of B cells by mapping and elimination of B-cell epitopes.,0.0878700614129593,prevent the activation of b cells,antibody dependent enhancement (ADE)
428,zmeu66h1,27504,ADE,This study suggests beneficial effects of mannoproteins on the specific and nonspecific immune responses in adult and elderly dogs.,0.08786980788217844,specific and nonspecific immune responses,antibody dependent enhancement (ADE)
429,epz7fvnx,39101,ADE,Active STAT5 inhibits the differentiation of B cells while increasing their replicative life span.,0.08786863555489982,active stat5 inhibits the differentiation of b cells,antibody dependent enhancement (ADE)
430,zu0ubwfq,7844,ADE,This ability to modulate the host immune response probably varies among strains or isolates.,0.08786588812253851,modulate the host immune response,antibody dependent enhancement (ADE)
431,czvdj3v7,39718,ADE,"Broad-spectrum anti-norovirus molecules, based on the inhibition of 3C-like protease, have been developed.",0.08786166645848935,broad-spectrum anti-norovirus,antibody dependent enhancement (ADE)
432,beiqzbwx,34161,ADE,"These results indicated that NPF could significantly improve the anti-PPV activity of PF, and its high concentration possessed the best efficacy.",0.08786083661251454,npf,interleukin
433,081o2zmd,20851,ADE,TGEV/PEDV specific antibody responses as well as kinetic changes of T lymphocyte subgroups of the immunized mice were analyzed.,0.0878550629947516,tgev / pedv specific antibody responses,antibody dependent enhancement (ADE)
434,536u0bo4,9741,ADE,"Our results show that VAD calves are unable to respond to the mucosal BRSV-NP vaccine, are afforded no protection from BRSV challenge and have significant abnormalities in the inflammatory response in the infected lung.",0.08785312398014591,inflammatory response,antibody dependent enhancement (ADE)
435,cjs9zust,21511,ADE,"As vaccinations also disrupt immunological pathways, these may also impact on TB risk.",0.08785247851166073,vaccinations,antibody dependent enhancement (ADE)
436,4jlj9rdc,1336,ADE,Infection cannot occur in the absence of contact.,0.08784839456830415,infection cannot occur in the absence of contact,interferon
437,3posyr5n,28288,ADE,Blotting assays via specific antibodies confirmed the expression of the 15 kDa HCVcp.,0.08784318488649147,antibodies,antibody dependent enhancement (ADE)
438,umnso91b,21913,ADE,"In all cases, MVA-MERS-S induced MERS-CoV-specific CD8(+) T cells and virus-neutralizing antibodies.",0.08783638369220888,virus-neutralizing antibodies,immunopathology
439,jxv1ntp8,19849,ADE,A successful mucosal vaccine relies on leveraging the functions of these immune cells and regulatory components.,0.08783572441018339,immune cells and regulatory components,antibody dependent enhancement (ADE)
440,5nyoxono,16329,ADE,Very little is known of the early events in viral clearance and the onset of innate and inflammatory responses during the SARS infection.,0.08783340881097458,innate and inflammatory responses,antibody dependent enhancement (ADE)
441,q3be4e15,15992,ADE,"Furthermore, the UV-inactivated virion induced regional lymph node T-cell proliferation and significant levels of cytokine production (IL-2, IL-4, IL-5, IFN-γ and TNF-α) upon restimulation with inactivated SARS-CoV virion in vitro.",0.08783255246098043,regional lymph node t-cell proliferation and significant levels of cytokine production,immunopathology
442,lhdtwwow,39963,ADE,There are no vaccines or therapeutic agents currently available for MERS-CoV.,0.08782473849771986,there are no vaccines or therapeutic agents currently available,immunopathology
443,v55piprx,6946,ADE,M2e-MAP vaccination limited viral replication and attenuated histopathological damage in the challenged mouse lungs.,0.08782348711594751,m2e-map vaccination,antibody dependent enhancement (ADE)
444,uy18a13l,33182,ADE,Clinical remission was not achieved despite of several medications.,0.08781985102270222,clinical remission was not achieved despite of several medications,immunopathology
445,aeuy92bx,1399,ADE,An ACE2 mutant with low catalytic activity was also used in the study.,0.08781963496150955,ace2,interleukin
446,z26xlqv8,11969,ADE,MVTTZCI induced neutralizing antibodies via the intranasal route of immunization.,0.08781304406531522,neutralizing antibodies,antibody dependent enhancement (ADE)
447,6rcezxjx,2222,ADE,"However, a combination of the vaccines induced T-helper type 1 (Th1) immune responses while the whole killed virus vaccine induced T helper type 2 (Th2) immune response.",0.08781140886531216,t-helper type 1 ( th1 ) immune responses,antibody dependent enhancement (ADE)
448,r03svb4t,14284,ADE,"In addition, due to resistance, a combination of antivirals is needed for life-threatening infections.",0.08781029739470078,antivirals,antibody dependent enhancement (ADE)
449,dby5aksb,10850,ADE,Neither lung eosinophilia nor vaccine-induced weight loss was observed upon Bac-RSV/G immunization and subsequent RSV infection.,0.08780909460539088,bac-rsv / g immunization,antibody dependent enhancement (ADE)
450,or0czzdp,4768,ADE,"The latter strategy also resulted in the best T cell response, yet, it was ineffective in inducing nose or lung IgA.",0.0878044783690238,t cell response,antibody dependent enhancement (ADE)
451,x93ybs7i,13605,ADE,"Vaccines offer an exciting strategy for the treatment of cocaine addiction; however, vaccine formulations need to be optimized to improve efficacy.",0.08780446852257298,vaccines,antibody dependent enhancement (ADE)
452,iiv08rcq,12687,ADE,"Despite some differences in the cellular composition of inflammatory infiltrates, we did not observe any overt lung pathology in the chimeric-VLP-treated mice, when compared to the negative control mice.",0.0878026837154974,chimeric-vlp-treated mice,immunopathology
453,o13leezl,9749,ADE,"However, the conjugation of cholera toxin subunit A1 induced more potent mucosal, humoral and cell-mediated immune responses.",0.08779633185993395,"mucosal , humoral and cell-mediated immune responses",antibody dependent enhancement (ADE)
454,jhtdaa5b,36313,ADE,Infection with M51R-F vector also induced the production of IL-1β.,0.08779491862996072,il-1β,interleukin
455,c1pjt9ek,8144,ADE,"Compared with the control group (adjuvant alone), mice immunized with the S protein or IV showed slightly lower pathological damage in the lung, as well as reduced antigen expression and lung virus titers.",0.08779228939707581,reduced antigen expression and lung virus titers,immunopathology
456,bet6rv0x,5814,ADE,"Analysis of the protective immune responses showed that the protein immunization promoted a Th2-biased response with an increase in IL-4, IL-5 and IgG1 responses, whereas, the DNA vaccine promoted a Th1-biased response with profound IFN-γ and IgG2a responses.",0.0877855131059459,protective immune responses,antibody dependent enhancement (ADE)
457,noyagzc6,8287,ADE,Effective vaccination strategies are needed.,0.08778147917415713,effective vaccination strategies,antibody dependent enhancement (ADE)
458,li6xz9gt,16206,ADE,"The cellular and humoral responses were monitored as well as the clinical signs, the viral excretion and the pathology following challenge.",0.08777984700773575,cellular and humoral responses,antibody dependent enhancement (ADE)
459,f3ynbps9,32059,ADE,"Also, the decrease in liver and spleen radioactivity with time implies that the nanoparticles are broken down and cleared.",0.08777823876780882,decrease in liver and spleen radioactivity with time implies that the nanoparticles are broken down and cleared,immunopathology
460,aeuy92bx,1396,ADE,"However, there is no specific antiviral treatment or vaccine currently.",0.08777172561598558,there is no specific antiviral treatment or vaccine currently,immunopathology
461,iq1gtb5w,2722,ADE,More importantly GSLS-Se was found to promote early production and prolong the duration of the antibody responses.,0.08777008642756591,antibody responses,antibody dependent enhancement (ADE)
462,gz72x0r1,25728,ADE,"For SARS-CoV, the absence of this 2′-O-MTase activity results in significant attenuation characterized by decreased viral replication, reduced weight loss, and limited breathing dysfunction in mice.",0.0877689961295408,"decreased viral replication , reduced weight loss , and limited breathing dysfunction in mice",immunopathology
463,hi7z3nob,33203,ADE,"It is also helpful for the development of mimotope-based diagnostics, therapeutics, and vaccines.",0.08776608055936896,vaccines,immunopathology
464,xaohrtq7,15306,ADE,Each regimen induced HIV-1-specific T-cell responses in systemic/local tissues in mice.,0.08776476816985446,hiv-1-specific t-cell responses,antibody dependent enhancement (ADE)
465,v7asfaxc,15799,ADE,Further examination indicated the MERS dNSP16 mutant had a type I IFN based attenuation and was partially restored in the absence of IFIT molecules.,0.08775676363804863,type i ifn based attenuation,interleukin
466,6uk3og8s,25515,ADE, The decline in CD4+ T cell function with aging contributes to reduced vaccine efficacy.,0.08775252736145506,the decline in cd4 + t cell function with aging contributes to reduced vaccine efficacy,immunopathology
467,z3mxqslb,20574,ADE,"Animals were examined for T lymphocyte proliferation, anti-PEDV antibodies, IFN-γ and IL-4 protein levels, and cytotoxic T cell function in mouse peripheral blood and spleen.",0.08775140359542355,anti-pedv antibodies,immunopathology
468,nwn53ak0,33603,ADE,But antigenic reactivity is only one of the properties required to induce a protective immune response.,0.08775029976624524,protective immune response,antibody dependent enhancement (ADE)
469,p493tr5u,33045,ADE,"In addition, the modulation of adaptive immune functions via macrophage and dendritic cell polarization, and subsequent priming, activation, and proliferation of pathogen-specific T- and B-cells may also be important elements associated with infectious disease outcomes.",0.08775014038726832,"modulation of adaptive immune functions via macrophage and dendritic cell polarization , and subsequent priming , activation , and proliferation of pathogen-specific t-and b-cells",antibody dependent enhancement (ADE)
470,yfh5d4io,29662,ADE,"Chronic inhalation of noxious irritants in COPD causes a changed balance in the lung microbiome, abnormal inflammatory response, and an impaired airway immune system.",0.08774408794816779,impaired airway immune system,immunopathology
471,nb6c8buz,7497,ADE,This suggests that protein-based vaccines formulated using RNA adjuvant function as live-attenuated vaccines.,0.0877431193485822,protein-based vaccines formulated using rna adjuvant,antibody dependent enhancement (ADE)
472,sctfgzdo,11464,ADE,"Although the immunogenicity of the DNA component was just above the dose response threshold, the HPV-specific immunity was robust.",0.08774223119333427,hpv-specific,antibody dependent enhancement (ADE)
473,z1njxotm,23645,ADE,"Treatments are limited, and no preventive vaccine is available.",0.08774046851299885,no preventive vaccine is available,immunopathology
474,kltodqnd,37818,ADE,These findings suggest that PRRSV interferes with the activation and signaling pathway of type I IFNs by blocking ISG factor 3 (ISGF3) nuclear translocation.,0.08773942557396057,type i,interleukin
475,dmpoy0b1,13438,ADE,"We tested whether co-administration of a neutrophil elastase inhibitor (NEI) could rescue the ability of EdTx to induce broad antibody responses, including mucosal IgA.",0.08773528522752612,broad antibody responses,antibody dependent enhancement (ADE)
476,081o2zmd,20850,ADE,"Lymphocyte proliferation assay, virus neutralization assay, IFN-γ assay and CTL activity assay were performed.",0.0877338929715161,"lymphocyte proliferation assay , virus neutralization assay , ifn-γ assay and ctl activity assay",immunopathology
477,tn1rzudq,6010,ADE,"Vaccination includes rNTV-HCV priming induced robust antigen-specific antibody, particularly nAbs, and CMI responses.",0.08773319514077578,"vaccination includes rntv-hcv priming induced robust antigen-specific antibody , particularly nabs , and cmi responses",antibody dependent enhancement (ADE)
478,4lxp65ze,36192,ADE,"Other than its well-established role in B cell responses, the TACI-mediated activation of macrophages is also implicated in resistance to intracellular pathogens.",0.08773112944329522,b cell responses,antibody dependent enhancement (ADE)
479,f3duj360,11314,ADE,"Taken together, these results demonstrate that the EIAV vaccine strain does not cause obvious histopathological lesions or clinical symptoms and that it induces a unique cytokine response profile.",0.0877286765452591,cytokine response,antibody dependent enhancement (ADE)
480,8b1ppt9t,10382,ADE,"We show here that the immunogenicity of the Modified Vaccinia Ankara MVA vaccine strain can be improved by deletion of the A35 gene, without diminishing the ability of the virus to replicate.",0.08772810559543981,the immunogenicity,immunopathology
481,3t97ubzc,14828,ADE,"On the other hand, the AL/CS/DNA exhibited minimal cytotoxicity.",0.08772740313102399,cytotoxicity,antibody dependent enhancement (ADE)
482,mubgm9s9,22689,ADE,"In this study, we designed two codon-optimized plasmids encoding the bovine RSV fusion (F) and nucleocapsid (N) proteins and assessed their immunogenicity in young calves.",0.08772526480093852,immunogenicity in young calves,immunopathology
483,8dkj6ps3,4414,ADE,Studies in animal models suggest that each viral vector is unique in its ability to induce humoral and/or cellular immune responses.,0.08771838278008373,humoral and / or cellular immune responses,antibody dependent enhancement (ADE)
484,uifnjio5,1378,ADE,"Furthermore, titration of NAb is helpful prior to the use of convalescent plasma for prevention or treatment.",0.08771640774617742,nab,interleukin
485,vogj4jfz,22059,ADE,"rSARS-CoV-ΔE-immunized hamsters remained active following wild-type virus challenge, while mock-immunized hamsters displayed decreased activity.",0.08771146176957764,hamsters,immunopathology
486,8fnr1vw0,34343,ADE,HI antibody responses in the absence of neutralizing antibody responses seem to be transient.,0.08771139628780694,antibody responses in the absence of neutralizing antibody responses,antibody dependent enhancement (ADE)
487,2dc958jf,12461,ADE,"Additionally, NDV has the potential to break various types of tumor resistances and also to affect liver fibrosis.",0.08770783913906996,ndv,interleukin
488,t8haj18z,37972,ADE,"Taken together, our results suggest that K1685 and K1829 in the L protein play important roles in pathogenicity and immune evasion during RABV infection.",0.08770473682929322,pathogenicity and immune evasion,antibody dependent enhancement (ADE)
489,847ld131,37893,ADE,Infection of macrophages and other cell types has also been documented.,0.08769752555630927,infection of macrophages and other cell types has also been documented,immunopathology
490,d13shsas,34996,ADE,"DNA viruses such as herpesvirus and poxvirus have multiple genes, some of them host-derived, which interfere with effective innate or acquired immune responses.",0.08769610647615765,acquired immune responses,antibody dependent enhancement (ADE)
491,hrsz15vv,16421,ADE,"Finally, the transport of plasmid DNA vaccines into the lungs is reviewed.",0.08769506669717456,plasmid dna vaccines,antibody dependent enhancement (ADE)
492,9z0lo2d1,39274,ADE,All three variant proteins were prepared in vitro and their biochemical and biophysical properties were characterized.,0.08768483408615442,biochemical and biophysical properties,immunopathology
493,vdqx6gag,35985,ADE,"Human mAb are used in the immunotherapy of several blood malignancies, such as lymphoma and leukemia, as well as for autoimmune diseases.",0.08768238239743048,autoimmune diseases,antibody dependent enhancement (ADE)
494,4fyg8naq,38370,ADE,"Recently, it has been shown that mast cells can be directly activated in response to IAV, releasing mediators such histamine, proteases, leukotrienes, inflammatory cytokines, and antiviral chemokines, which participate in the excessive inflammatory and pathological response observed during IAV infections.",0.08768205658012945,excessive inflammatory and pathological response,antibody dependent enhancement (ADE)
495,ene62kcz,13367,ADE,"However, there are some MERS vaccines in the preclinical stage of development.",0.08767885351919777,mers vaccines,antibody dependent enhancement (ADE)
496,ahxisc4h,35774,ADE,"They may inhibit the phagocytosis of bacteria, but they may also undergo phagocytosis themselves.",0.08767330058690898,they may inhibit the phagocytosis of bacteria,immunopathology
497,nb6miso7,4442,ADE,Western blot assay further demonstrated the specificity of the induced serum antibodies.,0.08767211195811196,induced serum antibodies,antibody dependent enhancement (ADE)
498,3pnuzxqv,15499,ADE,"In contrast, DS-Cav1 without adjuvant induced low-level responses (6).",0.0876607126391136,low-level responses,antibody dependent enhancement (ADE)
499,plxz5mkg,1425,ADE,"Finally, the advances in the development of chemotherapeutic options are also briefly summarized.",0.08765976137437168,chemotherapeutic options,immunopathology
500,azf3e2pa,17999,ADE,nTregs develop in the thymus and function in maintaining peripheral immune tolerance.,0.08765789951204428,peripheral immune tolerance,antibody dependent enhancement (ADE)
501,e0ccq2b3,13616,ADE,"The main effects of vaccination include less clinical symptoms, lung lesions and medication use, and improved performance.",0.08765594029315929,"the main effects of vaccination include less clinical symptoms , lung lesions and medication use , and improved performance",immunopathology
502,1q0vl6n8,24785,ADE,This protein functioned as an inhibitor of NF-κB activation and apoptosis and is similar to the N1L protein of vaccinia virus.,0.08765528827940999,nf-κb activation and apoptosis,antibody dependent enhancement (ADE)
503,nb6c8buz,7493,ADE,Recombinant protein-based vaccines are usually formulated with aluminum (alum)-based adjuvants to ensure an adequate immune response.,0.08765436988706714,recombinant protein-based vaccines are usually formulated with aluminum ( alum )-based adjuvants to ensure an adequate immune response,antibody dependent enhancement (ADE)
504,3vssgben,1521,ADE,"We apply mathematical and computational models to study this process, including the dynamics of vaccine and revertant growth plus the dynamics of innate and adaptive immunity.",0.08765144044843529,innate and adaptive immunity,antibody dependent enhancement (ADE)
505,7kt8q02t,31692,ADE,"Therefore, additional mechanisms influence the final outcome of the immune response.",0.08764929140264066,additional mechanisms,antibody dependent enhancement (ADE)
506,7zd5zhbz,10700,ADE,"Immunologically, PLGA-NP peptides vaccination (without adjuvant) significantly increased the frequency of antigen-specific IFNγ secreting CD4 and CD8 T cells response in the lung lymphocytes, despite not boosting the antibody response both at pre- and post-challenge.",0.08764701857226465,antibody response,antibody dependent enhancement (ADE)
507,p4dy2eo3,6343,ADE,"The significant increase in OmpA specific serum IgG, fecal sIgA and a Th1 dominant immune response (indicated by high INF-γ/IL-4 ratio) in LacVax® OmpA immunized mice revealed successful activation of humoral and cellular immunity.",0.08764699911857074,humoral and cellular immunity,antibody dependent enhancement (ADE)
508,tuax8axn,30788,ADE,"Immunoblot analysis indicated that plant-derived LTB protein was oligomeric, and dissociated after boiling.",0.08764345118437228,"immunoblot analysis indicated that plant-derived ltb protein was oligomeric , and dissociated after boiling",immunopathology
509,2a51n8ym,27327,ADE,Evaluation of the Th1/Th2 cytokine patterns expressed in the liver of hamsters showed that sterile protection was associated with the production of high levels of IFNγ and IL-4.,0.08763116596207879,ifnγ,interleukin
