,pid,newpid,category,sent,newscore,answer,keyword
0,3qdjmb2j,8652,ADE,"In addition, both vaccines also induced insert specific interferon gamma (IFN-γ) secreting T cell response.",0.1807475113117644,t cell response,antibody dependent enhancement (ADE)
1,ynef1d1t,8058,ADE,Type I interferon is important in anti-viral responses and in coordinating the innate immune response.,0.18061230933167002,innate immune response,antibody dependent enhancement (ADE)
2,mbvwh2ky,17361,ADE,"Importantly, attenuation of the dORF3-5 mutant is primarily driven by dysregulated host responses, including disrupted cell processes, augmented interferon (IFN) pathway activation, and robust inflammation.",0.18019054517210314,dysregulated host responses,antibody dependent enhancement (ADE)
3,zq58ot3c,18412,ADE,"Furthermore, T-cell proliferative responses and increased production of gamma interferon were also observed upon splenocyte restimulation with recombinant SOD.",0.17992187329988718,gamma,interleukin
4,cwfujgya,29285,ADE,By contrast there may be a lack of type 1 interferon response.,0.17990678968607535,type 1 interferon response,antibody dependent enhancement (ADE)
5,wyanwvxa,10176,ADE,"Replication of RVs is restricted in a host species-specific manner, and this barrier is determined predominantly by the host interferon (IFN) signaling and the ability of different RV strains to successfully negate IFN activation and amplification pathways.",0.17988278571317715,host interferon,interleukin
6,t0d8wtvp,37282,ADE,Generating feline cells with reduced ability to respond to interferon (IFN) is an essential step facilitating isolation of new candidate vaccine strains.,0.17986315715181167,generating feline cells with reduced ability to respond to interferon,antibody dependent enhancement (ADE)
7,gq9age1b,15677,ADE,These findings suggest that vaccine-induced eosinophil immunopathology in the lungs upon SARS-CoV infection could be avoided by the TLR agonist adjuvants.,0.1798500983294995,vaccine-induced eosinophil immunopathology,immunopathology
8,6mdaq868,11104,ADE,"In this study, we report on the activation of type I interferon (IFN) production by a defective interfering (DI) RNA isolated from the Hu-191 vaccine strain of measles virus.",0.17982485174523438,type i interferon,interleukin
9,wvot6rfc,17140,ADE,"The vaccine potential of each LAIV was determined through analysis of attenuation, interferon production, immunogenicity, and their ability to protect mice and ferrets.",0.1797873434093056,"immunogenicity , and their ability to protect mice and ferrets",immunopathology
10,j7fpiqfj,11405,ADE,"Plasmacytoid dendritic cells (pDC) play a central role in the antiviral immune response, both in the innate response and in shaping the adaptive response, mainly because of their ability to produce massive amounts of type I interferon (TI-IFN).",0.17972112203779214,antiviral immune response,antibody dependent enhancement (ADE)
11,08n9d0au,2780,ADE,The vaccine would induce neutralizing antibodies without causing Th2-type immunopathology.,0.17966144687919666,th2-type immunopathology,immunopathology
12,jd91k19z,11090,ADE,"There was a significant increase in the amount of Th1-related cytokines (interferon-γ and interleukin [IL] 12), and a significant decrease in the Th2-related cytokine IL-4 in splenocyte cell culture of the vaccinated group compared with the control groups.",0.17959429765572632,il ] 12,interleukin
13,6rwevq39,27485,ADE,The most noteworthy changes were in tumor necrosis factor-alpha (TNF-α) and interferon gamma (IFN-γ) levels.,0.1795423456564071,interferon gamma,interleukin
14,azf3e2pa,18001,ADE,Inducible (or adaptive) T(regs) frequently express high levels of the interleukin 2 receptor (CD25).,0.1794012298217809,inducible ( or adaptive ) t ( regs ) frequently express high levels of the interleukin 2 receptor,antibody dependent enhancement (ADE)
15,wr2sgixs,20615,ADE,"Moreover, exposure of type-I interferon knockout mice to ZIKV results in severe damage to the testes, epididymis and sperm.",0.17935635211263828,"severe damage to the testes , epididymis and sperm",interferon
16,kxg0ym05,15816,ADE,Cellular immunities were also shown in both cell proliferation and gamma interferon (IFN-γ) enzyme-linked immunospot (ELISpot) assays.,0.1792931293880269,gamma interferon,interleukin
17,j5b6bscg,37101,ADE,"In this study, we demonstrated that the PRRSV nsp2 OTU domain antagonizes the type I interferon induction by interfering with the NF-κB signaling pathway.",0.17927955261876788,type i,interleukin
18,r6c7kmqj,39197,ADE,"In human lung epithelial A549 cells, 5′pppRNA specifically stimulated multiple parameters of the innate antiviral response, including IRF3, IRF7 and STAT1 activation, and induction of inflammatory and interferon stimulated genes - hallmarks of a fully functional antiviral response.",0.17924141416996528,innate antiviral response,antibody dependent enhancement (ADE)
19,m2fwefuy,11479,ADE,"SMQ, but not alum, generated strong interleukin-6 (IL-6), gamma interferon (IFN-γ), and tumor necrosis alpha (TNF-α) responses.",0.17918462068604307,"strong interleukin-6 ( il-6 ) , gamma interferon ( ifn-γ ) , and tumor necrosis alpha ( tnf-α ) responses",antibody dependent enhancement (ADE)
20,vdsrdxrn,15648,ADE,"Moreover, MVA immunization at low dosage also protected IFNAR(−/−) mice, indicating efficient activation of cellular immunity even in the absence of type I interferon signaling.",0.17917480429717536,type i interferon signaling,antibody dependent enhancement (ADE)
21,key29aid,26485,ADE,The mHSP110-E7(11-20) complex induced epitope-specific splenocyte proliferation and E7(11-20)-specific gamma interferon (IFN-γ) secretion.,0.17914458984091847,gamma interferon,interleukin
22,bs3j3nss,7160,ADE,"VRP-N vaccines not only failed to protect from homologous or heterologous challenge, but resulted in enhanced immunopathology with eosinophilic infiltrates within the lungs of SARS-CoV–challenged mice.",0.179103376164779,enhanced immunopathology with eosinophilic infiltrates,immunopathology
23,ht7km4jz,17812,ADE,"The plasma level of the transforming growth factor (TGF-β), but not interleukin (IL)-2, IL-4, IL-5, IL-10, IFN-γ, TNF-α, was also found to increase significantly after vaccination.",0.17910238647349794,vaccination,antibody dependent enhancement (ADE)
24,gq9age1b,15678,ADE,"IMPORTANCE Inactivated whole severe acute respiratory syndrome-related coronavirus (SARS-CoV) vaccines induce neutralizing antibodies in mouse models; however, they also cause increased eosinophilic immunopathology in the lungs upon SARS-CoV challenge.",0.17909504252958694,eosinophilic immunopathology,immunopathology
25,xdnu5qyq,24093,ADE,AAV2/8 produced a vibrant CD8(+) T-cell effector response characterized by coexpression of gamma interferon and tumor necrosis factor alpha as well as in vivo cytolytic activity.,0.17909216938754968,gamma interferon,interleukin
26,hb2lieh3,1607,ADE,"Histopathology seen in animals given one of the SARS-CoV vaccines was uniformly a Th2-type immunopathology with prominent eosinophil infiltration, confirmed with special eosinophil stains.",0.1790876178992002,th2-type immunopathology with prominent eosinophil infiltration,immunopathology
27,itrv27tm,12019,ADE,"However, some animal studies have suggested that inadequate immunization against severe acute respiratory syndrome coronavirus (SARS&#8208;CoV) induces a lung eosinophilic immunopathology upon infection.",0.17905939749372884,lung eosinophilic,immunopathology
28,fb832hlp,6043,ADE,"As will be discussed in this chapter, coronavirus vaccines present many challenges including low and rapidly waning immunity and the fact that coronavirus vaccines, particularly when formulated with Th2-biased alum adjuvants, can exacerbate coronavirus infection-associated eosinophilic lung immunopathology.",0.17894538176936375,eosinophilic lung immunopathology,immunopathology
29,xq48afa0,30011,ADE,"Patients with H5N1 disease had unusually high serum concentrations of chemokines (eg, interferon induced protein-10 [IP-10] and monokine induced by interferon γ [MIG]).",0.17892517705507768,patients with h5n1 disease had unusually high serum concentrations of chemokines,immunopathology
30,rqhn122a,7384,ADE,"Immunized IFNAR(−/−)-CD46Ge mice developed E protein-specific and neutralizing antibodies, and ZIKV E-specific cellular immune responses were observed by gamma interferon (IFN-γ) enzyme-linked immunospot (ELISpot) and in vitro T cell proliferation assays.",0.1788743543176505,cellular immune responses,antibody dependent enhancement (ADE)
31,fb832hlp,6046,ADE,"This chapter will describe the current state of development of SARS vaccines, the issue of coronavirus-associated eosinophilic lung immunopathology and how adjuvants can be used to reduce the risk of this complication.",0.1786779098634224,eosinophilic lung immunopathology,immunopathology
32,xvvfguht,23623,ADE,"Lately, suboptimal innate immune responses, expressed as defective interferon production, have gained attention as they might be amenable to intervention.",0.17866143032211246,suboptimal innate immune responses,antibody dependent enhancement (ADE)
33,t6ndp2vq,31891,ADE,"The reasons for this obstacle are not well understood, but appear to reflect, at least in part, the inability of the virus to block the interferon response in any but the human host.",0.1784900147815084,interferon response,antibody dependent enhancement (ADE)
34,rhhafruq,40352,ADE,This study shows that formulation of SARS-CoV spike protein or inactivated whole-virus vaccines with novel delta inulin-based polysaccharide adjuvants enhances neutralizing-antibody titers and protection against clinical disease but at the same time also protects against development of lung eosinophilic immunopathology.,0.17846314861837415,lung eosinophilic immunopathology,immunopathology
35,nb6c8buz,7496,ADE,"We found that single strand RNA (termed RNA adjuvant) derived from cricket paralysis virus intergenic region internal ribosome entry site induced the expression of various adjuvant-function-related genes, such as type 1 and 2 interferon (IFN) and toll-like receptor (TLR), T cell activation, and leukocyte chemotaxis in human peripheral blood mononuclear cells; furthermore, its innate and IFN transcriptome profile patterns were similar to those of a live-attenuated yellow fever vaccine.",0.17837462707308027,type 1 and 2 interferon,interleukin
36,zu0ubwfq,7839,ADE,"In contrast, development of neutralising antibodies (NAs) is delayed and generation of cell-mediated immune responses, such as PRRSV-specific interferon (IFN)-γ secreting cells, is initially erratic.",0.17837413666686494,prrsv-specific interferon ( ifn )-γ,interleukin
37,rhhafruq,40344,ADE,"Such vaccines present major challenges: coronavirus immunity often wanes rapidly, individuals needing to be protected include the elderly, and vaccines may exacerbate rather than prevent coronavirus lung immunopathology.",0.1781513999428025,coronavirus lung immunopathology,immunopathology
38,godas2iy,36794,ADE,A bacterial artificial chromosome containing the sequence of ZIKV strain Paraiba/2015 under the control of the cytomegalovirus promoter was complexed with a commercial transfection reagent and administrated using different routes in type-I interferon receptor deficient A129 mice.,0.17801196013614934,interferon receptor,antibody dependent enhancement (ADE)
39,l3d19xur,33021,ADE,"Many downstream type I interferon activated genes with anti-viral activity (PKR, Mx, ISG15 and OAS among others) were also up-regulated in response to ALVAC.",0.17790925632937546,type i interferon,interleukin
40,upb97on4,20892,ADE,"In mouse studies, Cap-AuNP-immunized mice displayed a high production of interleukin (IL)-4, IL-10, and interferon-γ, suggesting that Cap-AuNPs can effectively activate CD4(+) and CD8(+) T cells and balance Th1 and Th2 cellular responses.",0.17787716809387544,th1 and th2 cellular responses,antibody dependent enhancement (ADE)
41,l8gszu1s,8069,ADE,"The vaccine mixture was shown to be well tolerated and increased frequencies of canineTrp-1-specific activated CD8(+) and CD4(+) T cells secreting interferon-(IFN)-γ, tumor necrosis factor (TNF)-α, or interleukin (IL)-2 alone or in combinations in four and five out of five dogs, respectively.",0.17778357730401825,interleukin ( il )-2,interleukin
42,m6abyuvx,29019,ADE,"We also demonstrated that the onset of chronic hepatitis in CN2-29((+/−))/MxCre((+/−)) mice was mainly attributable to inflammatory cytokines, (tumor necrosis factor) TNF-α and (interleukin) IL-6.",0.17778036742639594,il-6,interleukin
43,rhhafruq,40347,ADE,"Whereas unadjuvanted or alum-formulated vaccines were associated with significantly increased lung eosinophilic immunopathology on day 6 postchallenge, this was not seen in mice immunized with vaccines formulated with delta inulin adjuvant.",0.17769379814919714,lung eosinophilic immunopathology,immunopathology
44,l3d19xur,33023,ADE,"In view of these results we propose that ALVAC induces type I interferon anti-viral innate immunity via a cytosolic pattern-recognition-receptor (PRR) sensing double-stranded DNA, through activation of IRF3 and IRF7.",0.17654651220784573,type i interferon,interleukin
45,hkvurb2k,12996,ADE,Further examination indicated that dNSP16 mutant MERS-CoV had a type I interferon (IFN)-based attenuation and was partially restored in the absence of molecules of IFN-induced proteins with tetratricopeptide repeats.,0.1765053062021903,type i interferon,antibody dependent enhancement (ADE)
46,q5wx313k,13017,ADE,"Our major data indicated that immunization with “LbSapSal” is able to induce biomarkers characterized by enhanced amounts of type I (tumor necrosis factor [TNF]-α, interleukin [IL]-12, interferon [IFN]-γ) cytokines and reduction in type II cytokines (IL-4 and TGF-β), even after experimental challenge.",0.1763898022638632,il ]-12,interleukin
47,efdotm4f,35280,ADE,"RESULTS: Gene expression in MEF among children who were sOP was significantly different in upregulation of interleukin 8, secretory leukocyte peptidase inhibitor, and chemokine (C-C motif) ligand 3, and in downregulation of interferon regulatory factor 7 and its related signaling molecules interferon alpha, Toll-like receptor adaptor molecule 2, chemokine (C-C motif) ligand 5, and mitogen-activated protein kinase 8 compared with children who were NOP.",0.1762055752683111,interleukin 8,interleukin
48,ejkrvze7,27359,ADE,"Increased interferon gamma (IFN-γ) expression was observed in the mucosal immune compartment, i.e., HALT, after primary vaccination, but shifted to the systemic immune compartment after boosting.",0.1757191354116149,interferon gamma,interleukin
49,r6c7kmqj,39202,ADE,"Strikingly, the RIG-I-specific transcriptional response afforded partial protection from influenza challenge, even in the absence of type I interferon signaling.",0.17571771932403538,rig-i-specific transcriptional response,antibody dependent enhancement (ADE)
50,kv9n2qj3,23738,ADE,"The Medline database was searched using combinations and variations of terms, including ‘Middle East respiratory syndrome coronavirus’, ‘MERS-CoV’, ‘SARS’, ‘therapy’, ‘molecular’, ‘vaccine’, ‘prophylactic’, ‘S protein’, ‘DPP4’, ‘heptad repeat’, ‘protease’, ‘inhibitor’, ‘anti-viral’, ‘broad-spectrum’, ‘interferon’, ‘convalescent plasma’, ‘lopinavir ritonavir’, ‘antibodies’, ‘antiviral peptides’ and ‘live attenuated viruses’.",0.17543515417802955,antibodies,immunopathology
51,j90daoiq,8119,ADE,Vaccination with LBSap induced a prominent type 1 immune response that was characterized by increased levels of interleukin (IL-) 12 and interferon gamma (IFN-γ) production by peripheral blood mononuclear cells (PBMC) upon stimulation with soluble vaccine antigen.,0.17525421159965038,il-) 12,interleukin
52,wzozcj6l,40154,ADE,"In this study, site-directed mutagenesis analysis showed that the R128A or R129A mutation introduced into a highly conserved motif ((123)GKYLQRRLQ(131)) reduced the ability of nsp1β to suppress interferon beta (IFN-β) activation and also impaired nsp1β's function as a PRF transactivator.",0.17495137488563364,interferon beta,interleukin
53,hqmyund4,6793,ADE,There was no statistical relationship between responses and either tumor necrosis factor-α or interleukin (IL)-10 promoter polymorphisms among the 3 response groups.,0.17471701975369658,there was no statistical relationship between responses and either tumor necrosis factor-α or interleukin ( il )-10 promoter polymorphisms,immunopathology
54,hnaw4pyf,26651,ADE,"Additionally, significant increases in plasma TNF-α and IFN-γ, which may be important factors in the heightened immunopathology in the liver and brain, were detected in the Rag2 (−/−) mice 30 days after intravascular delivery.",0.17339833567143187,rag2,immunopathology
55,zu0ubwfq,7842,ADE,"The virus inhibits key cytokines, such as IFN-α, and may induce regulatory cytokines, such as interleukin (IL)-10.",0.17327259527725986,il )-10,interleukin
56,5g0n9na8,18974,ADE,"Compared with icPC22A, the KDKE(4A) and KDKE(4A)-SYA mutants replicated less efficiently in vitro but induced stronger type I and type III interferon responses.",0.17317515799397226,type i and type iii interferon responses,antibody dependent enhancement (ADE)
57,33y3qf20,11688,ADE,The DNA vaccine was found to mediate primarily a cellular immune response with high levels of IgG2a and the cytokines IL-2 and gamma interferon (IFN-γ).,0.17316947667064714,cellular immune response,antibody dependent enhancement (ADE)
58,laai8ohw,12821,ADE,"The rNDV vectors predominantly induced IgG2a subclass antibody for the Th1 response, and specifically, high levels of gamma interferon (IFN-γ), tumor necrosis factor alpha (TNF-α), and interleukin-2 (IL-2) were detected in splenocytes.",0.17187411939048391,"high levels of gamma interferon ( ifn-γ ) , tumor necrosis factor alpha ( tnf-α ) , and interleukin-2 ( il-2 ) were detected in splenocytes",immunopathology
59,p4ef8o77,31649,ADE,"According to these data, the immune response to HRSV infection—comparatively to HRV infection—was more associated to the activation of the interferon gamma signaling pathways and less related to neutrophil activation mechanisms.",0.17110055649521874,activation of the interferon gamma signaling pathways,antibody dependent enhancement (ADE)
60,d13shsas,34997,ADE,"RNA viruses may escape acquired humoral and cellular immune responses by mutations in protective antigenic epitopes (e.g., avian influenza viruses), while accessory non-structural proteins or multi-functional structural proteins interfere with the interferon system (e.g., Newcastle disease virus).",0.17086653626090412,acquired humoral and cellular immune responses,antibody dependent enhancement (ADE)
61,iub5hvz9,39307,ADE,"Upon challenge with a lethal dose of SARS-CoV, virus-specific memory CD8 T cells efficiently produced multiple effector cytokines (gamma interferon [IFN-γ], tumor necrosis factor alpha [TNF-α], and interleukin 2 [IL-2]) and cytolytic molecules (granzyme B) and reduced lung viral loads.",0.1706407692272517,interleukin 2,interleukin
62,fh0mhqhv,10269,ADE,"Cellular and humoral immunogenicity was confirmed in two mouse strains, including type I interferon receptor knockout mice, which are susceptible to CCHF disease.",0.17022097224478155,type i interferon receptor knockout mice,immunopathology
63,bftsmcl4,24130,ADE,Combination of supportive treatment with interferon and antivirals is also being explored.,0.1694683142204847,interferon,interleukin
64,msmq91d2,11122,ADE,"MP-12 was manufactured as an Investigational New Drug vaccine by using MRC-5 cells and encodes a functional NSs gene, the major virulence factor of RVFV which 1) induces a shutoff of the host transcription, 2) inhibits interferon (IFN)-β promoter activation, and 3) promotes the degradation of dsRNA-dependent protein kinase (PKR).",0.168998778207292,inhibits interferon ( ifn )-β promoter activation,interferon
65,vysrzhjs,26020,ADE,"In mice with dominant cross-reactive memory responses, during challenge with PICV increased immunopathology was directly associated with these cross-reactive NP205-specific CD8 memory cells.",0.16804568841659134,cross-reactive memory responses,antibody dependent enhancement (ADE)
66,xieqepl2,13766,ADE,"The major immunoglobulin G subclass recognizing N protein was immunoglobulin G2a, and stimulated splenocytes secreted high levels of gamma interferon and IL-2 in response to N protein.",0.16776348365588872,gamma interferon,interleukin
67,igw16hwb,37839,ADE,Past studies have shown NSs to be a multifaceted protein important for virulence through modulation of the interferon response as well acting as a general inhibitor of transcription.,0.16755927566934326,interferon response,antibody dependent enhancement (ADE)
68,5nyoxono,16331,ADE,"Notably, SARS-CoV has evolved evasive strategies to suppress antiviral type I interferon responses in infected cells.",0.1675159705078599,antiviral type i interferon responses,antibody dependent enhancement (ADE)
69,etpgwzrn,21039,ADE,"While there were significant differences in the number of host genes differentially regulated during the host responses between the three SARS-CoV strains, the top pathways and functions were similar and only apparent early during infection with the majority of genes associated with interferon signaling pathways.",0.16652014426443745,interferon signaling pathways,immunopathology
70,2gej7h1d,12829,ADE,"To improve the immune response, an adjuvant consisting of plasmid encoding either porcine interleukin (IL)-12 or IFN-α was co-administered during vaccination.",0.16649952090512982,porcine interleukin,interleukin
71,qx9flfme,14624,ADE,"Mechanistically, the attenuation phenotype was attributed to the enhanced sensitivity of the mutant virus to the antiviral effects of interferon and IFIT proteins.",0.16641344250412735,interferon and ifit proteins,antibody dependent enhancement (ADE)
72,od484ub1,11176,ADE,"Additionally, induction of specific T cells was demonstrated by T cell proliferation, antigen-specific T cell cytotoxicity, and gamma interferon secretion after stimulation of splenocytes with MERS-CoV-S presented by murine dendritic cells.",0.16575201097700432,gamma interferon,interleukin
73,h3g3sgiu,5822,ADE,"Cellular and humoral immunogenicity was confirmed in 2 mouse strains, including type I interferon receptor knockout mice, which are susceptible to CCHF disease.",0.16574638219935262,type i interferon receptor knockout mice,immunopathology
74,zhmx8f4v,9962,ADE,"Furthermore, these replication-incompetent AHSV particles were demonstrated to be highly protective against homologous virulent virus challenges in type I interferon receptor (IFNAR)-knockout mice.",0.16567870648366234,type i interferon receptor ( ifnar )-knockout mice,immunopathology
75,2m8xhi5r,39907,ADE,"We found that mutating a viral endoribonuclease, EndoU, results in a virus that activates both the type I interferon response and the type III interferon response in macrophages and epithelial cells.",0.1653233862104289,type i interferon response and the type iii interferon response,antibody dependent enhancement (ADE)
76,vysrzhjs,26026,ADE,We show that some of the coinfected mice have sufficiently altered memory T cell responses that they have decreased protection and enhanced immunopathology when reexposed to one of the two viruses.,0.1651553407721302,memory t cell responses,antibody dependent enhancement (ADE)
77,kx43u0n4,30236,ADE,"Through the use of macrophage genetic knockouts, we identified Toll-like receptor 2 (TLR2), the cytosolic nucleotide-binding oligomerization domain containing 2 (NOD2) receptor, and the inflammasome-associated caspase-1 as contributors to macrophage activation, with NOD2 cooperating with caspase-1 to induce inflammasome derived interleukin (IL)-1β in a pyroptosis-independent fashion.",0.16480298559771295,il )-1β,interleukin
78,gl46jz56,31447,ADE,"A formalin-inactivated RSV vaccine used in a trial in the 1960s elicited immunopathology in response to natural RSV infection; this has been modeled experimentally, primarily in inbred mice and cotton rats.",0.16426923749749112,inbred mice and cotton rats .,immunopathology
79,gub0qflg,30888,ADE," Background Type I interferon induced MxA response can differentiate viral from bacterial infections, but MxA responses in rhinovirus or asymptomatic virus infections are not known.",0.1642107473692513,type i interferon,interleukin
80,a95dwvcn,36568,ADE,"We show that at 72 hr post vaccination, liposomes alone induce no changes in gene expression and inflammatory profiles within afferent lymph; however, the incorporation of CpG drives interferon, antiviral and cytotoxic gene programmes.",0.16420602053836528,"interferon , antiviral and cytotoxic gene programmes",antibody dependent enhancement (ADE)
81,j7fpiqfj,11416,ADE,Type I interferon (TI-IFN)-producing plasmacytoid dendritic cells (pDC) may play an important role in vaccine development.,0.16409823349435526,type i interferon,interleukin
82,8db700qd,33751,ADE,In this review we focus primarily on the interferon pathway and its regulation as well as mechanisms by which respiratory RNA viruses interfere with its signalling capacity.,0.1639817789486844,mechanisms by which respiratory rna viruses interfere with its signalling capacity,interferon
83,xfoy3i7d,18590,ADE,"The innate immune response following PRRSV infection, particularly the antiviral type I interferon response, is meager, but when provided exogenously, IFN-α enhances PRRSV immunity and viral control.",0.1637952666085706,ifn-α,interleukin
