,pid,newpid,category,sent,newscore,answer,keyword
164,od484ub1,11175,ADE,"In vivo, immunization of type I interferon receptor-deficient (IFNAR(−/−))-CD46Ge mice with 2 × 10(5) 50% tissue culture infective doses of MV(vac2)-CoV-S(H) or MV(vac2)-CoV-solS(H) in a prime-boost regimen induced robust levels of both MV- and MERS-CoV-neutralizing antibodies.",0.15803874246749186,neutralizing antibodies,immunopathology
165,081o2zmd,20853,ADE,"In addition, the DNA vaccines induced a high level of IFN-γ in the immunized mice.",0.09002755725985702,ifn-γ,interleukin
166,j9qucb0k,4663,ADE,"All combinations induced specific T-cell immune responses, including high IFN-γ production.",0.08964520473448809,ifn-γ,interleukin
167,fn8k8q3e,36211,ADE,"Here, we show that IFN-I signaling is protective during MERS-CoV infection.",0.0893899456744672,ifn-i signaling,immunopathology
168,5qwtvm9x,28789,ADE,"Additionally, there was a strong HIV-1-specific IgG response.",0.08936917857292209,hiv-1-specific igg response,antibody dependent enhancement (ADE)
169,ynef1d1t,8060,ADE,Viral load and immune responses of immunized mice were analyzed over time.,0.08935838503548033,immunized mice,immunopathology
170,3qyn3ka5,11378,ADE, Adjuvants can enhance vaccine immunogenicity and induce long-term enhancement of immune responses.,0.08926285926870936,long-term enhancement of immune responses,antibody dependent enhancement (ADE)
171,jqy7lcbk,30516,ADE,The responses of the immunized mice differed markedly.,0.08924851552084434,immunized mice,immunopathology
172,wzozcj6l,40160,ADE,"Furthermore, the augmented innate response was consistent with the increased production of IFN-γ in pigs infected with mutated viruses.",0.0892459401078112,augmented innate response,antibody dependent enhancement (ADE)
173,sp212tai,6077,ADE,The recombinant Lactobacillus elicited specific systemic and mucosal immune responses.,0.08923274169360904,systemic and mucosal immune responses,antibody dependent enhancement (ADE)
174,bs194n2m,10085,ADE,"In contrast, the orally DNA vaccine evoked vigorous T cell response and a weak antibody production.",0.08922626653251747,vigorous t cell response,antibody dependent enhancement (ADE)
175,id1cxmk1,24397,ADE,The results showed marked differences in the responses of the immunized mice.,0.08918989763407126,marked differences in the responses of the immunized mice,immunopathology
176,ql30rv83,21978,ADE,"Moreover, a strong cellular immune response demonstrated by elevated IFN-γ and IL-6 levels was also observed in these mice.",0.08918279527062556,cellular immune response,antibody dependent enhancement (ADE)
177,l2fo7bcd,28991,ADE,Yet many lung pathogens are controlled by appropriate immune responses.,0.08911982878051036,appropriate immune responses,antibody dependent enhancement (ADE)
178,jkko6erq,7695,ADE,DNA vaccines induce humoral and cellular immune responses in animal models and humans.,0.08911259558586868,humoral and cellular immune responses,antibody dependent enhancement (ADE)
179,2m8xhi5r,39906,ADE,How PEDV suppresses the innate immune response was unknown.,0.08908943387606333,innate immune response,antibody dependent enhancement (ADE)
180,hmw6zj3m,4027,ADE,The fourth DNA vaccination boosted the immune responses.,0.0890213034730915,the fourth dna vaccination boosted the immune responses,immunopathology
181,b02owiak,11818,ADE,ASP-specific activation and proliferation of NK cells was also observed in mice following the same vaccination regime.,0.08901207830685487,asp-specific activation and proliferation of nk cells,antibody dependent enhancement (ADE)
182,wqr14w2y,31229,ADE,"Moreover, we measured cytokine mRNA expression in lung and spleen samples.",0.08901144871783834,cytokine,interleukin
183,54b4gi2c,29804,ADE,"Additionally, we found that JUNV-induced apoptosis was enhanced by RIG-I signaling.",0.08900921185558952,junv,interleukin
184,yuqc6dk0,14168,ADE,"However, compared to conventional vaccines, DNA vaccines usually induce poor antibody responses.",0.08899245835753136,antibody responses,antibody dependent enhancement (ADE)
185,hmy9n7m9,37351,ADE,The serum cytokine profile during acute infection indicated a significant elevation of innate immune responses.,0.08895883425457732,innate immune responses,antibody dependent enhancement (ADE)
186,w6q1x1zs,22091,ADE,"In addition, its immunomodulatory activity was also observed in mice.",0.08895157056471739,its immunomodulatory activity,immunopathology
187,rl12fwrz,37667,ADE,"The lungs of pregnant mice exhibited reduced epithelial regeneration, suggesting impaired lung repair.",0.08893554913758267,pregnant mice,immunopathology
188,2jeb1vcs,14725,ADE,"Furthermore, a strong Th1-based cellular immune response was stimulated by both DNA vaccines.",0.08892335721594039,cellular immune response,antibody dependent enhancement (ADE)
189,ekxq4l9a,9001,ADE,Both vaccines induced high M2e-specific humoral and cellular immune responses in the vaccinated mice.,0.08892268052374985,humoral and cellular immune responses,antibody dependent enhancement (ADE)
190,oh7usp68,11195,ADE,"Additionally, the Th1-related cytokines IL-12 (p40), TNF, and IFN-γ were significantly increased in the spleens of the BALB/c mice.",0.08888809826654087,balb / c,immunopathology
191,2uvibr2j,126,ADE,Linkers and adjuvant were added to enhance the immunogenicity response of the MEV.,0.0888766625405662,immunogenicity response,antibody dependent enhancement (ADE)
192,rc3ayjf6,31695,ADE,"The immunological hallmarks in PRRSV-infected pigs include the unusually poor production of type I interferons (IFNs-α/β) and the aberrant and delayed adaptive immune responses, indicating that PRRSV has the ability to suppress both innate and adaptive immune responses in the host.",0.08887637433181023,aberrant and delayed adaptive immune responses,antibody dependent enhancement (ADE)
193,bd2ndoug,25357,ADE,"Furthermore, affinity purified anti-RBD antibodies possessed robust neutralizing activity.",0.08887553418641451,affinity purified anti-rbd antibodies possessed robust neutralizing activity,immunopathology
194,rp5b9crv,21855,ADE," The cytokine interleukin-1 beta (IL-1β) is a potent inflammatory mediator in response to infection, and can be used as an immunological adjuvant.",0.08887530822198975,interleukin-1 beta,interleukin
195,1d17iafs,3301,ADE,"However, compared with DNA vaccines, these methods usually induce poor cellular responses.",0.08886927616057835,"dna vaccines , these methods usually induce poor cellular responses",antibody dependent enhancement (ADE)
196,jkko6erq,7703,ADE,Different vaccination routes also evoke distinct immune responses.,0.08886275693472595,different vaccination routes,antibody dependent enhancement (ADE)
197,hmloggsp,18349,ADE,"Most notably, the combination of two different expression strategies did not increase the immune response elicited.",0.08886088368953324,the combination of two different expression strategies did not increase the immune response elicited,immunopathology
198,6jg96bdr,37456,ADE,"Additionally, antigen-specific IFN-γ secretion, T-cell proliferation, cytokine expression, and a cytotoxic assay were also evaluated.",0.08885246736364824,ifn-γ,interleukin
199,w5b5yrbo,3132,ADE,"Here, we expand our investigation of the immunogenic properties of these bivalent vaccines in mice.",0.08883223219881173,bivalent vaccines,antibody dependent enhancement (ADE)
200,g15qw1ky,20303,ADE,It indicates an increase in the antigenic activity of the multivalent vaccine.,0.08882896040151941,increase in the antigenic activity,immunopathology
201,msmq91d2,11126,ADE,"We have demonstrated that those recombinant MP-12 viruses inhibit IFN-β mRNA synthesis, yet do not promote the degradation of PKR.",0.08881674408070503,ifn-β,interleukin
202,s8qh1wwl,15451,ADE,VLPs trigger a high humoral and cellular immune response due to their repetitive structures.,0.08881270866663199,cellular immune response,antibody dependent enhancement (ADE)
203,83phcmty,15960,ADE,"In contrast, bacterial treatment also resulted in a statistically significant increase in IL-10 production.",0.08880855829919407,il-10,interleukin
204,z9780v62,6973,ADE,This receptor is considered a key factor in the signaling and activation of the acquired and innate immune responses in infected patients.,0.08880554640670024,acquired and innate immune responses,antibody dependent enhancement (ADE)
205,6jg96bdr,37458,ADE,"Moreover, the immune stimulating abilities of PKA(p) were further validated in vivo, with target peptide immunized mice showing an increased cellular IFN-γ in both the lungs and spleen without causing immunopathogenesis.",0.08879181382217853,ifn-γ,interleukin
206,ytxrrslz,9991,ADE,The mutant viruses are attenuated in mice and rhesus monkeys and elicit a strong adaptive immune response.,0.08877895243316902,strong adaptive immune response,antibody dependent enhancement (ADE)
207,mx1mjdqc,30058,ADE,Topical antiviral drugs may be used for the treatment of acute FHV ocular disease.,0.08877671783113125,topical antiviral drugs may be used for the treatment of acute fhv ocular disease,immunopathology
208,v2li1bfs,20747,ADE,The activation of TLRs establishes antiviral innate immune responses and coordinates the development of long-lasting adaptive immunity in order to control viral pathogenesis.,0.08876574146245461,tlrs,interleukin
209,fs99ixgw,37446,ADE,"Furthermore, TLR activation facilitates and guides activation of adaptive immune responses through the activation of dendritic cells.",0.08875482947112784,adaptive immune responses,antibody dependent enhancement (ADE)
210,xx6imhzb,24912,ADE,This binding may be followed by the modulation of the host immune responses.,0.08875146648796026,host immune responses,antibody dependent enhancement (ADE)
211,2wl9h6fz,35434,ADE,It seems that multiple cell types and multiple processes are involved in the development of feline retrovirus-induced immunosuppression.,0.08871828203136313,multiple cell types and multiple processes are involved in the development of feline retrovirus-induced immunosuppression,antibody dependent enhancement (ADE)
212,lx6qrufs,18249,ADE,Supportive treatment is aimed at suppressing the inflammatory and detrimental immune response.,0.08870749982784745,inflammatory and detrimental immune response,antibody dependent enhancement (ADE)
213,nb6c8buz,7499,ADE,"Moreover, the combination of alum and the RNA adjuvant synergistically induced humoral and cellular immune responses and endowed long-term immunity.",0.08870653491843106,humoral and cellular immune responses,antibody dependent enhancement (ADE)
214,obm13pbg,33628,ADE,We noticed significant variations of the immunogenicity of each peptide between the two antigen delivery systems.,0.08870638997275761,significant variations of the immunogenicity of each peptide between the two antigen delivery systems,immunopathology
215,af8ofuwo,5930,ADE,Antibody response of the RSV F DNA vaccine showed a strong Th1 response.,0.08870483347708318,th1,interleukin
216,grz0fe9l,31241,ADE,"The titers of the virus increased gradually during serial passage, but the replication capacity decreased in chickens.",0.08870433334207575,"the titers of the virus increased gradually during serial passage , but the replication capacity decreased in chickens",immunopathology
217,fbotc479,4245,ADE,"As a result, antigen-specific immune responses are greatly enhanced and are likely due to increased DNA uptake and antigen expression.",0.08870432233851155,antigen-specific immune responses,antibody dependent enhancement (ADE)
218,zu0ubwfq,7841,ADE,PRRSV strongly modulates the host’s immune responses.,0.0886934967147612,prrsv strongly modulates the host ’ s immune responses,antibody dependent enhancement (ADE)
219,y4t84phi,8696,ADE,"Importantly, aged animals displayed increased eosinophilic immune pathology in the lungs and were not protected against significant virus replication.",0.08869215947756562,increased eosinophilic immune pathology,immunopathology
220,02c9knga,23752,ADE,The results indicate that the kinetics of the G- and F-specific antibody responses differ.,0.08868939293419076,g-and f-specific antibody responses,antibody dependent enhancement (ADE)
221,w2bt9tnw,13925,ADE,"The high humoral immune responses (virus specific antibody) and cellular immune responses (IFN-γ, IL-4, and spleen lymphocyte proliferation) were evaluated.",0.08868005313203536,high humoral immune responses ( virus specific antibody ) and cellular immune responses,antibody dependent enhancement (ADE)
222,vq72zw0n,4183,ADE,"Hence, mucosal vaccination may suppress the immune system instead of induce a protective immune response.",0.08867813997384189,protective immune response,antibody dependent enhancement (ADE)
223,0lsobcnl,16878,ADE,Their activation can elicit a strong humoral and cellular immune response as well as mucosal immunity.,0.08865334723834067,humoral and cellular immune response,antibody dependent enhancement (ADE)
224,8oki8xr2,5987,ADE,Live virus vaccines can be improved by adding adjuvants to boost mucosal innate and adaptive responses.,0.08865274741174177,mucosal innate and adaptive responses,antibody dependent enhancement (ADE)
225,49ei5k78,17778,ADE,Other therapeutic strategies including immunotherapy and the use of oligonucleotides have also been explored.,0.08864589857149258,immunotherapy,immunopathology
226,1d0olfki,20736,ADE, Interferon-induced antiviral genes are crucial players in innate antiviral defense and potential determinants of immune response heterogeneity.,0.08863807432926046,interferon-induced antiviral genes are crucial players in innate antiviral defense and potential determinants of immune response heterogeneity,antibody dependent enhancement (ADE)
227,97sxlkjp,19368,ADE,MSA2-specific Th-cell activation could be demonstrated.,0.08863498901398756,msa2,interleukin
228,riq8p5u0,19568,ADE,"Further analysis showed that TLR ligands induced IFN-γ, IL-1β and IFN stimulated genes viz.",0.08863279160131783,ifn-γ,interleukin
229,eph6mib8,10259,ADE,"The LBSap vaccine induced high levels of IL-12 and IL-10 expression at 12 and 24h, respectively.",0.08861757413497072,high levels of il-12 and il-10 expression,immunopathology
230,sbascdya,36997,ADE,"During pregnancy, the maternal immune response changes dramatically over the course of gestation.",0.08861234181795667,maternal immune response,antibody dependent enhancement (ADE)
231,ynef1d1t,8059,ADE,Here we explore the use of interferon-β to adjuvant the response to a rabies virus (RV) vaccine vector expressing both HIV-1 Gag and IFN-β.,0.08861040439016565,the response to a rabies virus ( rv ) vaccine vector expressing both hiv-1 gag and ifn-β,antibody dependent enhancement (ADE)
232,elhp6rx6,31175,ADE,Bacterial superinfection of virus infected lungs was not observed.,0.08860687747992238,bacterial superinfection of virus infected lungs was not observed,immunopathology
233,b0izt9hq,2847,ADE,A major advantage of DNA vaccination is the ability to induce both humoral and cellular immune responses.,0.08860417012862751,humoral and cellular immune responses,antibody dependent enhancement (ADE)
234,30k10ud4,9254,ADE,"Additionally, the BC, F, and HN proteins were modified in several ways to enhance virus replication.",0.08860163301882748,enhance virus replication,immunopathology
235,d9v2s9o4,19769,ADE,"As a result, specific immune responses increased correspondingly.",0.08859980949175286,specific immune responses,antibody dependent enhancement (ADE)
236,hhz8slxl,36898,ADE,Clinical disease and histopathological changes were more severe in the absence of type-I IFN signaling whereas the T-cell response was required for virus clearance.,0.08859553229626979,clinical disease and histopathological changes,immunopathology
237,rdf7mbx9,23439,ADE,Orally vaccinated mice produced a significant UreB-specific serum immunoglobulin G (IgG) response.,0.08859530026447579,serum immunoglobulin g ( igg ),antibody dependent enhancement (ADE)
238,bdse9o26,4015,ADE,These mice can be used to analyze the human immune response in vivo.,0.08858779011548888,human immune response,antibody dependent enhancement (ADE)
239,wzozcj6l,40159,ADE,"In pigs infected with nsp1β mutants, IFN-α production was increased in the lungs at early time points postinfection, which was correlated with increased innate NK cell function.",0.0885704805848649,ifn-α,interleukin
240,e8l9w41u,9509,ADE,VLPs can stimulate strong humoral and cellular immune responses and have been shown to exhibit self-adjuvanting abilities.,0.08856973068237528,strong humoral and cellular immune responses,antibody dependent enhancement (ADE)
241,jjluocxz,8395,ADE,VLPs can stimulate strong humoral and cellular immune responses and have been shown to exhibit self-adjuvanting abilities.,0.0885697223276378,strong humoral and cellular immune responses,antibody dependent enhancement (ADE)
242,3qyn3ka5,11388,ADE,"Collectively, these data suggest that the polysaccharide IIP-2 exhibits excellent adjuvant activity and can enhance both cellular and humoral immunity.",0.08856306678124623,cellular and humoral immunity,antibody dependent enhancement (ADE)
243,hfwxsr9y,17533,ADE,"The results showed that DNA vaccination primed a specific T-cell-mediated response, as indicated by both a lymphoproliferative response and IFN-γ production.",0.088552706129669,ifn-γ,interleukin
244,gsa3n2ci,22466,ADE,"Hence, there is an ample need for antiviral treatment and prophylaxis of norovirus infections.",0.08855246575076771,norovirus infections,immunopathology
245,c1pjt9ek,8140,ADE,Similar levels of the anti-S protein IgG response and neutralizing activity were induced by both the S protein and IV vaccines.,0.08854905176836955,anti-s protein igg response,antibody dependent enhancement (ADE)
246,3kuta9pr,36580,ADE,"Surprisingly, the lungs of these two animals did not show overt inflammatory lesions.",0.0885448729966537,overt inflammatory lesions,immunopathology
247,aw8p35c5,8369,ADE,They are attractive vaccine vectors as they induce both innate and adaptive immune responses in mammalian hosts.,0.08852848151970444,innate and adaptive immune responses,antibody dependent enhancement (ADE)
248,pukh8zqt,39849,ADE,"In PRRSV-infected pigs, innate cytokine IFN-α is inhibited and the adaptive arm of the immunity is delayed.",0.08851616356626726,ifn-α,interleukin
249,3gt3vlev,16193,ADE,"Dysregulation of the antibody response can lead to an autoimmune disease, malignancy, or enhanced infection.",0.08850833689572307,antibody response,antibody dependent enhancement (ADE)
250,bgz1h20o,3954,ADE,"Moreover, this recombinant live vaccine induced significantly high levels of specific cytotoxic T-lymphocyte activities and increased gamma interferon-producing T cells compared with the parental strain.",0.08850792241458512,gamma interferon,interleukin
251,fphwlxiq,9929,ADE,Toll-like receptor 3 (TLR3) and TLR21 are involved in early recognition of virus resulting in induction of inflammatory cytokines.,0.08850563940066539,induction of inflammatory cytokines,antibody dependent enhancement (ADE)
252,j7fpiqfj,11418,ADE,"In addition, we found that the gE/gI complex, which is absent in Bartha, inhibits the pDC TI-IFN response.",0.08849874367188951,pdc ti-ifn response,antibody dependent enhancement (ADE)
253,wdpatr2z,2890,ADE,"Interestingly, it potentiated the IgA responses in the tear and intestinal secretions when used with both live and inactivated IBV vaccines.",0.08849871513277198,iga responses,antibody dependent enhancement (ADE)
254,0yqyclxk,111,ADE,It also increased the proliferation of T-helper cells and cytotoxic T-cells along with the increased INF-γ and IL-2 cytokines.,0.08849795554779988,increased the proliferation of t-helper cells and cytotoxic t-cells along with the increased inf-γ and il-2 cytokines,immunopathology
255,cobrl3dl,29312,ADE,The T cell proliferation showed that the fusion protein could induce an antigen-specific T-cell response.,0.08849577949748166,antigen-specific t-cell response,antibody dependent enhancement (ADE)
256,2zq44poq,30090,ADE,These conditions down-regulate the synthesis of proinflammatory cytokines and impair the host's innate and humoral immune systems.,0.08849377764521317,impair the host ' s innate and humoral immune systems,antibody dependent enhancement (ADE)
257,gncmygda,39822,ADE,Vitamin D may be important for immune function.,0.0884919107584026,vitamin d,interleukin
258,ihg4kqxf,36820,ADE,"After 5 days postinfection, the innate immune gene expression was replaced by the adaptive immune response, which correlates with viral clearance.",0.08848822246298463,adaptive immune response,antibody dependent enhancement (ADE)
259,xsfg7uth,30727,ADE,They also possess remarkable pathogen-neutralizing activity in the respiratory tract and lungs.,0.08847761394574705,remarkable pathogen-neutralizing activity,immunopathology
260,4mt2v3ip,8540,ADE,": Type I interferons (IFNs) exhibit direct antiviral effects, but also distinct immunomodulatory properties.",0.08847683900297461,type i interferons,antibody dependent enhancement (ADE)
261,6mdaq868,11105,ADE,We found that the Hu-191 virus induced IFN-β much more potently than the Edmonston strain.,0.08847400742452524,ifn-β,interleukin
262,o7y3wygc,10232,ADE,"Currently, live-attenuated IBV vaccines are used to control the disease.",0.08847130220442471,"currently , live-attenuated ibv vaccines are used to control the disease",immunopathology
263,k85v6nac,7929,ADE,"Simultaneously, this vaccine induces potent polyfunctional effector CD4 and CD8 T cell memory responses.",0.08847007745737465,cd4 and cd8 t cell memory responses,antibody dependent enhancement (ADE)
264,jr9hj0bs,22500,ADE,Adjuvants enhance the efficacy of vaccines by stimulating immune response-related gene expression and pathways.,0.08846471232582295,gene expression and pathways,antibody dependent enhancement (ADE)
265,rvwuk7tx,35599,ADE,"However, we recently showed that inefficient immune activation and a poor virus-specific T cell response underlie severe disease in SARS-CoV-infected mice.",0.08846460890971741,inefficient immune activation and a poor virus-specific t cell response underlie severe disease,immunopathology
266,8f6gpdy2,17461,ADE,"In contrast, inhibition of sodium channels or activation of PKC leads to enhanced virus production in tissue culture.",0.08845609392010143,inhibition of sodium channels or activation of pkc leads to enhanced virus production,immunopathology
267,eq4obbte,7833,ADE,"In contrast, the UQ tag was utilized for enhancing CD8+ response.",0.08845457806154282,cd8 + response,antibody dependent enhancement (ADE)
268,nb6c8buz,7494,ADE,"However, use of alum triggers a Th2-biased immune induction, and hence is not optimal.",0.08844976585731383,is not optimal,immunopathology
269,2ljbsia2,8400,ADE,These stable and versatile subviral particles possess excellent adjuvant properties capable of inducing innate and cognate immune responses.,0.08844878661128884,innate and cognate immune responses,antibody dependent enhancement (ADE)
270,1tuf4zxi,37299,ADE,"Most notably, it is used in combination with interferon-α for treatment of HCV infection [66].",0.0884469572498229,interferon-α,antibody dependent enhancement (ADE)
271,fgwxguoj,26519,ADE,"They can also regulate immune responses, to avoid autoreactivity and excessive inflammation.",0.08844673927825927,excessive inflammation,immunopathology
272,z9780v62,6974,ADE,Using potent antigens in combination with strong adjuvants may effectively trigger the activation of specific MERS-CoV cellular responses as well as the production of neutralizing antibodies.,0.08844646988538313,specific mers-cov cellular responses,antibody dependent enhancement (ADE)
273,cgiok0ce,4692,ADE,The PRRSV infects primarily the lung macrophages.,0.08844631483201087,macrophages,antibody dependent enhancement (ADE)
274,j9qucb0k,4666,ADE,"Only the adenovirus induced envelope-specific antibody responses, but these failed to show neutralizing activity.",0.08844441049954169,envelope-specific antibody responses,antibody dependent enhancement (ADE)
275,kv9n2qj3,23739,ADE,There are many options for the development of MERS-CoV-specific therapies.,0.0884309291812435,therapies,immunopathology
276,z86rjwle,28337,ADE,"Currently, no antiviral therapy or vaccine is available for the treatment of hantavirus-associated diseases.",0.08842571650760506,no antiviral therapy or vaccine is available for the treatment of hantavirus-associated diseases,immunopathology
277,vugnc7jk,38323,ADE,It was also found that the bacterial growth inhibition was complement independent.,0.08842498521101817,bacterial growth inhibition,interleukin
278,tjwkouya,2071,ADE,These vaccines have been shown to induce a protective immune response and to be very effective.,0.08841805164656469,protective immune response,antibody dependent enhancement (ADE)
279,77gd3myj,17431,ADE,"Likewise, there were no differences in neutrophil activation between mice groups.",0.08841367215177794,neutrophil,interleukin
280,b8sbvy0g,13553,ADE,"Adjuvants are used to enhance and modulate antigen (Ag) immunogenicity, aiming to induce a protective and long-lasting immune response.",0.08840629748117931,protective and long-lasting immune response,antibody dependent enhancement (ADE)
281,wzozcj6l,40166,ADE,Mutations introduced into these two residues attenuated virus growth and improved the innate and adaptive immune responses of infected animals.,0.08840058357676345,innate and adaptive immune responses,antibody dependent enhancement (ADE)
282,21irqpxj,9012,ADE,They had the ability to stimulate the humoral and cell-mediated immune system.,0.08839711775100068,humoral and cell-mediated immune system,antibody dependent enhancement (ADE)
283,k10siwur,36629,ADE,"However, the resulting chimeras induced a marginal TGEV-neutralizing antibody (Ab) response in mice.",0.08838927850718667,tgev-neutralizing antibody,antibody dependent enhancement (ADE)
